username;date;retweets;favorites;text;geo;mentions;hashtags;id;permalink
BarackObama;2008/03/04;1;6;"In Texas getting out the vote! Tell friends in Ohio, Rhode Island, Texas & Vermont to vote today. More info at: http://barackobama.com";;;;"766633421";https://twitter.com/BarackObama/status/766633421
BarackObama;2008/03/01;2;3;"Just left a rally in Providence, RI & heading to Parma, OH for a Town Hall. Remind all your friends in OH, RI, TX & VT to vote this Tuesday.";;;;"765466611";https://twitter.com/BarackObama/status/765466611
BarackObama;2008/02/26;1;3;"Heading to Cleveland State University for tonight's debate. Watch it live at 9pm ET on MSNBC or streamed at http://cleveland.com.";;;;"762528142";https://twitter.com/BarackObama/status/762528142
BarackObama;2008/02/21;1;3;"Excited to learn about winning the Dems Abroad primary today. Getting ready for the Texas debate. It will be live tonight at 8pm ET on CNN.";;;;"741427672";https://twitter.com/BarackObama/status/741427672
BarackObama;2008/02/19;4;6;"Is encouraging everyone to tell friends in Wisconsin to vote until 8pm tonight. And tell friends in Hawaii to get to their caucus by 6:30pm!";;;;"731617452";https://twitter.com/BarackObama/status/731617452
BarackObama;2008/02/12;1;2;"Encouraging everyone in DC, MD and VA to vote today. Heading to Madison, WI for a Rally for Change event at the Kohl Center (6:15pm tonight)";;;;"705222042";https://twitter.com/BarackObama/status/705222042
BarackObama;2008/02/09;1;2;"in Virginia, speaking at VA Democratic Party Jefferson-Jackson Dinner. Watch his speech live on CNN.";;;;"695142052";https://twitter.com/BarackObama/status/695142052
BarackObama;2008/02/05;1;3;"Yes We Can! Please tell all your friends in the Feb 5th States to vote today. To find polling info visit: http://my.barackobama.com/polling";;;;"681105812";https://twitter.com/BarackObama/status/681105812
BarackObama;2008/02/04;1;1;"In Hartford, CT, East Rutherford, NJ, and Boston, MA at Stand for Change Rallies. For info visit http://barackobama.com.";;;;"676670602";https://twitter.com/BarackObama/status/676670602
BarackObama;2008/01/31;1;2;"In California, heading to the last debate before Super Tuesday. Watch it tonight at 8pm ET/5pm PT on CNN. Text your thoughts to 62262 after.";;;;"664157292";https://twitter.com/BarackObama/status/664157292
BarackObama;2008/01/28;1;2;"In Washington, DC at the State of the Union. To watch my response visit http://youtube.com/barackobama";;;;"653512022";https://twitter.com/BarackObama/status/653512022
BarackObama;2008/01/24;1;1;"In North Charleston,SC at a "Stand for Change" rally. Watch Letterman's Top 10 tonight. The Late Show is on CBS at 11:35pm ET/PT.";;;;"638640682";https://twitter.com/BarackObama/status/638640682
BarackObama;2008/01/23;2;1;"Meeting folks in South Carolina today. Excited to have received Columbia's The State, Rock Hill Herald & Greenville News endorsements.";;;;"634197232";https://twitter.com/BarackObama/status/634197232
BarackObama;2008/01/22;1;1;"At "Stand for Change" events across South Carolina this week. Visit http://sc.barackobama.com for more info.";;;;"629910042";https://twitter.com/BarackObama/status/629910042
BarackObama;2008/01/21;1;1;"In Myrtle Beach heading to tonight's debate at 8pm on CNN. Please visit http://barackobama.com to watch my speech from Dr. King's church.";;;;"625659282";https://twitter.com/BarackObama/status/625659282
BarackObama;2008/01/19;1;3;"In Las Vegas, Nevada. Fired Up & Ready to Go!";;;;"617583502";https://twitter.com/BarackObama/status/617583502
BarackObama;2008/01/15;1;1;"In Las Vegas, heading to Nevada Democratic Party/MSNBC Debate. Watch it live at 9pm ET on MSNBC. Text your thoughts to 62262 after.";;;;"603356882";https://twitter.com/BarackObama/status/603356882
BarackObama;2008/01/13;1;1;"In Pahrump, NV at a Stand for Change Rally. Heading to Reno, Fallon & Carson City tomorrow. For info visit http://nevada.barackobama.com";;;;"595984802";https://twitter.com/BarackObama/status/595984802
BarackObama;2008/01/10;0;4;"In Charleston, SC at a "Rally for Change" event at the College of Charleston. Yes, we can!";;;;"584310612";https://twitter.com/BarackObama/status/584310612
BarackObama;2008/01/05;1;1;"In Manchester, NH - heading to the ABC Facebook Debate. Watch it live on your ABC station at 9pm ET. Text your thoughts to 62262 after.";;;;"566675722";https://twitter.com/BarackObama/status/566675722
BarackObama;2008/01/03;13;50;"is Fired Up!.. And Ready to Go!";;;;"560004652";https://twitter.com/BarackObama/status/560004652
BarackObama;2007/12/29;1;1;"Will be on NBC's Meet the Press tomorrow live from Des Moines, IA. To find your local air times visit: http://www.msnbc.msn.com/id/3080248/";;;;"545563542";https://twitter.com/BarackObama/status/545563542
BarackObama;2007/12/26;1;2;"In Iowa this week. Campaigning today in Mason City, Webster City, Fort Dodge, and Carroll. More info at http://iowa.barackobama.com";;;;"536277242";https://twitter.com/BarackObama/status/536277242
BarackObama;2007/12/20;1;1;"In New Hampshire -holding events at 5pm at the Frank Jones Center in Portsmouth and 7pm at the American Legion Post No. 7 in Rochester.";;;;"518843182";https://twitter.com/BarackObama/status/518843182
BarackObama;2007/12/19;1;1;"In New Hampshire - meeting people at 5pm at the Radisson Manchester & 7pm at Elm Street Middle School in Nashua. http://nh.barackobama.com";;;;"515167272";https://twitter.com/BarackObama/status/515167272
BarackObama;2007/12/17;1;2;"In Iowa - campaigning in Spencer, Storm Lake, Cherokee, Le Mars, and Sioux City. More info at http://iowa.barackobama.com";;;;"509301172";https://twitter.com/BarackObama/status/509301172
BarackObama;2007/12/16;3;2;"In Iowa - travelling to Algona, Emmetsburg, Estherville, and Spirit Lake. More info at http://iowa.barackobama.com";;;;"506668022";https://twitter.com/BarackObama/status/506668022
BarackObama;2007/12/13;1;1;"In Iowa and heading to DSM Register debate, the last one before the Iowa Caucuses. Watch at 2pm ET on CNN, C-SPAN3 & http://www.iptv.org.";;;;"497832212";https://twitter.com/BarackObama/status/497832212
BarackObama;2007/12/09;1;3;"In Columbia, SC with Oprah - watch the webcast live now at http://my.barackobama.com/page/content/oprahwebcast";;;;"484078152";https://twitter.com/BarackObama/status/484078152
BarackObama;2007/12/07;1;4;"In Chicago, heading to Change Rocks Concert with Macy Gray, Jeff Tweedy, Stephan Jenkins & Jill Sobule http://my.barackobama.com/gochicago";;;;"479580172";https://twitter.com/BarackObama/status/479580172
BarackObama;2007/12/04;1;2;"In Iowa and heading to today's NPR/Iowa Public Radio Presidential Debate. Watch it live at 2pm ET by visiting http://www.npr.org";;;;"469126222";https://twitter.com/BarackObama/status/469126222
BarackObama;2007/12/01;1;1;"In Iowa at two presidential forums today: The Heartland Forum at 3:30pm ET on C-SPAN & The Brown & Black Forum at 8pm ET on HDNet.";;;;"461041512";https://twitter.com/BarackObama/status/461041512
BarackObama;2007/11/27;1;1;"In Portsmouth, NH holding a foreign policy forum. Watch it live stream at http://my.barackobama.com/page/content/fpforum";;;;"448528472";https://twitter.com/BarackObama/status/448528472
BarackObama;2007/11/15;1;1;"In Las Vegas, NV for the presidential debate. It will be broadcast live tonight at 8pm ET on CNN. Txt your thoughts throughout to 62262.";;;;"417913262";https://twitter.com/BarackObama/status/417913262
BarackObama;2007/11/14;7;11;"At Google's Town Hall in Mountain View,CA Speaking about the need for network neutrality!";;;;"415162962";https://twitter.com/BarackObama/status/415162962
BarackObama;2007/11/07;5;3;"In Iowa this week. Just announced plan today to "Reclaim the American Dream" Learn more about the plan at http://my.barackobama.com/dream";;;;"396941082";https://twitter.com/BarackObama/status/396941082
BarackObama;2007/10/29;1;3;"In Cedar Rapids, IA at Coe College for the MySpace MTV Presidential Dialogue. It will stream live at 1:30pm ET www.myspace.com/election2008";;;;"372864392";https://twitter.com/BarackObama/status/372864392
BarackObama;2007/10/23;2;4;"In Boston with Governor Deval Patrick for a rally starting at 5:30PM at Parkman Bandstand on Boston Common http://my.barackobama.com/bos";;;;"358041612";https://twitter.com/BarackObama/status/358041612
BarackObama;2007/10/18;1;2;"In Nevada today and excited to be on the Tavis Smiley Show tonight on PBS. Check your listings for what time it airs locally.";;;;"346029382";https://twitter.com/BarackObama/status/346029382
BarackObama;2007/10/17;1;4;"In Los Angeles, CA. Going to be on NBC's Tonight Show with Jay Leno tonight. Check local listings for exact time.";;;;"343509982";https://twitter.com/BarackObama/status/343509982
BarackObama;2007/10/08;1;2;"In Portsmouth, NH -just announced a visionary plan to make America a global leader on energy. For details visit www.barackobama.com/speeches";;;;"321156922";https://twitter.com/BarackObama/status/321156922
BarackObama;2007/10/02;4;3;"In Chicago, at DePaul University speaking about the need to eliminate the world's nuclear weapons. Watch live now http://www.cnn.com/video";;;;"307408422";https://twitter.com/BarackObama/status/307408422
BarackObama;2007/09/27;1;1;"At rally in Washington Square Park, NYC - Watch full event live now at http://www.barackobama.com/nyc";;;;"297529302";https://twitter.com/BarackObama/status/297529302
BarackObama;2007/09/26;1;1;"At Dartmouth College at the DNC debate. It airs live from 9-11pm ET on MSNBC text your thoughts on the debate to 62262.";;;;"295555602";https://twitter.com/BarackObama/status/295555602
BarackObama;2007/09/20;1;3;"In Atlanta: had a great event with Usher and Dominique Wilkins. Fired Up!";;;;"282953412";https://twitter.com/BarackObama/status/282953412
BarackObama;2007/09/18;1;1;"In Washington DC, talking about reforming America’s tax code so that it works for the middle class. Visit www.barackobama.com for details.";;;;"276831892";https://twitter.com/BarackObama/status/276831892
BarackObama;2007/09/11;4;2;"Giving a major Iraq policy speech tomorrow in Iowa and will also be live on the Today Show tomorrow morning at 7:00am.";;;;"262432362";https://twitter.com/BarackObama/status/262432362
BarackObama;2007/09/05;1;1;"Speaking at town halls in Sac City and Storm Lake, Iowa today. Heading to Nevada tomorrow.";;;;"249809452";https://twitter.com/BarackObama/status/249809452
BarackObama;2007/08/29;3;2;"Thinking on this 2nd anniversary of Katrina that New Orleans should become an example of what America can do when we come together.";;;;"235503102";https://twitter.com/BarackObama/status/235503102
BarackObama;2007/08/22;1;3;"In New York - heading to The Daily Show with Jon Stewart. Be sure to watch it on Comedy Central tonight.";;;;"220886672";https://twitter.com/BarackObama/status/220886672
BarackObama;2007/08/17;1;1;"In Tama, IA for a Rural Policy Summit @ South Tama County High School. Heading to Cedar Rapids and Waverly tomorrow.";;@;;"211537812";https://twitter.com/BarackObama/status/211537812
BarackObama;2007/08/16;1;2;"In Iowa this week and heading to the Iowa State Fair later this afternoon- Visit http://iowa.barackobama.com/roadtochange for full schedule.";;;;"209493312";https://twitter.com/BarackObama/status/209493312
BarackObama;2007/08/07;3;1;"In Chicago - heading to the AFL-CIO Presidential Forum. It is on MSNBC tonight live at 7pm EDT, moderated by Keith Olbermann.";;;;"192555492";https://twitter.com/BarackObama/status/192555492
BarackObama;2007/07/26;1;1;"Addressing the College Democrats of America at their national convention in Columbia, SC.";;;;"170096102";https://twitter.com/BarackObama/status/170096102
BarackObama;2007/07/19;12;23;"Enjoying an ice cream social with residents of Sunapee, New Hampshire.";;;;"158199002";https://twitter.com/BarackObama/status/158199002
BarackObama;2007/07/16;1;3;"In Chicago, walking picket line with hotel workers at the Congress Hotel. For more info visit http://www.congresshotelstrike.info";;;;"152903462";https://twitter.com/BarackObama/status/152903462
BarackObama;2007/07/09;2;2;"Heading to Alabama for the Birmingham kick-off rally.";;;;"141791322";https://twitter.com/BarackObama/status/141791322
BarackObama;2007/06/28;1;1;"In DC heading to Howard University for the presidential debate @ 9pm EDT on PBS stations. Txt your thoughts on the debate to OBAMA (62262)";;@;;"125365592";https://twitter.com/BarackObama/status/125365592
BarackObama;2007/06/26;1;1;"In DC: Asking you to share what inspires you on the front page of www.barackobama.com";;;;"121928412";https://twitter.com/BarackObama/status/121928412
BarackObama;2007/06/19;28;19;"Launching Obama Mobile text messaging; text 'GO' to OBAMA (62262) to get a free bumper sticker.";;;;"112224892";https://twitter.com/BarackObama/status/112224892
BarackObama;2007/06/15;1;2;"Traveling to Jackson, Mississippi - excited after rallying with over 3500 supporters in Greenville, South Carolina.";;;;"106484782";https://twitter.com/BarackObama/status/106484782
BarackObama;2007/06/13;1;1;"Being featured on YouTube "Candidate Spotlight" asking how can we make this country better?";;;;"103634902";https://twitter.com/BarackObama/status/103634902
BarackObama;2007/06/08;1;2;"Preparing for our big "Walk for Change" national canvass - Heading to Dubuque, Iowa for tomorrow's walk.";;;;"96637982";https://twitter.com/BarackObama/status/96637982
BarackObama;2007/06/03;1;1;"Heading to Democratic presidential debate at St. Anselm College in New Hampshire. Debate starts at 7pm EST and will air live on CNN.";;;;"89585682";https://twitter.com/BarackObama/status/89585682
BarackObama;2007/05/31;5;7;"Looking forward to watching Michelle's interview on NBC nightly news tonight.";;;;"85862772";https://twitter.com/BarackObama/status/85862772
BarackObama;2007/05/29;45;29;"At the University of Iowa envisioning affordable universal healthcare by end of first term.";;;;"82737212";https://twitter.com/BarackObama/status/82737212
BarackObama;2007/05/24;30;19;"In DC voting No... "We should not give the President a blank check to continue down this same, disastrous path.”";;;;"77263482";https://twitter.com/BarackObama/status/77263482
BarackObama;2007/05/19;4;8;"Speaking at Southern New Hampshire University Commencement";;;;"70349392";https://twitter.com/BarackObama/status/70349392
BarackObama;2007/05/16;17;22;"Thinking the President’s word is not the last word on Iraq.";;;;"66208452";https://twitter.com/BarackObama/status/66208452
BarackObama;2007/05/14;2;4;"In Trenton, NJ at AFL-CIO Town Hall Meeting";;;;"63909652";https://twitter.com/BarackObama/status/63909652
BarackObama;2007/05/10;14;14;"In Indianola, Iowa and heading to Des Moines";;;;"59358952";https://twitter.com/BarackObama/status/59358952
BarackObama;2007/05/08;4;8;"Thinking we can cut oil consumption by 2.5 million barrels of oil per day and take 50 million cars’ worth of pollution off the road by 2020";;;;"55928192";https://twitter.com/BarackObama/status/55928192
BarackObama;2007/05/07;6;4;"At the Detroit Economic Club – Talking about the need to reduce our dependence on foreign oil.";;;;"53427172";https://twitter.com/BarackObama/status/53427172
BarackObama;2007/05/01;269;240;"Wondering why, four years after President Bush landed on an aircraft carrier and declared ‘Mission Accomplished,’ we are still at war?";;;;"46195712";https://twitter.com/BarackObama/status/46195712
BarackObama;2007/04/29;786;429;"Thinking we're only one signature away from ending the war in Iraq. Learn more at http://www.barackobama.com";;;;"44240662";https://twitter.com/BarackObama/status/44240662
