username;date;retweets;favorites;text;geo;mentions;hashtags;id;permalink
;2010/10/05;510;46;"Voter registration deadlines are coming up. Visit http://RaiseYourVote.com to find out how to register in your state (via @TheDemocrats).";;@TheDemocrats;;"26481360289";https://twitter.com/BarackObama/status/26481360289
;2010/10/05;269;46;"Speaking about the critical role of community colleges in America. Watch live at 12:15pm ET. http://wh.gov/live";;;;"26469527258";https://twitter.com/BarackObama/status/26469527258
;2010/10/05;151;34;"RT @Energy: Have questions about energy efficiency? Get an answer directly from Secretary Chu. Details: http://bit.ly/c1jBcp";;@Energy;;"26465206652";https://twitter.com/BarackObama/status/26465206652
;2010/10/02;872;142;"We’re putting Americans to work producing clean energy that will lower our reliance on foreign oil and protect our planet. http://j.mp/dk-X";;;;"26200313724";https://twitter.com/BarackObama/status/26200313724
;2010/10/01;185;49;"This West Wing Week, watch the signing of the Small-Business Jobs Act and a conference call with college journalists. http://OFA.BO/uL94nM";;;;"26115997007";https://twitter.com/BarackObama/status/26115997007
;2010/10/01;63;19;"#FF: @TheDemocrats, @TimKaine, @dccc, @dscc";;@TheDemocrats @TimKaine @dccc @dscc;#FF;"26092710790";https://twitter.com/BarackObama/status/26092710790
;2010/10/01;305;43;"Making a personnel announcement this morning. Watch live at 11:05am ET: http://j.mp/au6oam";;;;"26087018153";https://twitter.com/BarackObama/status/26087018153
;2010/10/01;165;33;"#FF: @whitehouse, @OpenGov, @StateDept, @whitehouseostp";;@whitehouse @OpenGov @StateDept @whitehouseostp;#FF;"26083003684";https://twitter.com/BarackObama/status/26083003684
;2010/09/30;127;28;"Tonight is a critical deadline, and your grassroots donations will help @TheDemocrats in tight races across the country: http://j.mp/busZLS.";;@TheDemocrats;;"26019851558";https://twitter.com/BarackObama/status/26019851558
;2010/09/29;187;51;"Holding a discussion on the economy with families in Richmond, VA. Listen live at 3:35pm ET: http://wh.gov/live.";;;;"25910802821";https://twitter.com/BarackObama/status/25910802821
;2010/09/28;1804;194;"The other side is counting on you staying home this Nov. They’re counting on your silence. They are betting on your apathy. Prove them wrong";;;;"25833933676";https://twitter.com/BarackObama/status/25833933676
;2010/09/28;869;71;"If everyone who fought for change shows up to vote in Nov., I am absolutely confident that we will win. Commit to vote: http://j.mp/9qIFPF";;;;"25832176485";https://twitter.com/BarackObama/status/25832176485
;2010/09/28;192;33;"Getting ready to go on stage. Follow @TheDemocrats for live tweets from the rally in Madison. Watch live: http://j.mp/b6-sc.";;@TheDemocrats;;"25828482783";https://twitter.com/BarackObama/status/25828482783
;2010/09/28;159;31;"About to address @OFA_WI supporters at the Moving America Forward rally the University of Wisconsin. Watch live: http://j.mp/b6-sc";;@OFA_WI;;"25827989786";https://twitter.com/BarackObama/status/25827989786
;2010/09/28;271;55;"Ben Harper is firing up the crowd here on Library Mall in Madison. Watch live: http://j.mp/b6-sc.";;;;"25826963923";https://twitter.com/BarackObama/status/25826963923
;2010/09/28;240;40;"Heading to Madison, WI, for a special organizing rally with @OFA_WI supporters.";;@OFA_WI;;"25811070906";https://twitter.com/BarackObama/status/25811070906
;2010/09/27;437;92;"I want to thank all @TheDemocrats who worked so hard to get the Small Business Jobs Act passed.";;@TheDemocrats;;"25721685698";https://twitter.com/BarackObama/status/25721685698
;2010/09/27;789;92;"Small Business Jobs Act will cut taxes and make more loans available for small business. It’s a great victory for America’s entrepreneurs.";;;;"25720965047";https://twitter.com/BarackObama/status/25720965047
;2010/09/27;404;52;"Signing the Small Business Jobs Act into law at 1:45pm ET. Watch live: http://wh.gov/live.";;;;"25706339595";https://twitter.com/BarackObama/status/25706339595
;2010/09/25;1208;146;"The new GOP agenda isn't a prescription for a better future. It’s an echo of a disastrous decade we can’t afford to relive. http://OFA.BO/wk";;;;"25528330192";https://twitter.com/BarackObama/status/25528330192
;2010/09/24;208;49;"Joining @OFA_WI in Madison on Tuesday for a Moving America Forward organizing rally. http://j.mp/cPLirz";;@OFA_WI;;"25436391420";https://twitter.com/BarackObama/status/25436391420
;2010/09/24;236;34;"#FF @TheDemocrats, @whitehouse, @timkaine, and @HouseDemocrats";;@TheDemocrats @whitehouse @timkaine @HouseDemocrats;#FF;"25419843650";https://twitter.com/BarackObama/status/25419843650
;2010/09/24;183;33;"Go behind the scenes as Elizabeth Warren is named to lead the launch of the Consumer Financial Protection Bureau. http://OFA.BO/KRMfsX";;;;"25415308793";https://twitter.com/BarackObama/status/25415308793
;2010/09/23;922;93;"The small-business jobs bill passed today will provide loans and cut taxes for millions of small businesses without adding to our deficit.";;;;"25343574744";https://twitter.com/BarackObama/status/25343574744
;2010/09/23;180;34;"Introducing the First Lady at the Clinton Global Initiative Annual Meeting. Watch live at 4pm ET. http://bit.ly/cgilive";;;;"25336572659";https://twitter.com/BarackObama/status/25336572659
;2010/09/22;628;95;"The United States will do our part—we will be a global leader in international development in the 21st century.";;;;"25260681959";https://twitter.com/BarackObama/status/25260681959
;2010/09/22;256;58;"The new Democrats.org makes it easier than ever to find and support @TheDemocrats in your state and your community. http://j.mp/avTA1o";;@TheDemocrats;;"25238258836";https://twitter.com/BarackObama/status/25238258836
;2010/09/22;267;41;"Speaking in Falls Church, VA, on the new health reform benefits that go into effect tomorrow. Listen live at 11:45am ET. http://wh.gov/live";;;;"25221534125";https://twitter.com/BarackObama/status/25221534125
;2010/09/21;417;87;"Our history as @TheDemocrats is the history of change that matters for America. http://j.mp/aC2vpa";;@TheDemocrats;;"25168348493";https://twitter.com/BarackObama/status/25168348493
;2010/09/21;609;100;"Each time we’ve made epic change, it's come from the grassroots rallying around a cause. That's what we need again. http://j.mp/d0aYah";;;;"25134964507";https://twitter.com/BarackObama/status/25134964507
;2010/09/20;266;50;"Holding a town hall discussion on jobs in Washington. Listen live at 12pm ET. http://wh.gov/live";;;;"25036432975";https://twitter.com/BarackObama/status/25036432975
;2010/09/18;724;140;"It’s up to all of us to defend that most basic American principle of a government of, by, and for the people. http://j.mp/cfDbnQ";;;;"24871504367";https://twitter.com/BarackObama/status/24871504367
;2010/09/17;196;45;"This West Wing Week: a wreath-laying ceremony at the Pentagon 9/11 memorial and kicking off the new school year. http://j.mp/deXhtB";;;;"24788466521";https://twitter.com/BarackObama/status/24788466521
;2010/09/17;549;67;"Elizabeth Warren understands what I strongly believe—that a strong, growing economy begins with a strong and thriving middle class.";;;;"24783024759";https://twitter.com/BarackObama/status/24783024759
;2010/09/17;441;75;"Our nation’s success depends on strengthening America’s role as the world’s engine of discovery and innovation. http://j.mp/b4cLhQ";;;;"24779797843";https://twitter.com/BarackObama/status/24779797843
;2010/09/17;686;103;"We are not about to allow a corporate takeover of our democracy. http://j.mp/ddUHxy";;;;"24771916250";https://twitter.com/BarackObama/status/24771916250
;2010/09/16;298;59;"Announcing the expansion of the Educate to Innovate initiative live from the White House. Watch at 3:25pm ET. http://wh.gov/live";;;;"24690092042";https://twitter.com/BarackObama/status/24690092042
;2010/09/16;1150;112;"Extending tax cuts for the middle class is right, it is just, and it will help our economy.";;;;"24662366052";https://twitter.com/BarackObama/status/24662366052
;2010/09/14;4035;592;"Education is about more than getting into college or getting a good job. It’s about giving each of us the chance to fulfill our promise.";;;;"24513285451";https://twitter.com/BarackObama/status/24513285451
;2010/09/14;367;65;"Speaking to students across the country as they mark the beginning of a school year. Watch live at 1pm ET. http://wh.gov/live";;;;"24491786779";https://twitter.com/BarackObama/status/24491786779
;2010/09/13;239;65;"Hosting a backyard discussion about the economy with small-business owners and neighbors in Fairfax, VA. Watch at 2pm ET. http://j.mp/UT2FE";;;;"24402811737";https://twitter.com/BarackObama/status/24402811737
;2010/09/11;1799;167;"For our nation, this is a day of remembrance, a day of reflection, and -- with God’s grace -- a day of unity and renewal.";;;;"24213513992";https://twitter.com/BarackObama/status/24213513992
;2010/09/11;4437;256;"Today we grieve for those we’ve lost, honor those who have sacrificed, and do our best to live up to the values we share. http://j.mp/b1I2Ql";;;;"24201680241";https://twitter.com/BarackObama/status/24201680241
;2010/09/11;903;98;"Delivering remarks at the Pentagon Memorial on this anniversary of the September 11 attacks. Watch live at 9:30am ET. http://wh.gov/live";;;;"24193693889";https://twitter.com/BarackObama/status/24193693889
;2010/09/10;185;49;"Take a behind-the-scenes look at Labor Day in Milwaukee and a trip to Cleveland to outline plans to grow the economy. http://j.mp/d6jNq9";;;;"24134006328";https://twitter.com/BarackObama/status/24134006328
;2010/09/10;147;36;"In the weeks leading up to November 2, OFA is organizing rallies across the country and a town hall webcast. http://j.mp/aaGBd5";;;;"24127095117";https://twitter.com/BarackObama/status/24127095117
;2010/09/10;273;44;"#FF @HHSGov, who launched CuidadoDeSalud.gov, the first website of its kind in Spanish to help consumers take control of their health care.";;@HHSGov;#FF;"24120692150";https://twitter.com/BarackObama/status/24120692150
;2010/09/10;334;37;"Speaking to the press at 11am ET. Watch live at http://j.mp/au6oam.";;;;"24110871279";https://twitter.com/BarackObama/status/24110871279
;2010/09/09;205;55;"OFA is using technology to make it easier than ever to talk to voters in your community: http://j.mp/cLuPZP.";;;;"24043402075";https://twitter.com/BarackObama/status/24043402075
;2010/09/09;9624;621;"Burning a Quran is contrary to our values—this country was built on the notions of religious freedom and tolerance.";;;;"24032192946";https://twitter.com/BarackObama/status/24032192946
;2010/09/09;303;44;". @DemocratsDotOrg believe in a vibrant free market, but one that works for everybody. That's our vision for a stronger economy.";;@DemocratsDotOrg;;"24030560185";https://twitter.com/BarackObama/status/24030560185
;2010/09/09;182;38;"RT @HealthCareGov: Check out CuidadodeSalud.Gov, a new Spanish-language website connecting consumers with coverage http://bit.ly/8Yik3y";;@HealthCareGov;;"24029536301";https://twitter.com/BarackObama/status/24029536301
;2010/09/09;564;99;"Part of moving forward is returning to values that built this country—responsibility for ourselves and for one another. http://j.mp/cNpOWw";;;;"24023273322";https://twitter.com/BarackObama/status/24023273322
;2010/09/08;1984;267;"I don’t believe we can have a strong and growing economy without a strong and growing middle class.";;;;"23945723460";https://twitter.com/BarackObama/status/23945723460
;2010/09/08;268;29;"In Cleveland to speak about the economy and to discuss proposals to keep the economy growing. Watch live at 2:10pm ET. http://wh.gov/live";;;;"23935507416";https://twitter.com/BarackObama/status/23935507416
;2010/09/07;222;42;"David Plouffe lays out what's ahead in the final 56 days before the November elections—and how you can make a difference. http://j.mp/dbe0IQ";;;;"23858830180";https://twitter.com/BarackObama/status/23858830180
;2010/09/07;1152;120;"Michelle and I wish all who celebrate Rosh Hashanah a sweet year full of health and prosperity.";;;;"23268154790";https://twitter.com/BarackObama/status/23268154790
;2010/09/06;840;118;"Announcing a plan to modernize America’s roads, rails, and runways—creating jobs now and making our economy better over the long haul.";;;;"23176893207";https://twitter.com/BarackObama/status/23176893207
;2010/09/06;1245;141;"This Labor Day, know that I’m going to keep fighting to turn this economy around, put our people back to work, and renew the American Dream.";;;;"23173697869";https://twitter.com/BarackObama/status/23173697869
;2010/09/06;285;28;"Honoring America’s workers on Labor Day at 3:10pm ET. Watch live: http://wh.gov/live.";;;;"23169176962";https://twitter.com/BarackObama/status/23169176962
;2010/09/05;964;101;"On Labor Day we honor the American worker and reaffirm our commitment to the great American middle class. http://j.mp/a3RjbF";;;;"23061356117";https://twitter.com/BarackObama/status/23061356117
;2010/09/03;826;111;"We can’t afford to go backward to the failed policies of the past. We have to move forward. Commit to vote this November. http://j.mp/cQ5kd7";;;;"22922015235";https://twitter.com/BarackObama/status/22922015235
;2010/09/03;536;57;"The party that finally made real the idea that no one should be denied health care just because they get sick: #FF @DemocratsDotOrg.";;@DemocratsDotOrg;#FF;"22917777573";https://twitter.com/BarackObama/status/22917777573
;2010/09/03;300;56;"As the U.S. combat mission in Iraq came to an end, West Wing Week spent a week on the ground in Iraq with our troops. http://j.mp/dCHnt4";;;;"22898565862";https://twitter.com/BarackObama/status/22898565862
;2010/08/31;1571;183;"The Iraqi people will have a strong partner in the United States. Our combat mission is ending, but our commitment to Iraq’s future is not.";;;;"22664321637";https://twitter.com/BarackObama/status/22664321637
;2010/08/31;1492;135;"America’s men and women in uniform have served with courage and resolve. I am proud of their service and awed by their sacrifice.";;;;"22663596539";https://twitter.com/BarackObama/status/22663596539
;2010/08/31;1156;123;"There were patriots who supported this war and who opposed it. We are united in appreciation for our troops and our hope for Iraq’s future.";;;;"22662866667";https://twitter.com/BarackObama/status/22662866667
;2010/08/31;7647;580;"I made a pledge to the American people as a candidate for this office—and tonight the American combat mission in Iraq has ended.";;;;"22662128371";https://twitter.com/BarackObama/status/22662128371
;2010/08/31;923;60;"Addressing the nation from the Oval Office about the end of the war in Iraq. Watch live at 8pm ET. http://wh.gov/live";;;;"22659595532";https://twitter.com/BarackObama/status/22659595532
;2010/08/31;154;26;"Not only did volunteers surpass OFA’s goal of knocking on 200,000 doors last weekend, but they also made 168,330 calls: http://j.mp/9vwbPN.";;;;"22648832800";https://twitter.com/BarackObama/status/22648832800
;2010/08/31;600;81;"I ask Senate Republicans to drop their blockade of a jobs bill that would cut taxes and make more loans available for small businesses.";;;;"22624001695";https://twitter.com/BarackObama/status/22624001695
;2010/08/30;642;57;"RT @SpeakerPelosi: As our combat mission ends, I join in thanking those who have served in Iraq—and honor those we've lost. #SaluteTroops";;@SpeakerPelosi;#SaluteTroops;"22558372066";https://twitter.com/BarackObama/status/22558372066
;2010/08/30;637;71;"As we mark the end of America’s combat mission in Iraq, a grateful nation pays tribute to all who have served there. http://j.mp/9Yowhz";;;;"22548164809";https://twitter.com/BarackObama/status/22548164809
;2010/08/29;724;71;"The people of the Gulf Coast have demonstrated what it means to persevere in the face of tragedy—and rebuild in the face of ruin.";;;;"22462157167";https://twitter.com/BarackObama/status/22462157167
;2010/08/27;352;50;"This weekend, join supporters in your community to reach out to voters about the importance of voting this November. http://j.mp/cd-K";;;;"22302379314";https://twitter.com/BarackObama/status/22302379314
;2010/08/27;976;97;"Thank you to all the men and women who have served in Iraq. Your dedication, bravery and courage have made America safer. http://j.mp/d0BqjP";;;;"22297190188";https://twitter.com/BarackObama/status/22297190188
;2010/08/27;237;30;"Democrats to follow: @TimKaine, @SpeakerPelosi, and @SenatorReid #FF";;@TimKaine @SpeakerPelosi @SenatorReid;#FF;"22293379633";https://twitter.com/BarackObama/status/22293379633
;2010/08/25;536;78;"To keep moving America forward, we need supporters to knock on doors and talk to voters. Join a canvass this weekend: http://j.mp/cd-K.";;;;"22138106699";https://twitter.com/BarackObama/status/22138106699
;2010/08/24;524;91;"The CARD Act will put a stop to deceptive practices and hold credit card companies accountable to their customers: http://j.mp/aWtnRo.";;;;"22014819497";https://twitter.com/BarackObama/status/22014819497
;2010/08/23;211;40;"This weekend, OFA supporters will talk to voters about how important it is to vote this November. Can you attend a canvass? http://j.mp/cd-K";;;;"21918111512";https://twitter.com/BarackObama/status/21918111512
;2010/08/21;1095;197;"We cannot allow the corporate takeover of our democracy. We’re going to continue to fight for reform and transparency. http://j.mp/bKo8TY";;;;"21784775391";https://twitter.com/BarackObama/status/21784775391
;2010/08/20;203;35;"Vice President Biden is in St. Louis to address Democrats at the party's summer meeting. Watch live at 10:50 a.m. ET. http://j.mp/dnGEqd";;;;"21669422915";https://twitter.com/BarackObama/status/21669422915
;2010/08/20;456;74;"Let’s put aside partisanship and work together for small businesses, employees, and the communities that depend on them. http://j.mp/dot0uc";;;;"21667171283";https://twitter.com/BarackObama/status/21667171283
;2010/08/18;428;73;"Our commitment to clean energy is creating work in the short term—and laying the foundation for lasting economic growth. http://j.mp/a3pPHO";;;;"21508880830";https://twitter.com/BarackObama/status/21508880830
;2010/08/17;205;62;"Delivering remarks after a conversation on the economy with three Seattle small-business owners. Listen at 3:20 pm ET. http://wh.gov/live";;;;"21426245425";https://twitter.com/BarackObama/status/21426245425
;2010/08/16;236;39;"OFA needs your help to knock on 200,000 doors in 48 hours. Can you host a Moving America Forward canvass August 28 or 29? http://j.mp/cqtYaA";;;;"21341744771";https://twitter.com/BarackObama/status/21341744771
;2010/08/16;110;33;"White House staff and @HHSGov Secretary Kathleen Sebelius answered your questions in this episode of West Wing Week. http://j.mp/aZsJ90";;@HHSGov;;"21336204550";https://twitter.com/BarackObama/status/21336204550
;2010/08/16;313;48;"To the people in the Gulf, we are standing by your side. And to Americans across the country, come on down and visit. http://j.mp/abTq6S";;;;"21328358209";https://twitter.com/BarackObama/status/21328358209
;2010/08/16;133;15;"Touring ZBB Energy Inc. in Menomonee Falls, WI, and then speaking to workers. Listen live at 12:10 pm ET. http://wh.gov/live";;;;"21325651841";https://twitter.com/BarackObama/status/21325651841
;2010/08/14;216;70;"OFA volunteers have set an ambitious goal: knocking on 200,000 doors in just 48 hours. Can you help by hosting a canvass? http://j.mp/cqtYaA";;;;"21181005370";https://twitter.com/BarackObama/status/21181005370
;2010/08/14;600;124;"I’ll fight with everything I’ve got to stop those who would gamble your Social Security on Wall Street. http://j.mp/dzFmm8";;;;"21175662016";https://twitter.com/BarackObama/status/21175662016
;2010/08/14;2133;261;"Our commitment to religious freedom must be unshakable—all faiths are welcome in this country. http://j.mp/aFYFYC";;;;"21170204049";https://twitter.com/BarackObama/status/21170204049
;2010/08/12;472;78;"Making sure we can continue to move forward starts with a promise to cast a ballot this November. Please commit to vote: http://j.mp/a5rq5o.";;;;"20998766448";https://twitter.com/BarackObama/status/20998766448
;2010/08/12;747;125;"This nation has always been proud of what it builds, and that spirit will lead our recovery forward. Don’t lose faith in American industry.";;;;"20980557812";https://twitter.com/BarackObama/status/20980557812
;2010/08/10;769;109;"We can’t stand by while pink slips are given to those who educate our children or keep our communities safe. http://j.mp/c3gCbH";;;;"20815561870";https://twitter.com/BarackObama/status/20815561870
;2010/08/10;421;53;"Joining teachers in the Rose Garden to urge the House to pass aid that will save 160,000 teacher jobs. Watch http://wh.gov/live at 11:40 ET.";;;;"20803607818";https://twitter.com/BarackObama/status/20803607818
;2010/08/09;2217;271;"At every juncture in history, we’ve recognized that the way to move forward, in our own lives and as a nation, is to put education first.";;;;"20732295200";https://twitter.com/BarackObama/status/20732295200
;2010/08/09;370;57;"Discussing our strategy to lead the world in college graduation rates & ensure grads are career-ready. Watch at 3 pm ET. http://wh.gov/live";;;;"20729337938";https://twitter.com/BarackObama/status/20729337938
;2010/08/09;193;34;"In a special Gulf Coast West Wing Week, take a look at the administration's efforts to clean up the BP oil spill. http://j.mp/bwWFux";;;;"20723686785";https://twitter.com/BarackObama/status/20723686785
;2010/08/09;665;58;"A minority in the Senate is blocking a vote on a jobs bill for small businesses, and that's a shame. It's time to move forward.";;;;"20720608516";https://twitter.com/BarackObama/status/20720608516
;2010/08/09;303;64;"The steps we took this year to reform the health care system have put Medicare on a sounder financial footing. http://j.mp/aWL1AD";;;;"20716649701";https://twitter.com/BarackObama/status/20716649701
;2010/08/06;211;52;"Hosting a reception to honor the Senate confirmation of Elena Kagan’s to the Supreme Court. Watch live @ 2:35pm ET: http://wh.gov/live";;@;;"20489376873";https://twitter.com/BarackObama/status/20489376873
;2010/08/05;496;152;"Thank you to all those who signed my birthday card. I was overwhelmed by the kind words I received from everyone. http://j.mp/9X6Z6w";;;;"20422256524";https://twitter.com/BarackObama/status/20422256524
;2010/08/05;590;60;"Pleased that the Senate has confirmed Elena Kagan as our 112th Supreme Ct. justice. I am confident she will make an outstanding justice.";;;;"20417456764";https://twitter.com/BarackObama/status/20417456764
;2010/08/05;637;64;"To the naysayers in Washington who said walk away from the auto industry, my message to them is this: Don’t bet against the American worker.";;;;"20407571308";https://twitter.com/BarackObama/status/20407571308
;2010/08/05;148;24;"OFA supporters stand with Elena Kagan—a Supreme Ct. nominee who embodies independence, integrity & passion for the law. http://j.mp/dlWmt8";;;;"20401666855";https://twitter.com/BarackObama/status/20401666855
;2010/08/05;155;28;"Speaking about the auto industry at a Ford Motor Company assembly plant in Chicago. Listen live at 11:15 am ET. http://wh.gov/live.";;;;"20394289524";https://twitter.com/BarackObama/status/20394289524
;2010/08/04;1764;259;"We are going to rebuild this economy stronger than before, and at the heart of it are going to be three powerful words: "Made in America."";;;;"20337776197";https://twitter.com/BarackObama/status/20337776197
;2010/08/04;514;73;"Today Congress took an important step toward ensuring that teachers stay in the classroom and cash-strapped states get the relief they need.";;;;"20335558327";https://twitter.com/BarackObama/status/20335558327
;2010/08/04;176;28;"Delivering remarks on the economy at the AFL-CIO Executive Council Meeting in Washington. Listen live at 11:05 am ET. http://wh.gov/live";;;;"20310664263";https://twitter.com/BarackObama/status/20310664263
;2010/08/03;294;45;"Taking questions from young African leaders from 47 nations at a White House town hall meeting. Watch live at 2 pm ET. http://wh.gov/live";;;;"20238935714";https://twitter.com/BarackObama/status/20238935714
;2010/08/02;376;59;"At a time when America is just starting to move forward again, we can’t afford do-nothing policies & partisan maneuvering. http://j.mp/bQ-N";;;;"20155802916";https://twitter.com/BarackObama/status/20155802916
;2010/08/02;1561;164;"As a presidential candidate, I pledged to bring the Iraq war to a responsible end. That's exactly what we're doing—as promised, on schedule.";;;;"20150910602";https://twitter.com/BarackObama/status/20150910602
;2010/08/02;197;34;"Speaking at the Disabled American Veterans national convention in Atlanta. Watch live at 11:30 am ET. http://wh.gov/live";;;;"20146818504";https://twitter.com/BarackObama/status/20146818504
;2010/07/30;182;57;"Go behind the scenes in the fight for campaign finance reform and at yesterday's appearance on The View. http://j.mp/atXbqL";;;;"19932917803";https://twitter.com/BarackObama/status/19932917803
;2010/07/30;154;28;"Speaking at a Hamtramck GM plant that recently stayed open during a scheduled production shutdown. Listen live: http://wh.gov/live.";;;;"19927507688";https://twitter.com/BarackObama/status/19927507688
;2010/07/30;165;18;"Delivering remarks after touring the Chrysler auto plant in Detroit. Listen live at 12:15 pm ET. http://wh.gov/live";;;;"19920474041";https://twitter.com/BarackObama/status/19920474041
;2010/07/29;311;41;"Speaking about education reform at the National Urban League 100th Anniversary Convention. Watch live at 10:05 a.m. ET. http://wh.gov/live";;;;"19827126470";https://twitter.com/BarackObama/status/19827126470
