username;date;retweets;favorites;text;geo;mentions;hashtags;id;permalink
3jdg3mnmy;2016/07/27;0;0;"طريقه التحميل 1 اضغط الرابط ده http://4b.bz/Vv78U  2 اضغط الاعلان 3 حمل pic.twitter.com/4Mo9KuHwNx PTB";;;;"758451870235058180";https://twitter.com/3jdg3mnmy/status/758451870235058180
onlineplatforms;2016/07/27;0;1;"Zurich Falls Behind in Bitcoin Adoption and Fintech Development. @investorseurope #blockchainhttp://rocktrader.eu/p/4066871266/2016/07/27/zurich-falls-behind-in-bitcoin-adoption-and-fintech-development-investorseurope-blockchain?utm_medium=social&utm_source=twitter …";;@investorseurope;#blockchainhttp;"758451713426808836";https://twitter.com/onlineplatforms/status/758451713426808836
Jesusluvsander;2016/07/27;0;0;"@carterreynolds Carter Reynolds was caught having sex with Selena Gomez, vid just got leaked on: http://ow.ly/8NNK301VcI6  0.295";;@carterreynolds;;"758451702638927875";https://twitter.com/Jesusluvsander/status/758451702638927875
Jesusluvsander;2016/07/27;0;0;"@Nashgrier Nash Grier was caught having sex with Ariana Grande, vid got leaked on: http://ow.ly/8NNK301VcI6  0.320";;@Nashgrier;;"758451697656016896";https://twitter.com/Jesusluvsander/status/758451697656016896
BlockChannel;2016/07/27;1;0;"BCN News: coindesk "The latest Bitcoin Price Index is 655.51 USD http://www.coindesk.com/price/  pic.twitter.com/iSiLHcBkvw"";;;;"758451689108148225";https://twitter.com/BlockChannel/status/758451689108148225
coindesk;2016/07/27;35;13;"The latest Bitcoin Price Index is 655.51 USD http://www.coindesk.com/price/ pic.twitter.com/mRaexruEbL";;;;"758451667889188864";https://twitter.com/coindesk/status/758451667889188864
mifid;2016/07/27;0;0;"US Regulators Explore Rules for Bitcoin. @investorseurope #blockchainhttp://rocktrader.eu/p/4066866977/2016/07/27/us-regulators-explore-rules-for-bitcoin-investorseurope-blockchain?utm_medium=social&utm_source=twitter …";;@investorseurope;#blockchainhttp;"758451664579858432";https://twitter.com/mifid/status/758451664579858432
bitcoinfirehose;2016/07/27;0;0;"Can I just get something clarified real quick regarding Bitaddress? http://ift.tt/2aeKrO8  #reddit #bitcoin";;;#reddit #bitcoin;"758451595973623808";https://twitter.com/bitcoinfirehose/status/758451595973623808
bitcoinfirehose;2016/07/27;0;0;"I got a question about bitcoin miner. http://ift.tt/2afFHLf  #reddit #bitcoin";;;#reddit #bitcoin;"758451594258251776";https://twitter.com/bitcoinfirehose/status/758451594258251776
bitcoinfirehose;2016/07/27;0;0;"The Destituent Power of Crypto http://ift.tt/2aeMRMs  #reddit #bitcoin";;;#reddit #bitcoin;"758451590621720582";https://twitter.com/bitcoinfirehose/status/758451590621720582
OFKWebDesign;2016/07/27;0;0;"Jornal da Globo: Bitcoin, a moeda virtual, se populariza no Brasil e tem valorização recorde - http://g1.globo.com/jornal-da-globo/noticia/2016/07/bitcoin-moeda-virtual-se-populariza-no-brasil-e-tem-valorizacao-recorde.html …";;;;"758451555196690432";https://twitter.com/OFKWebDesign/status/758451555196690432
Akumaburn;2016/07/27;0;0;"New Study Reveals #Bitcoin Economy Maturing to Mainstream Enterprise… http://dlvr.it/LvDLyD pic.twitter.com/NfocSBbe2u";;;#Bitcoin;"758451440113168385";https://twitter.com/Akumaburn/status/758451440113168385
Akumaburn;2016/07/27;0;0;"Case Study: Why Systems Security Company @Nexusguard Chooses #Bitcoin… http://dlvr.it/LvDLns pic.twitter.com/y5deSmhvMB";;@Nexusguard;#Bitcoin;"758451432127238144";https://twitter.com/Akumaburn/status/758451432127238144
GoddessBitcoin;2016/07/27;0;0;"Bitcoin Impact Debated Ahead of Possible Bank of Japan Stimulus: Ahead of potential new monetary pol... http://cur.lv/10umdm  #Bitcoin";;;#Bitcoin;"758451352838123520";https://twitter.com/GoddessBitcoin/status/758451352838123520
bitcoinpoet;2016/07/27;5;1;"Bitcoin investment vehicles: I've heard of at least 2 financial products which enable people to take... http://btcs.me/2avxXpj  #bitcoin";;;#bitcoin;"758451337445027840";https://twitter.com/bitcoinpoet/status/758451337445027840
BTCTips1;2016/07/27;0;0;"Top story: ItBit Hit With String of Departures in Bitcoin-to-Blockchain Transit… http://www.coindesk.com/itbit-exodus-populating-startups-blockchain-expertise/ …, see more http://tweetedtimes.com/BTCTips1?s=tnp ";;;;"758451305518133248";https://twitter.com/BTCTips1/status/758451305518133248
interested_mtm;2016/07/27;0;0;"【仮想通貨】日本版Bitcoin、Monacoinでできること - NAVER まとめ http://matome.naver.jp/odai/2139216646253241501 …";;;;"758451241915588608";https://twitter.com/interested_mtm/status/758451241915588608
AnoncoinPrice;2016/07/27;0;0;"#Anoncoin/ #ANC price now: $ 0.186354, that's -0.10 % change in 1hour. -1.05 % past day, and -6.16 % in the past week! #Bitcoin is $ 654.31";;;#Anoncoin #ANC #Bitcoin;"758451211628666880";https://twitter.com/AnoncoinPrice/status/758451211628666880
KellyKSutton;2016/07/27;0;0;"the beauty of decentralization. <3http://fb.me/4CZKkqyEH ";;;;"758451184986382336";https://twitter.com/KellyKSutton/status/758451184986382336
onlineplatforms;2016/07/27;0;0;"Altcoins Benefit as Bitcoin Transaction Fees Rises. @investorseurope #blockchainhttp://rocktrader.eu/p/4066871242/2016/07/27/altcoins-benefit-as-bitcoin-transaction-fees-rises-investorseurope-blockchain?utm_medium=social&utm_source=twitter …";;@investorseurope;#blockchainhttp;"758451177080123392";https://twitter.com/onlineplatforms/status/758451177080123392
bitcoinagile;2016/07/27;0;0;"How China Took Center Stage in Bitcoins Civil War https://getpocket.com/@jds950/share/919126 …pic.twitter.com/9JnoH0WMj2";;@jds950;;"758451132813508608";https://twitter.com/bitcoinagile/status/758451132813508608
jskuros;2016/07/27;0;0;"How China Took Center Stage in Bitcoin’s Civil War https://getpocket.com/@jds950/share/919126 …";;@jds950;;"758451118045335552";https://twitter.com/jskuros/status/758451118045335552
AnselLindner;2016/07/27;0;5;"I bet this was awkward. #Ethereum #DAOhack $ETC #bitcoin #SmartCon2016https://twitter.com/ChrJentzsch/status/757788605729288197 …";;;#Ethereum #DAOhack #bitcoin #SmartCon2016https;"758451115897655296";https://twitter.com/AnselLindner/status/758451115897655296
