username;date;retweets;favorites;text;geo;mentions;hashtags;id;permalink
;2016/07/29;7784;25632;""Little" Michael Bloomberg, who never had the guts to run for president, knows nothing about me. His last term as Mayor was a disaster!";;;;"759025610249216000";https://twitter.com/realDonaldTrump/status/759025610249216000
;2016/07/29;6322;21067;"General John Allen, who I never met but spoke against me last night, failed badly in his fight against ISIS. His record = BAD #NeverHillary";;;#NeverHillary;"759024055123009536";https://twitter.com/realDonaldTrump/status/759024055123009536
;2016/07/29;9525;33713;"Crooked Hillary Clinton mentioned me 22 times in her very long and very boring speech. Many of her statements were lies and fabrications!";;;;"759021886055387136";https://twitter.com/realDonaldTrump/status/759021886055387136
;2016/07/29;3137;10573;"Join @mike_pence at the University of Northwestern Ohio- tonight at 7pm. Tickets: https://www.donaldjtrump.com/schedule/register/lima-oh/ …";;@mike_pence;;"759017481633542145";https://twitter.com/realDonaldTrump/status/759017481633542145
;2016/07/29;8284;23014;"" @AnnCoulter: "I believe in science" Dem code for "we're shutting down coal mines, steel plants and any other remaining manufacturing""";;@AnnCoulter;;"759014707277598720";https://twitter.com/realDonaldTrump/status/759014707277598720
;2016/07/29;3797;10432;"CAMPAIGN STATEMENT: https://www.facebook.com/DonaldTrump/posts/10157391345450725 …";;;;"759013928315686917";https://twitter.com/realDonaldTrump/status/759013928315686917
;2016/07/29;9476;27621;"Two policemen just shot in San Diego, one dead. It is only getting worse. People want LAW AND ORDER!";;;;"759013889761697794";https://twitter.com/realDonaldTrump/status/759013889761697794
;2016/07/29;8844;31308;"Crooked Hillary Clinton made up facts about me, and "forgot" to mention the many problems of our country, in her very average scream!";;;;"759008377577967616";https://twitter.com/realDonaldTrump/status/759008377577967616
;2016/07/29;5900;20512;"The media coverage this morning of the very average Clinton speech and Convention is a joke. @CNN and the little watched @Morning_Joe = SAD!";;@CNN @Morning_Joe;;"759005597899436032";https://twitter.com/realDonaldTrump/status/759005597899436032
;2016/07/28;17502;49005;"No one has worse judgement than Hillary Clinton - corruption and devastation follows her wherever she goes.";;;;"758874457142284288";https://twitter.com/realDonaldTrump/status/758874457142284288
;2016/07/28;13139;36454;"Hillary's wars in the Middle East have unleashed destruction, terrorism and ISIS across the world.";;;;"758873961425805312";https://twitter.com/realDonaldTrump/status/758873961425805312
;2016/07/28;16714;43151;"Hillary's vision is a borderless world where working people have no power, no jobs, no safety.";;;;"758873275044798464";https://twitter.com/realDonaldTrump/status/758873275044798464
;2016/07/28;16419;43080;"Hillary will never reform Wall Street. She is owned by Wall Street!";;;;"758872873234681860";https://twitter.com/realDonaldTrump/status/758872873234681860
;2016/07/28;14857;42592;"Our way of life is under threat by Radical Islam and Hillary Clinton cannot even bring herself to say the words.";;;;"758872422028148740";https://twitter.com/realDonaldTrump/status/758872422028148740
;2016/07/28;19747;51251;"Hillary's refusal to mention Radical Islam, as she pushes a 550% increase in refugees, is more proof that she is unfit to lead the country.";;;;"758871653547806724";https://twitter.com/realDonaldTrump/status/758871653547806724
;2016/07/28;7949;27610;"Departing now - thank you Cedar Rapids, Iowa. This is a MOVEMENT!pic.twitter.com/ezrqVqPtta";;;;"758851150175055874";https://twitter.com/realDonaldTrump/status/758851150175055874
;2016/07/28;30176;54955;"#CrookedHillarypic.twitter.com/JeXFnO6e3s";;;#CrookedHillarypic;"758802697763958784";https://twitter.com/realDonaldTrump/status/758802697763958784
;2016/07/28;6376;19053;""Dems warn not to underestimate Trump's potential win"http://nypost.com/2016/07/25/dems-warn-not-to-underestimate-trumps-potential-to-win/ …";;;;"758778607489708032";https://twitter.com/realDonaldTrump/status/758778607489708032
;2016/07/28;4308;16806;"Great to be back in Iowa! #TBT with @JerryJrFalwell joining me in Davenport- this past winter. #MAGApic.twitter.com/A5IF0QHnic";;@JerryJrFalwell;#TBT #MAGApic;"758771144140820481";https://twitter.com/realDonaldTrump/status/758771144140820481
;2016/07/28;10499;29821;"Median household income is down for the middle class since Obama took office. It will only go further down under Clinton.";;;;"758768028595032064";https://twitter.com/realDonaldTrump/status/758768028595032064
;2016/07/28;16625;38427;"A vote for Clinton-Kaine is a vote for TPP, NAFTA, high taxes, radical regulation, and massive influx of refugees.";;;;"758761945910669312";https://twitter.com/realDonaldTrump/status/758761945910669312
;2016/07/28;3660;10959;"AMERICA'S FUTURE https://www.facebook.com/DonaldTrump/posts/10157388173350725 …";;;;"758761521317023744";https://twitter.com/realDonaldTrump/status/758761521317023744
;2016/07/28;4585;14436;"Bernie caved! https://www.instagram.com/p/BIalBvcjIQQ/ ";;;;"758732782348623874";https://twitter.com/realDonaldTrump/status/758732782348623874
;2016/07/28;6348;17017;"" @LallyRay: Poll: Donald Trump Sees 17-Point Positive Swing in Two Weeks - Breitbart http://www.breitbart.com/2016-presidential-race/2016/07/28/poll-trump-gains-17-point-swing-two-weeks-clinton/ … @realdonaldtrump" Great!";;@LallyRay @realdonaldtrump;;"758731880183193601";https://twitter.com/realDonaldTrump/status/758731880183193601
;2016/07/28;16057;48176;"President Obama spoke last night about a world that doesn’t exist. 70% of the people think our country is going in the wrong direction. #DNC";;;#DNC;"758680707979943937";https://twitter.com/realDonaldTrump/status/758680707979943937
;2016/07/27;6636;24115;"" @trumplican2016: @realDonaldTrump @DavidWohl stay the course mr trump your message is resonating with the PEOPLE"";;@trumplican2016 @realDonaldTrump @DavidWohl;;"758512401629192192";https://twitter.com/realDonaldTrump/status/758512401629192192
;2016/07/27;8027;24775;"" @DavidWohl: Barack is offended that @realDonaldTrump will demand that #NATO allies pay their fair share. #DemsInPhilly"";;@DavidWohl @realDonaldTrump;#NATO #DemsInPhilly;"758511494669664256";https://twitter.com/realDonaldTrump/status/758511494669664256
;2016/07/27;16647;49295;"Our country does not feel 'great already' to the millions of wonderful people living in poverty, violence and despair.";;;;"758492727583576064";https://twitter.com/realDonaldTrump/status/758492727583576064
;2016/07/27;20164;62494;"Shooting deaths of police officers up 78% this year. We must restore law and order and protect our great law enforcement officers!";;;;"758491947409481728";https://twitter.com/realDonaldTrump/status/758491947409481728
;2016/07/27;3879;14116;"Join me live in Toledo, Ohio! #MakeAmericaGreatAgainhttp://youtu.be/vcb_VzvM3Vw ";;;#MakeAmericaGreatAgainhttp;"758452289376022529";https://twitter.com/realDonaldTrump/status/758452289376022529
;2016/07/27;19148;35827;"#CrookedHillarypic.twitter.com/lwi9gqDEHE";;;#CrookedHillarypic;"758422125254471680";https://twitter.com/realDonaldTrump/status/758422125254471680
;2016/07/27;5416;18516;"Thank you Pennsylvania! #MakeAmericaGreatAgain https://www.facebook.com/DonaldTrump/posts/10157382674030725:0 …pic.twitter.com/bbroAGTdMw";;;#MakeAmericaGreatAgain;"758421383063961604";https://twitter.com/realDonaldTrump/status/758421383063961604
;2016/07/27;16167;45579;"Thank you to our amazing law enforcement officers! #MAGApic.twitter.com/UEZorOQhTw";;;#MAGApic;"758380358874247168";https://twitter.com/realDonaldTrump/status/758380358874247168
;2016/07/27;6628;13904;""Trump right: Illegal families crossing border set to double, 51,152 so far"http://bit.ly/2aeaiwaTrumpPence16 …";;;;"758367154232320000";https://twitter.com/realDonaldTrump/status/758367154232320000
;2016/07/27;13744;37203;"Great new poll - thank you! #MakeAmericaGreatAgainpic.twitter.com/mXovx0TLPC";;;#MakeAmericaGreatAgainpic;"758350470402408449";https://twitter.com/realDonaldTrump/status/758350470402408449
;2016/07/27;24136;62221;"If Russia or any other country or person has Hillary Clinton's 33,000 illegally deleted emails, perhaps they should share them with the FBI!";;;;"758335147183788032";https://twitter.com/realDonaldTrump/status/758335147183788032
;2016/07/27;4063;13119;"Join our next Vice President, @Mike_Pence in Wisconsin tonight & Michigan Thursday! MI: https://www.donaldjtrump.com/schedule/register/waukesha-wi/ … WI: https://www.donaldjtrump.com/schedule/register/grand-rapids-mi1/ …";;@Mike_Pence;;"758331893809090560";https://twitter.com/realDonaldTrump/status/758331893809090560
;2016/07/27;29320;82798;"Not one American flag on the massive stage at the Democratic National Convention until people started complaining-then a small one. Pathetic";;;;"758286077400580096";https://twitter.com/realDonaldTrump/status/758286077400580096
;2016/07/27;11303;36884;"Our not very bright Vice President, Joe Biden, just stated that I wanted to "carpet bomb" the enemy. Sorry Joe, that was Ted Cruz!";;;;"758285141982711808";https://twitter.com/realDonaldTrump/status/758285141982711808
;2016/07/27;16093;53043;"Crooked Hillary Clinton wants to flood our country with Syrian immigrants that we know little or nothing about. The danger is massive. NO!";;;;"758242674646323200";https://twitter.com/realDonaldTrump/status/758242674646323200
;2016/07/27;12770;39551;"Hopefully the violent and vicious killing by ISIS of a beloved French priest is causing people to start thinking rationally. Get tough!";;;;"758240929564258305";https://twitter.com/realDonaldTrump/status/758240929564258305
;2016/07/27;14916;44831;"The Democratic Convention has paid ZERO respect to the great police and law enforcement professionals of our country. No recognition - SAD!";;;;"758238226180083712";https://twitter.com/realDonaldTrump/status/758238226180083712
;2016/07/27;7034;25115;"Funny how the failing @nytimes is pushing Dems narrative that Russia is working for me because Putin said "Trump is a genius." America 1st!";;@nytimes;;"758236300554174465";https://twitter.com/realDonaldTrump/status/758236300554174465
;2016/07/27;6741;21771;"As I have been saying, Crooked Hillary will approve the job killing TPP after the election, despite her statements to the contrary: top adv.";;;;"758233935230959617";https://twitter.com/realDonaldTrump/status/758233935230959617
;2016/07/26;9653;21577;"Just like I have warned from the beginning, Crooked Hillary Clinton will betray you on the TPP.http://www.politico.com/story/2016/07/terry-mcauliffe-hillary-clinton-tpp-trade-226253 …";;;;"758135085820416000";https://twitter.com/realDonaldTrump/status/758135085820416000
;2016/07/26;8267;30657;"Many of Bernie's supporters have left the arena. Did Bernie go home and go to sleep?";;;;"758122684798607360";https://twitter.com/realDonaldTrump/status/758122684798607360
;2016/07/26;10066;45799;"I hate to say it, but the Republican Convention was far more interesting (with a much more beautiful set) than the Democratic Convention!";;;;"758121939365982208";https://twitter.com/realDonaldTrump/status/758121939365982208
;2016/07/26;10631;39625;"No matter what Bill Clinton says and no matter how well he says it, the phony media will exclaim it to be incredible. Highly overrated!";;;;"758120321845235712";https://twitter.com/realDonaldTrump/status/758120321845235712
;2016/07/26;13064;42316;"You have no idea what my strategy on ISIS is, and neither does ISIS (a good thing). Please get your facts straight - thanks. @megynkelly";;@megynkelly;;"758117640200187905";https://twitter.com/realDonaldTrump/status/758117640200187905
;2016/07/26;11756;36797;"For the record, I have ZERO investments in Russia.";;;;"758071952498159616";https://twitter.com/realDonaldTrump/status/758071952498159616
;2016/07/26;9853;32924;"In order to try and deflect the horror and stupidity of the Wikileakes disaster, the Dems said maybe it is Russia dealing with Trump. Crazy!";;;;"758071264128806912";https://twitter.com/realDonaldTrump/status/758071264128806912
;2016/07/26;13660;35719;"Dems don't want to talk ISIS b/c Hillary's foreign interventions unleashed ISIS & her refugee plans make it easier for them to come here.";;;;"758026136299397120";https://twitter.com/realDonaldTrump/status/758026136299397120
;2016/07/26;7002;25201;"Bernie's exhausted, he just wants to shut down and go home to bed!";;;;"758021060503756804";https://twitter.com/realDonaldTrump/status/758021060503756804
;2016/07/26;12122;36845;"The invention of email has proven to be a very bad thing for Crooked Hillary in that it has proven her to be both incompetent and a liar!";;;;"758020997383684096";https://twitter.com/realDonaldTrump/status/758020997383684096
;2016/07/26;6279;20413;"Thank you New Hampshire! #MakeAmericaGreatAgainpic.twitter.com/KRCdV77BQp";;;#MakeAmericaGreatAgainpic;"758004154417553409";https://twitter.com/realDonaldTrump/status/758004154417553409
;2016/07/26;4296;14000;"Join us in Toledo, Ohio- tomorrow night at 8pm! #TrumpPence16 #MAGA Tickets: http://bit.ly/2aetvp7TrumpPenceOH …pic.twitter.com/zmGZauCnQF";;;#TrumpPence16 #MAGA;"757997327269306369";https://twitter.com/realDonaldTrump/status/757997327269306369
;2016/07/26;4364;14238;"Join us tomorrow in Scranton, Pennsylvania at 3pm! #TrumpPence16 #MAGA Tickets: http://bit.ly/2aetcdrTrumpPencePA …pic.twitter.com/7zMKhhMmhp";;;#TrumpPence16 #MAGA;"757994830110658560";https://twitter.com/realDonaldTrump/status/757994830110658560
;2016/07/26;8247;31138;"Pocahontas bombed last night! Sad to watch.";;;;"757919034755076096";https://twitter.com/realDonaldTrump/status/757919034755076096
;2016/07/26;19854;63882;"Why aren't the Democrats speaking about ISIS, bad trade deals, broken borders, police and law and order. The Republican Convention was great";;;;"757918002339778560";https://twitter.com/realDonaldTrump/status/757918002339778560
;2016/07/26;7736;29013;"Funny, if you listen to @FoxNews, the Democrats did not have a good day. If you listen to the other two, they are fawning. What a difference";;@FoxNews;;"757916962269704192";https://twitter.com/realDonaldTrump/status/757916962269704192
;2016/07/25;22486;65114;"Bernie Sanders totally sold out to Crooked Hillary Clinton. All of that work, energy and money, and nothing to show for it! Waste of time.";;;;"757777369272815617";https://twitter.com/realDonaldTrump/status/757777369272815617
;2016/07/25;11499;41591;"Elizabeth Warren, often referred to as Pocahontas, just misrepresented me and spoke glowingly about Crooked Hillary, who she always hated!";;;;"757775689525309440";https://twitter.com/realDonaldTrump/status/757775689525309440
;2016/07/25;22869;66356;"Sad to watch Bernie Sanders abandon his revolution. We welcome all voters who want to fix our rigged system and bring back our jobs.";;;;"757773671545044992";https://twitter.com/realDonaldTrump/status/757773671545044992
;2016/07/25;10436;34486;"If Cory Booker is the future of the Democratic Party, they have no future! I know more about Cory than he knows about himself.";;;;"757760973419712512";https://twitter.com/realDonaldTrump/status/757760973419712512
;2016/07/25;8140;25927;"I was at @FoxNews and met Juan Williams in passing. He asked if he could have pictures taken with me. I said fine. He then trashes on air!";;@FoxNews;;"757696233427312640";https://twitter.com/realDonaldTrump/status/757696233427312640
;2016/07/25;8744;29665;"Hard to believe that Bernie Sanders has done such a complete fold. He got NOTHING for all of the time, energy and money. The V.P. a joke!";;;;"757693383481626624";https://twitter.com/realDonaldTrump/status/757693383481626624
;2016/07/25;14325;43675;"While Bernie has totally given up on his fight for the people, we welcome all voters who want a better future for our workers.";;;;"757690343181737984";https://twitter.com/realDonaldTrump/status/757690343181737984
;2016/07/25;8558;23963;"Clinton betrayed Bernie voters. Kaine supports TPP, is in pocket of Wall Street, and backed Iraq War.";;;;"757690132111777792";https://twitter.com/realDonaldTrump/status/757690132111777792
;2016/07/25;7989;26257;"Thank you OHIO! #TrumpPence16 https://www.facebook.com/DonaldTrump/posts/10157370239030725:0 …pic.twitter.com/WPMBkYjuIm";;;#TrumpPence16;"757688331597668353";https://twitter.com/realDonaldTrump/status/757688331597668353
;2016/07/25;4266;15651;"Thank you Roanoke, Virginia- be back soon! #TrumpPence16 https://www.facebook.com/DonaldTrump/posts/10157370422355725:0 …pic.twitter.com/HwqI2iGPDu";;;#TrumpPence16;"757687988189065216";https://twitter.com/realDonaldTrump/status/757687988189065216
;2016/07/25;10478;30121;"MAKE AMERICA SAFE AND GREAT AGAIN! #TrumpPence16 https://www.facebook.com/DonaldTrump/posts/10157369699375725:0 …pic.twitter.com/cptBaZbV1v";;;#TrumpPence16;"757650904896139264";https://twitter.com/realDonaldTrump/status/757650904896139264
;2016/07/25;13001;32625;"#MakeAmericaGreatAgain https://www.facebook.com/DonaldTrump/posts/10157368945620725:0 …pic.twitter.com/3ji7a14GSw";;;#MakeAmericaGreatAgain;"757618048664829952";https://twitter.com/realDonaldTrump/status/757618048664829952
;2016/07/25;10230;34920;"Great POLL numbers are coming out all over. People don't want another four years of Obama, and Crooked Hillary would be even worse. #MAGA";;;#MAGA;"757577508346888192";https://twitter.com/realDonaldTrump/status/757577508346888192
;2016/07/25;7939;28766;"The State of Florida is so embarrassed by the antics of Crooked Hillary Clinton and Debbie Wasserman Schultz that they will vote for CHANGE!";;;;"757576490213146624";https://twitter.com/realDonaldTrump/status/757576490213146624
;2016/07/25;11726;40861;"Wow, the Republican Convention went so smoothly compared to the Dems total mess. But fear not, the dishonest media will find a good spinnnn!";;;;"757573051215147008";https://twitter.com/realDonaldTrump/status/757573051215147008
;2016/07/25;9303;29641;"Here we go again with another Clinton scandal, and e-mails yet (can you believe). Crooked Hillary knew the fix was in, B never had a chance!";;;;"757571837463240704";https://twitter.com/realDonaldTrump/status/757571837463240704
;2016/07/25;8971;27037;"Crooked Hillary Clinton knew everything that her "servant" was doing at the DNC - they just got caught, that's all! They laughed at Bernie.";;;;"757565892146454532";https://twitter.com/realDonaldTrump/status/757565892146454532
;2016/07/25;5265;19688;"If Bernie Sanders, after seeing the just released e-mails, continues to look exhausted and done, then his legacy will never be the same.";;;;"757552876348645377";https://twitter.com/realDonaldTrump/status/757552876348645377
;2016/07/25;16987;49297;"Thank you! #MakeAmericaGreatAgainpic.twitter.com/Pzs9uwgzam";;;#MakeAmericaGreatAgainpic;"757552713873891328";https://twitter.com/realDonaldTrump/status/757552713873891328
;2016/07/25;7463;25883;"Hillary was involved in the e-mail scandal because she is the only one with judgement so bad that such a thing could have happened!";;;;"757546442240167936";https://twitter.com/realDonaldTrump/status/757546442240167936
;2016/07/25;6966;23753;"How much BAD JUDGEMENT was on display by the people in DNC in writing those really dumb e-mails, using even religion, against Bernie!";;;;"757545252026712064";https://twitter.com/realDonaldTrump/status/757545252026712064
;2016/07/25;10183;31822;"The new joke in town is that Russia leaked the disastrous DNC e-mails, which should never have been written (stupid), because Putin likes me";;;;"757538729170964481";https://twitter.com/realDonaldTrump/status/757538729170964481
;2016/07/24;9854;32429;"Watched Crooked Hillary Clinton and Tim Kaine on 60 Minutes. No way they are going to fix America's problems. ISIS & all others laughing!";;;;"757364534873128960";https://twitter.com/realDonaldTrump/status/757364534873128960
;2016/07/24;5894;28850;"The ratings for the Republican National Convention were very good, but for the final night, my speech, great. Thank you!";;;;"757361504895246336";https://twitter.com/realDonaldTrump/status/757361504895246336
;2016/07/24;9340;29720;"The highly neurotic Debbie Wasserman Schultz is angry that, after stealing and cheating her way to a Crooked Hillary victory, she's out!";;;;"757343025983057922";https://twitter.com/realDonaldTrump/status/757343025983057922
;2016/07/24;12888;34305;"The Democrats are in a total meltdown but the biased media will say how great they are doing! E-mails say the rigged system is alive & well!";;;;"757338816487235584";https://twitter.com/realDonaldTrump/status/757338816487235584
;2016/07/24;7966;27671;"Even though Bernie Sanders has lost his energy and his strength, I don't believe that his supporters will let Crooked Hillary off the hook!";;;;"757336511436075008";https://twitter.com/realDonaldTrump/status/757336511436075008
;2016/07/24;5417;19388;"Crooked Hillary Clinton was not at all loyal to the person in her rigged system that pushed her over the top, DWS. Too bad Bernie flamed out";;;;"757335224397225984";https://twitter.com/realDonaldTrump/status/757335224397225984
;2016/07/24;11122;31768;"If the Republican Convention had blown up with e-mails, resignation of boss and the beat down of a big player. (Bernie), media would go wild";;;;"757332905047752704";https://twitter.com/realDonaldTrump/status/757332905047752704
;2016/07/24;9217;30226;"The @CNN panels are so one sided, almost all against Trump. @FoxNews is so much better and the ratings are much higher. Don't watch CNN!";;@CNN @FoxNews;;"757315800466272256";https://twitter.com/realDonaldTrump/status/757315800466272256
;2016/07/24;7331;24458;"I always said that Debbie Wasserman Schultz was overrated. The Dems Convention is cracking up and Bernie is exhausted, no energy left!";;;;"757311921095925760";https://twitter.com/realDonaldTrump/status/757311921095925760
;2016/07/24;6953;23795;"Today proves what I have always known, that @Reince Priebus is the tough one and the smart one, not Debbie Wasserman Shultz ( @DWStweets.)";;@Reince @DWStweets;;"757309616254545920";https://twitter.com/realDonaldTrump/status/757309616254545920
;2016/07/24;9366;28423;"Sorry folks, but Bernie Sanders is exhausted, just can't go on any longer. He is trying to dismiss the new e-mails and DNC disrespect. SAD!";;;;"757206444148158464";https://twitter.com/realDonaldTrump/status/757206444148158464
;2016/07/24;8885;26667;"There is no longer a Bernie Sanders "political revolution." He is turning out to be a weak and somewhat pathetic figure,wants it all to end!";;;;"757205678821928960";https://twitter.com/realDonaldTrump/status/757205678821928960
;2016/07/24;10746;28423;"An analysis showed that Bernie Sanders would have won the Democratic nomination if it were not for the Super Delegates.";;;;"757191160481873920";https://twitter.com/realDonaldTrump/status/757191160481873920
;2016/07/24;6531;21014;"Looks like the Bernie people will fight. If not, their BLOOD, SWEAT AND TEARS was a total waste of time. Kaine stands for opposite!";;;;"757187537681154048";https://twitter.com/realDonaldTrump/status/757187537681154048
;2016/07/24;33200;86538;"Wow, President Obama's brother, Malik, just announced that he is voting for me. Was probably treated badly by president-like everybody else!";;;;"757182723089895424";https://twitter.com/realDonaldTrump/status/757182723089895424
;2016/07/24;5582;19413;"Bernie Sanders started off strong, but with the selection of Kaine for V.P., is ending really weak. So much for a movement! TOTAL DISRESPECT";;;;"757174767547977728";https://twitter.com/realDonaldTrump/status/757174767547977728
;2016/07/24;6612;23432;"The Crooked Hillary V.P. choice is VERY disrespectful to Bernie Sanders and all of his supporters. Just another case of BAD JUDGEMENT by H!";;;;"757172536882913280";https://twitter.com/realDonaldTrump/status/757172536882913280
;2016/07/23;8014;23195;"#MakeAmericaGreatAgain #TrumpPence16pic.twitter.com/gCzHX1nyxD";;;#MakeAmericaGreatAgain #TrumpPence16pic;"757012114460569604";https://twitter.com/realDonaldTrump/status/757012114460569604
;2016/07/23;6188;15440;"" @NancyNielsenn: @realDonaldTrump Dinesh D'Sousa Hillary's America. see it"";;@NancyNielsenn @realDonaldTrump;;"756975589110779904";https://twitter.com/realDonaldTrump/status/756975589110779904
;2016/07/23;5830;12391;"" @OliMauritania: @realDonaldTrump Kaine supported the stupidest deal in the history of deals http://www.breitbart.com/big-government/2016/07/22/tim-kaine-boycotted-netanyahus-iran-deal-speech/ … #HillaryKaine2016"";;@OliMauritania @realDonaldTrump;#HillaryKaine2016;"756974970312462336";https://twitter.com/realDonaldTrump/status/756974970312462336
;2016/07/23;6758;32093;"Thank you to everyone for the wonderful reviews of my speech on Thursday night. From the heart!";;;;"756973646216884225";https://twitter.com/realDonaldTrump/status/756973646216884225
;2016/07/23;14396;35781;"The Wikileaks e-mail release today was so bad to Sanders that it will make it impossible for him to support her, unless he is a fraud!";;;;"756962332228612096";https://twitter.com/realDonaldTrump/status/756962332228612096
;2016/07/23;9371;31305;"Just saw Crooked Hillary and Tim Kaine together. ISIS and our other enemies are drooling. They don't look presidential to me!";;;;"756952917152784384";https://twitter.com/realDonaldTrump/status/756952917152784384
;2016/07/23;10138;34069;"I will bring jobs back and get wages up. People haven't had a real wage increase in almost twenty years. Clinton killed jobs!";;;;"756883131685273605";https://twitter.com/realDonaldTrump/status/756883131685273605
