username;date;retweets;favorites;text;geo;mentions;hashtags;id;permalink
;2016/08/06;8748;28748;"Heading to New Hampshire - will be talking about Hillary saying her brain SHORT CIRCUITED, and other things!";;;;"761988164382756864";https://twitter.com/realDonaldTrump/status/761988164382756864
;2016/08/06;13459;36032;"Anybody whose mind "SHORT CIRCUITS" is not fit to be our president! Look up the word "BRAINWASHED."";;;;"761936929902452740";https://twitter.com/realDonaldTrump/status/761936929902452740
;2016/08/06;13682;38678;"Crooked Hillary said loudly, and for the world to see, that she "SHORT CIRCUITED" when answering a question on her e-mails. Very dangerous!";;;;"761931010548305920";https://twitter.com/realDonaldTrump/status/761931010548305920
;2016/08/06;9483;33568;"Hillary Clinton is being badly criticized for her poor performance in answering questions. Let us all see what happens!";;;;"761892829434183684";https://twitter.com/realDonaldTrump/status/761892829434183684
;2016/08/05;10422;34719;"Good luck #TeamUSA #OpeningCeremony #Rio2016pic.twitter.com/mS8qsQpJPh";;;#TeamUSA #OpeningCeremony #Rio2016pic;"761773576101953536";https://twitter.com/realDonaldTrump/status/761773576101953536
;2016/08/05;8315;19837;"'Trump is right about violent crime: It’s on the rise in major cities'https://www.washingtonpost.com/opinions/trump-is-right-about-violent-crime-its-on-the-rise-in-major-cities/2016/08/05/3cf6b55e-5b11-11e6-9aee-8075993d73a2_story.html …";;;;"761757988516401153";https://twitter.com/realDonaldTrump/status/761757988516401153
;2016/08/05;5569;19688;"Thank you Green Bay, Wisconsin! Governor @Mike_Pence and I will be back soon. #TrumpPence16 #MAGApic.twitter.com/qsYbyrm3UR";;@Mike_Pence;#TrumpPence16 #MAGApic;"761754898602061824";https://twitter.com/realDonaldTrump/status/761754898602061824
;2016/08/05;18023;32437;"DON'T LET HILLARY CLINTON DO IT AGAIN! #TrumpPence16https://amp.twimg.com/v/42d9c3c3-e924-4a5b-b8a9-540ec3d21654 …";;;#TrumpPence16https;"761711856457125888";https://twitter.com/realDonaldTrump/status/761711856457125888
;2016/08/05;5813;19682;"Thank you Des Moines, Iowa! Governor @Mike_Pence and I appreciate your support! #MAGA #TrumpTrainpic.twitter.com/gr6tGqqmcm";;@Mike_Pence;#MAGA #TrumpTrainpic;"761693803120041986";https://twitter.com/realDonaldTrump/status/761693803120041986
;2016/08/05;14666;28935;"#MakeAmericaSafeAgainpic.twitter.com/5yuLKyh8Q6";;;#MakeAmericaSafeAgainpic;"761653875413618689";https://twitter.com/realDonaldTrump/status/761653875413618689
;2016/08/05;9061;25978;"Hillary Clinton has bad judgment and is unfit to serve as President. http://bit.ly/2aDkmmiDJTFB ";;;;"761549461893984256";https://twitter.com/realDonaldTrump/status/761549461893984256
;2016/08/05;8632;27045;"The plane I saw on television was the hostage plane in Geneva, Switzerland, not the plane carrying $400 million in cash going to Iran!";;;;"761511930238496772";https://twitter.com/realDonaldTrump/status/761511930238496772
;2016/08/04;12537;32753;"President Obama refuses to answer question about Iran terror funding. I won't dodge questions as your President. http://ntknetwork.com/obama-spends-7-minutes-dodging-on-whether-iran-will-use-400-million-to-fund-terrorism/ …";;;;"761386080272875520";https://twitter.com/realDonaldTrump/status/761386080272875520
;2016/08/04;13126;36771;"Obama's disastrous judgment gave us ISIS, rise of Iran, and the worst economic numbers since the Great Depression!";;;;"761386025323225088";https://twitter.com/realDonaldTrump/status/761386025323225088
;2016/08/04;11790;34375;"President Obama should ask the DNC about how they rigged the election against Bernie.";;;;"761385812390977536";https://twitter.com/realDonaldTrump/status/761385812390977536
;2016/08/04;4231;13667;"See you tomorrow w/ Gov. @Mike_Pence, Iowa & Wisconsin! 3pm- http://bit.ly/2aLiY9zDesMoines … 7pm- http://bit.ly/2axymdaGreenBay pic.twitter.com/UODSMp0oTo";;@Mike_Pence;;"761385317169496064";https://twitter.com/realDonaldTrump/status/761385317169496064
;2016/08/04;5428;18008;"Thank you Portland, Maine! #MakeAmericaGreatAgain https://instagram.com/p/BIs_qmQjnRA/ pic.twitter.com/RhblAXkNPw";;;#MakeAmericaGreatAgain;"761331433810132992";https://twitter.com/realDonaldTrump/status/761331433810132992
;2016/08/04;10510;34604;"Happy 226th Birthday to the United States Coast Guard. Thank you @USCG! #CoastGuardDaypic.twitter.com/hr4O8Xgq2R";;@USCG;#CoastGuardDaypic;"761281473492189184";https://twitter.com/realDonaldTrump/status/761281473492189184
;2016/08/04;5884;19285;"Great meeting all of you. This group knocked on 50K doors & counting here in Maine, thank you! @MaineGOPhttps://twitter.com/garrettmason/status/761277330543239168 …";;@MaineGOPhttps;;"761279538106097664";https://twitter.com/realDonaldTrump/status/761279538106097664
;2016/08/04;5705;18301;"Looking forward to IA & WI with Gov. Pence, tomorrow. Join us! #MAGA http://bit.ly/2aLiY9zDesMoines … http://bit.ly/2axymdaGreenBay pic.twitter.com/0Ei3EdQdXB";;;#MAGA;"761219396635361280";https://twitter.com/realDonaldTrump/status/761219396635361280
;2016/08/03;7385;23294;"Thank you Jacksonville, Florida! #MakeAmericaGreatAgain https://www.facebook.com/DonaldTrump/posts/10157433142040725:0 …pic.twitter.com/VSnBoQYoZs";;;#MakeAmericaGreatAgain;"761025834350018561";https://twitter.com/realDonaldTrump/status/761025834350018561
;2016/08/03;5689;20248;"Thank you for your support of my candidacy! #MAGA #ImWithYou http://bit.ly/2aRqNxjThankYou ";;;#MAGA #ImWithYou;"760976212068106240";https://twitter.com/realDonaldTrump/status/760976212068106240
;2016/08/03;10184;34477;"Thank you to the amazing law enforcement officers today- in Daytona Beach, Florida! #LESM #MAGApic.twitter.com/QoxJf4Xzbc";;;#LESM #MAGApic;"760960985524043777";https://twitter.com/realDonaldTrump/status/760960985524043777
;2016/08/03;7426;23363;"THANK YOU Daytona Beach, Florida! #MakeAmericaGreatAgainpic.twitter.com/IAcLfXe463";;;#MakeAmericaGreatAgainpic;"760957697579708416";https://twitter.com/realDonaldTrump/status/760957697579708416
;2016/08/03;19829;47628;"Our incompetent Secretary of State, Hillary Clinton, was the one who started talks to give 400 million dollars, in cash, to Iran. Scandal!";;;;"760783130978648064";https://twitter.com/realDonaldTrump/status/760783130978648064
;2016/08/03;13359;48058;"There is great unity in my campaign, perhaps greater than ever before. I want to thank everyone for your tremendous support. Beat Crooked H!";;;;"760765818917515264";https://twitter.com/realDonaldTrump/status/760765818917515264
;2016/08/02;5465;24771;"Great day in Virginia. Crowd was fantastic!";;;;"760669268539301889";https://twitter.com/realDonaldTrump/status/760669268539301889
;2016/08/02;6037;27157;"My daughter @IvankaTrump will be on @Greta tonight at 7pm. Enjoy!pic.twitter.com/QySC5PLFMy";;@IvankaTrump @Greta;;"760594155835887616";https://twitter.com/realDonaldTrump/status/760594155835887616
;2016/08/02;10952;20816;"Report raises questions about ‘Clinton Cash’ from Russians during ‘reset'http://nypost.com/2016/07/31/report-raises-questions-about-clinton-cash-from-russians-during-reset/ …";;;;"760560366447370241";https://twitter.com/realDonaldTrump/status/760560366447370241
;2016/08/02;29607;78996;"President Obama will go down as perhaps the worst president in the history of the United States!";;;;"760552601356267520";https://twitter.com/realDonaldTrump/status/760552601356267520
;2016/08/02;8171;14409;"#ICYMI: John Podesta’s Brother Pocketed $180,000 from Putin’s Uranium Company: https://www.facebook.com/DonaldTrump/posts/10157422221965725 …pic.twitter.com/I5fF3didZs";;;#ICYMI;"760542646888652804";https://twitter.com/realDonaldTrump/status/760542646888652804
;2016/08/02;13423;27229;"#CrookedHillarypic.twitter.com/xe0I0EmxMa";;;#CrookedHillarypic;"760538951581130754";https://twitter.com/realDonaldTrump/status/760538951581130754
;2016/08/02;3504;10222;"Join me in Florida tomorrow! #MakeAmericaGreatAgain Daytona | 3pm- http://bit.ly/2apZfbvDAYTONA  Jacksonville | 7pm- http://bit.ly/2aq0jQ3JACKSONVILLE …";;;#MakeAmericaGreatAgain;"760535661699035136";https://twitter.com/realDonaldTrump/status/760535661699035136
;2016/08/02;7472;16522;"STATEMENT IN RESPONSE TO PRESIDENT OBAMA'S FAILED LEADERSHIP: http://bit.ly/2aNb6apDJTStatement …";;;;"760532443061420033";https://twitter.com/realDonaldTrump/status/760532443061420033
;2016/08/02;5013;17447;"Thank you Virginia! #ImWithYoupic.twitter.com/9inCh1BVwM";;;#ImWithYoupic;"760519847461658624";https://twitter.com/realDonaldTrump/status/760519847461658624
;2016/08/02;26411;50326;"The Washington Post calls out #CrookedHillary for what she REALLY is. A PATHOLOGICAL LIAR! Watch that nose grow!pic.twitter.com/FsrUGByuuD";;;#CrookedHillary;"760420894271471620";https://twitter.com/realDonaldTrump/status/760420894271471620
;2016/08/01;15810;62284;"Great afternoon in Ohio & a great evening in Pennsylvania - departing now. See you tomorrow Virginia!pic.twitter.com/jQTQYBFpdb";;;;"760299757206208512";https://twitter.com/realDonaldTrump/status/760299757206208512
;2016/08/01;7147;24620;"Just leaving Mechanicsburg, PA. Incredible crowd-- so enthusiastic! Will be back soon. #MAGApic.twitter.com/RbuXfDZ5w9";;;#MAGApic;"760293742381244416";https://twitter.com/realDonaldTrump/status/760293742381244416
;2016/08/01;8461;26962;"Vast numbers of manufacturing jobs in Pennsylvania have moved to Mexico and other countries. That will end when I win!";;;;"760287440435187712";https://twitter.com/realDonaldTrump/status/760287440435187712
;2016/08/01;5176;16636;"Thanks to @pnehlen for your kind words, very much appreciated.";;@pnehlen;;"760255085561597952";https://twitter.com/realDonaldTrump/status/760255085561597952
;2016/08/01;3890;11569;"Join me in Florida on Wednesday! Daytona & Jacksonville: Daytona | 3pm- https://www.donaldjtrump.com/schedule/register/daytona-beach-fl/ … Jacksonville | 7pm- https://www.donaldjtrump.com/schedule/register/jacksonville-fl/ …";;;;"760249495754006528";https://twitter.com/realDonaldTrump/status/760249495754006528
;2016/08/01;10613;20540;"During the GOP convention, CNN cut away from the victims of illegal immigrant violence. They don’t want them heard.http://www.breitbart.com/big-journalism/2016/07/19/republican-national-convention-cnn-victims-illegal-aliens/ …";;;;"760247348673077248";https://twitter.com/realDonaldTrump/status/760247348673077248
;2016/08/01;11969;28479;"When will CNN do a segment on Hillary’s plan to increase Syrian refugees 550% and how much it will cost?";;;;"760246898095775744";https://twitter.com/realDonaldTrump/status/760246898095775744
;2016/08/01;11000;26838;"Hillary Clinton raked in money from regimes that horribly oppress women and gays & refuses to speak out against Radical Islam.";;;;"760246732152311808";https://twitter.com/realDonaldTrump/status/760246732152311808
;2016/08/01;12963;23790;"Hillary, whose decisions have led to the deaths of many, accepted $ from a business linked to ISIS. Silence at CNN.http://www.thegatewaypundit.com/2016/08/wikileaks-hillary/ …";;;;"760245342231158785";https://twitter.com/realDonaldTrump/status/760245342231158785
;2016/08/01;16459;36201;"Crooked Hillary Clinton is 100% owned by her donors. #ImWithYou #MAGApic.twitter.com/iYM3CCWS2z";;;#ImWithYou #MAGApic;"760229355784138752";https://twitter.com/realDonaldTrump/status/760229355784138752
;2016/08/01;4836;17442;"Thank you Columbus, Ohio! I will be back soon. #ImWithYou #MAGApic.twitter.com/vMf1EPJp4r";;;#ImWithYou #MAGApic;"760214225830772737";https://twitter.com/realDonaldTrump/status/760214225830772737
;2016/08/01;9044;25798;"Thank you Oklahoma & Virginia! #MakeAmericaGreatAgain #ImWithYoupic.twitter.com/WUdY7feRvV";;;#MakeAmericaGreatAgain #ImWithYoupic;"760213628926779392";https://twitter.com/realDonaldTrump/status/760213628926779392
;2016/08/01;9236;29289;"People believe CNN these days almost as little as they believe Hillary....that's really saying something!";;;;"760185303483187201";https://twitter.com/realDonaldTrump/status/760185303483187201
;2016/08/01;7827;22950;"The people who support Hillary sit behind CNN anchor chairs, or headline fundraisers - those disconnected from real life.";;;;"760185067054465024";https://twitter.com/realDonaldTrump/status/760185067054465024
;2016/08/01;11302;32410;"Will CNN send its cameras to the border to show the massive unreported crisis now unfolding -- or are they worried it will hurt Hillary?";;;;"760184664468418560";https://twitter.com/realDonaldTrump/status/760184664468418560
;2016/08/01;12400;30527;"When will we see stories from CNN on Clinton Foundation corruption and Hillary's pay-for-play at State Department?";;;;"760184336603811842";https://twitter.com/realDonaldTrump/status/760184336603811842
;2016/08/01;7923;25353;"CNN anchors are completely out of touch with everyday people worried about rising crime, failing schools and vanishing jobs.";;;;"760184176591208448";https://twitter.com/realDonaldTrump/status/760184176591208448
;2016/08/01;9608;28045;"CNN will soon be the least trusted name in news if they continue to be the press shop for Hillary Clinton.";;;;"760184028293173248";https://twitter.com/realDonaldTrump/status/760184028293173248
;2016/08/01;3699;12062;"Join Governor Mike Pence in Reno, Nevada- tonight at 7pm! Tickets available at: https://www.donaldjtrump.com/schedule/register/reno-nv1/ …";;;;"760126146830794753";https://twitter.com/realDonaldTrump/status/760126146830794753
;2016/08/01;8646;19286;"#CrookedHillaryhttp://www.dailymail.co.uk/news/article-3718137/Hillary-Clinton-slapped-dreaded-Four-Pinocchios-rating-false-claim-FBI-director-said-told-truth-classified-emails.html …";;;#CrookedHillaryhttp;"760125021280960512";https://twitter.com/realDonaldTrump/status/760125021280960512
;2016/08/01;6598;20992;"So with all of the Obama tough talk on Russia and the Ukraine, they have already taken Crimea and continue to push. That's what I said!";;;;"760098514319835136";https://twitter.com/realDonaldTrump/status/760098514319835136
;2016/08/01;5848;18732;"When I said in an interview that Putin is "not going into Ukraine, you can mark it down," I am saying if I am President. Already in Crimea!";;;;"760095370185674752";https://twitter.com/realDonaldTrump/status/760095370185674752
;2016/08/01;12241;34637;"This story is not about Mr. Khan, who is all over the place doing interviews, but rather RADICAL ISLAMIC TERRORISM and the U.S. Get smart!";;;;"760074526059270144";https://twitter.com/realDonaldTrump/status/760074526059270144
;2016/08/01;8757;27886;"Mr. Khan, who does not know me, viciously attacked me from the stage of the DNC and is now all over T.V. doing the same - Nice!";;;;"760070280932982784";https://twitter.com/realDonaldTrump/status/760070280932982784
;2016/07/31;14429;45040;"Wow, it is unbelievable how distorted, one-sided and biased the media is against us. The failing @nytimes is a joke. @CNN is laughable!";;@nytimes @CNN;;"759915863600304128";https://twitter.com/realDonaldTrump/status/759915863600304128
;2016/07/31;13852;35257;"" @RealJamesWoods: Without absolutely OWNING the liberal media, HillaryClinton wouldn't stand a chance. #VoterFraud and #MSM her only hope."";;@RealJamesWoods;#VoterFraud #MSM;"759848885900763141";https://twitter.com/realDonaldTrump/status/759848885900763141
;2016/07/31;10026;37545;"The dishonest media is fawning over the Democratic Convention. I wonder why, then, my speech had millions of more viewers than Crooked H?";;;;"759843323909668865";https://twitter.com/realDonaldTrump/status/759843323909668865
;2016/07/31;18818;56765;"I was viciously attacked by Mr. Khan at the Democratic Convention. Am I not allowed to respond? Hillary voted for the Iraq war, not me!";;;;"759743648573435905";https://twitter.com/realDonaldTrump/status/759743648573435905
;2016/07/31;15358;44203;"Captain Khan, killed 12 years ago, was a hero, but this is about RADICAL ISLAMIC TERROR and the weakness of our "leaders" to eradicate it!";;;;"759734698415312897";https://twitter.com/realDonaldTrump/status/759734698415312897
;2016/07/30;12182;41059;"Nielson Media Research final numbers on ACCEPTANCE SPEECH: TRUMP 32.2 MILLION. CLINTON 27.8 MILLION. Thank you!";;;;"759592590106849280";https://twitter.com/realDonaldTrump/status/759592590106849280
;2016/07/30;10898;44277;"Thank you to all of the television viewers that made my speech at the Republican National Convention #1 over Crooked Hillary and DEMS.";;;#1;"759524001613918208";https://twitter.com/realDonaldTrump/status/759524001613918208
;2016/07/30;10162;31892;"Can you imagine if I had the small crowds that Hillary is drawing today in Pennsylvania. It would be a major media event! @CNN @FoxNews";;@CNN @FoxNews;;"759516008272932864";https://twitter.com/realDonaldTrump/status/759516008272932864
;2016/07/30;7555;18422;"NATO commander agrees members should pay up via @dcexaminer:http://www.washingtonexaminer.com/nato-commander-agrees-members-should-pay-up/article/2598183?custom_click=rss …";;@dcexaminer;;"759515080010719232";https://twitter.com/realDonaldTrump/status/759515080010719232
;2016/07/30;11662;36407;"Wow, NATO's top commander just announced that he agrees with me that alliance members must PAY THEIR BILLS. This is a general I will like!";;;;"759513644258525184";https://twitter.com/realDonaldTrump/status/759513644258525184
;2016/07/30;8861;26822;"The "Rust Belt" was created by politicians like the Clintons who allowed our jobs to be stolen from us by other countries like Mexico. END!";;;;"759512042906587137";https://twitter.com/realDonaldTrump/status/759512042906587137
;2016/07/30;10178;29753;"Crooked's stop in Johnstown, Pennsylvania, where jobs have been absolutely decimated by dumb politicians, drew less than 200 - with Bill, VP";;;;"759509936002957314";https://twitter.com/realDonaldTrump/status/759509936002957314
;2016/07/30;10261;25284;"#CrookedHillary = Obama's third term, which would be terrible news for our economic growth - seen below.pic.twitter.com/y9WJoUaaql";;;#CrookedHillary;"759507812963737600";https://twitter.com/realDonaldTrump/status/759507812963737600
;2016/07/30;8415;27163;"Word is that Crooked Hillary has very small and unenthusiastic crowds in Pennsylvania. Perhaps it is because her husband signed NAFTA?";;;;"759506712516784128";https://twitter.com/realDonaldTrump/status/759506712516784128
;2016/07/30;12077;34526;"I turned down a meeting with Charles and David Koch. Much better for them to meet with the puppets of politics, they will do much better!";;;;"759479059046883328";https://twitter.com/realDonaldTrump/status/759479059046883328
;2016/07/30;8136;27357;"Why doesn't the media want to report that on the two "Big Thursdays" when Crooked Hillary and I made our speeches - Republican's won ratings";;;;"759477522232901632";https://twitter.com/realDonaldTrump/status/759477522232901632
;2016/07/30;10574;21844;"#CrookedHillarypic.twitter.com/xyoPFJmByp";;;#CrookedHillarypic;"759457253925785604";https://twitter.com/realDonaldTrump/status/759457253925785604
;2016/07/30;9501;28055;"Crooked Hillary Clinton is soft on crime, supports open borders, and wants massive tax hikes. A formula for disaster!";;;;"759450265208651776";https://twitter.com/realDonaldTrump/status/759450265208651776
;2016/07/30;9097;29033;"Violent crime is rising across the United States, yet the DNC convention ignored it. Crime reduction will be one of my top priorities.";;;;"759450053379579905";https://twitter.com/realDonaldTrump/status/759450053379579905
;2016/07/30;5267;22806;"Just got back from Colorado. The love and enthusiasm at two rallies was incredible. Big crowds!";;;;"759425642723246084";https://twitter.com/realDonaldTrump/status/759425642723246084
;2016/07/30;4003;12586;"While I am in OH & PA - you can also join @Mike_Pence in Nevada on Mon! Carson City: https://www.donaldjtrump.com/schedule/register/carson-city-nv/ … Reno: https://www.donaldjtrump.com/schedule/register/reno-nv1/ …";;@Mike_Pence;;"759393092554424320";https://twitter.com/realDonaldTrump/status/759393092554424320
;2016/07/30;3783;11316;"Join me Monday in Columbus, Ohio & Harrisburg, Pennsylvania! #MAGA 3pm in OH: https://www.donaldjtrump.com/schedule/register/columbus-oh1/ … 7pm in PA: https://www.donaldjtrump.com/schedule/register/harrisburg-pa1/ …";;;#MAGA;"759389559385952257";https://twitter.com/realDonaldTrump/status/759389559385952257
;2016/07/30;10848;28477;"American homeownership rate in Q2 2016 was 62.9% - lowest rate in 51yrs. WE will bring back the 'American Dream!'pic.twitter.com/yI4Q8FHRjp";;;;"759381869267980288";https://twitter.com/realDonaldTrump/status/759381869267980288
;2016/07/30;9261;27648;"We are suffering through the worst long-term unemployment in the last 70 years. I want change - Crooked Hillary Clinton does not.";;;;"759372422692954112";https://twitter.com/realDonaldTrump/status/759372422692954112
;2016/07/30;8097;24731;"Hillary can never win over Bernie supporters. Her foreign wars, NAFTA/TPP support & Wall Street ties are driving away millions of votes.";;;;"759371648764108801";https://twitter.com/realDonaldTrump/status/759371648764108801
;2016/07/30;4926;19472;"Colorado was amazing yesterday! So much support. Our tax, trade and energy reforms will bring great jobs to Colorado and the whole country.";;;;"759371377002553344";https://twitter.com/realDonaldTrump/status/759371377002553344
;2016/07/29;12447;33213;"" @patrioticpepe: @realDonaldTrump ONLY TRUMP CAN UNITE AMERICA AND FIX OBAMA'S MISTAKES!!! #Trump2016 https://twitter.com/patrioticpepe/status/759021890107166721/photo/1pic.twitter.com/yB72Bm2muM "";;@patrioticpepe @realDonaldTrump;#Trump2016;"759282300135809024";https://twitter.com/realDonaldTrump/status/759282300135809024
;2016/07/29;5200;17781;"Thank you Denver, Colorado! #MakeAmericaGreatAgain!pic.twitter.com/1KHrLdkOyW";;;#MakeAmericaGreatAgain;"759227755494072320";https://twitter.com/realDonaldTrump/status/759227755494072320
;2016/07/29;15608;39711;"As usual, Hillary & the Dems are trying to rig the debates so 2 are up against major NFL games. Same as last time w/ Bernie. Unacceptable!";;;;"759222916387069952";https://twitter.com/realDonaldTrump/status/759222916387069952
;2016/07/29;16796;35099;"#CrookedHillary Job Applicationpic.twitter.com/CKXkAlGSiV";;;#CrookedHillary;"759192213234393088";https://twitter.com/realDonaldTrump/status/759192213234393088
;2016/07/29;11814;38080;"Hillary Clinton should not be given national security briefings in that she is a lose cannon with extraordinarily bad judgement & insticts.";;;;"759191265988653056";https://twitter.com/realDonaldTrump/status/759191265988653056
;2016/07/29;9710;30231;"Thank you to the amazing law enforcement officers in Colorado! #MakeAmericaGreatAgain #LESMpic.twitter.com/glxTQYAQiN";;;#MakeAmericaGreatAgain #LESMpic;"759185456818860032";https://twitter.com/realDonaldTrump/status/759185456818860032
;2016/07/29;7575;23233;"Thank you Colorado Springs. Get out & VOTE #TrumpPence16 in November!pic.twitter.com/wK02fWzJey";;;#TrumpPence16;"759152897602916352";https://twitter.com/realDonaldTrump/status/759152897602916352
;2016/07/29;8608;21581;""Only a Reagan or a Trump-like figure in the White House will achieve this goal."http://www.cnbc.com/2016/07/29/we-need-a-tough-negotiator-like-trump-to-fix-us-trade-policy-commentary.html …";;;;"759117301517996032";https://twitter.com/realDonaldTrump/status/759117301517996032
;2016/07/29;7676;22322;"Even Bill is tired of the lies, SAD! https://www.instagram.com/p/BIdHmRbjEp0/ ";;;;"759093740497764353";https://twitter.com/realDonaldTrump/status/759093740497764353
;2016/07/29;3062;10317;"Join me in Colorado Springs at 2pm- or in Denver tonight at 7pm! Colorado Springs: https://www.donaldjtrump.com/schedule/register/colorado-springs-co/ … Denver: https://www.donaldjtrump.com/schedule/register/denver-co1/ …";;;;"759088844683608064";https://twitter.com/realDonaldTrump/status/759088844683608064
;2016/07/29;21263;41299;"What Bernie Sanders really thinks of Crooked Hillary Clinton.pic.twitter.com/VgMaAsZBep";;;;"759084522705068032";https://twitter.com/realDonaldTrump/status/759084522705068032
;2016/07/29;6705;24671;"I am watching Crooked Hillary speak. Same old stuff, our country needs change!";;;;"759082026687352834";https://twitter.com/realDonaldTrump/status/759082026687352834
;2016/07/29;10178;35186;"Wow, my campaign is hearing from more and more Bernie supporters that they will NEVER support Crooked Hillary. She sold them out, V.P. pick!";;;;"759071976182861824";https://twitter.com/realDonaldTrump/status/759071976182861824
;2016/07/29;12524;26027;"In Hillary Clinton's America - things get worse. #TrumpPence16pic.twitter.com/WdHbnhhCbW";;;#TrumpPence16pic;"759070976181084160";https://twitter.com/realDonaldTrump/status/759070976181084160
;2016/07/29;8137;29250;"The dishonest media didn't mention that Bernie Sanders was very angry looking during Crooked's speech. He wishes he didn't make that deal!";;;;"759070106546638849";https://twitter.com/realDonaldTrump/status/759070106546638849
;2016/07/29;6447;22061;"Thank you! Facebook: https://www.facebook.com/DonaldTrump/posts/10157391232965725:0 … Instagram: https://instagram.com/p/BIc8Oz2DCCo/ pic.twitter.com/Pw7GS8R9Gg";;;;"759064533814038528";https://twitter.com/realDonaldTrump/status/759064533814038528
;2016/07/29;16809;53419;"Crooked Hillary said that I "couldn't handle the rough and tumble of a political campaign." Really,I just beat 16 people and am beating her!";;;;"759029315006705664";https://twitter.com/realDonaldTrump/status/759029315006705664
;2016/07/29;6103;21632;"If Michael Bloomberg ran again for Mayor of New York, he wouldn't get 10% of the vote - they would run him out of town! #NeverHillary";;;#NeverHillary;"759027356434518016";https://twitter.com/realDonaldTrump/status/759027356434518016
