username;date;retweets;favorites;text;geo;mentions;hashtags;id;permalink
;2016/08/30;7521;22858;"Thank you North Carolina! #MAGApic.twitter.com/1oWrFnHe0u";;;#MAGApic;"770771735092142080";https://twitter.com/realDonaldTrump/status/770771735092142080
;2016/08/30;7857;21550;"Thank you America! #MAGA https://instagram.com/p/BJvyloZD0yo/ pic.twitter.com/ePJW9jLckM";;;#MAGA;"770724546454417408";https://twitter.com/realDonaldTrump/status/770724546454417408
;2016/08/30;3271;11948;"" @meequalsfree: Looking forward to seeing you again! Everett to be a packed house! @realDonaldTrump @mike_pence"";;@meequalsfree @realDonaldTrump @mike_pence;;"770573355191631873";https://twitter.com/realDonaldTrump/status/770573355191631873
;2016/08/30;11066;33415;"From day one I said that I was going to build a great wall on the SOUTHERN BORDER, and much more. Stop illegal immigration. Watch Wednesday!";;;;"770568584443539456";https://twitter.com/realDonaldTrump/status/770568584443539456
;2016/08/29;5036;13933;"Join me this Thursday in Wilmington, Ohio at noon! #ImWithYou Tickets: https://www.donaldjtrump.com/schedule/register/wilmington-oh/ …pic.twitter.com/fDAJl5wVGe";;;#ImWithYou;"770417590351040513";https://twitter.com/realDonaldTrump/status/770417590351040513
;2016/08/29;4659;12528;"Join me this Wednesday in Phoenix, Arizona at 6pm! #ImWithYou Tickets: https://www.donaldjtrump.com/schedule/register/phoenix-az2/ …pic.twitter.com/VwKnxo1TNQ";;;#ImWithYou;"770414693869649921";https://twitter.com/realDonaldTrump/status/770414693869649921
;2016/08/29;7681;20131;"#MakeAmericaGreatAgain #ImWithYoupic.twitter.com/IoYMdjvWHf";;;#MakeAmericaGreatAgain #ImWithYoupic;"770401822121005056";https://twitter.com/realDonaldTrump/status/770401822121005056
;2016/08/29;10391;24607;"We will repeal and replace the horrible disaster known as #Obamacare!pic.twitter.com/YzRTPrqrNC";;;#Obamacare;"770381482229657602";https://twitter.com/realDonaldTrump/status/770381482229657602
;2016/08/29;16215;30276;"#CrookedHillarypic.twitter.com/vXhcC8PaPy";;;#CrookedHillarypic;"770330631783972868";https://twitter.com/realDonaldTrump/status/770330631783972868
;2016/08/29;8838;27445;"Now that African-Americans are seeing what a bad job Hillary type policy and management has done to the inner-cities, they want TRUMP!";;;;"770253550639251456";https://twitter.com/realDonaldTrump/status/770253550639251456
;2016/08/29;7057;22185;"Crooked Hillary's brainpower is highly overrated.Probably why her decision making is so bad or, as stated by Bernie S, she has BAD JUDGEMENT";;;;"770252177512230912";https://twitter.com/realDonaldTrump/status/770252177512230912
;2016/08/29;10669;29852;"Does anyone know that Crooked Hillary, who tried so hard, was unable to pass the Bar Exams in Washington D.C. She was forced to go elsewhere";;;;"770250409843777536";https://twitter.com/realDonaldTrump/status/770250409843777536
;2016/08/29;4224;13592;"" @PMNOrlando: @realDonaldTrump I know of NO ONE voting for Crooked Hillary! Her rallies are held in (blank) & she still has room.";;@PMNOrlando @realDonaldTrump;;"770249086255661056";https://twitter.com/realDonaldTrump/status/770249086255661056
;2016/08/29;6761;15917;"" @RhondaR: Thank-You Clarence Henderson for telling @cnn you know racism & it's not DonaldTrump http://www.breitbart.com/video/2016/08/28/civil-rights-leader-clarence-henderson-backs-trump-america-is-a-business/ … via @BreitbartNews"";;@RhondaR @cnn @BreitbartNews;;"770248548571021312";https://twitter.com/realDonaldTrump/status/770248548571021312
;2016/08/29;6531;15644;"" @Patrici: Crowd at Trump Rally in Akron, Ohio is a Sea of Women, Minorities, Independents, Dems https://shar.es/1w66Vf  via @gatewaypundit";;@Patrici @gatewaypundit;;"770248186241900544";https://twitter.com/realDonaldTrump/status/770248186241900544
;2016/08/29;6726;20670;"Inner-city crime is reaching record levels. African-Americans will vote for Trump because they know I will stop the slaughter going on!";;;;"770247094439469058";https://twitter.com/realDonaldTrump/status/770247094439469058
;2016/08/29;6917;21969;"Look how bad it is getting! How much more crime, how many more shootings, will it take for African-Americans and Latinos to vote Trump=SAFE!";;;;"770245313345052673";https://twitter.com/realDonaldTrump/status/770245313345052673
;2016/08/28;10412;32837;"I will be making a major speech on ILLEGAL IMMIGRATION on Wednesday in the GREAT State of Arizona. Big crowds, looking for a larger venue.";;;;"770040258796855296";https://twitter.com/realDonaldTrump/status/770040258796855296
;2016/08/28;19453;51588;"I think that both candidates, Crooked Hillary and myself, should release detailed medical records. I have no problem in doing so! Hillary?";;;;"770039317142069248";https://twitter.com/realDonaldTrump/status/770039317142069248
;2016/08/28;8540;28335;"Today is the 53rd anniversary of the March on Washington - today we honor the enduring fight for justice, equality and opportunity.";;;;"770021252002119680";https://twitter.com/realDonaldTrump/status/770021252002119680
;2016/08/28;6170;20678;"Thank you Arizona! #VoteTrumppic.twitter.com/v8VLxdd0fO";;;#VoteTrumppic;"769898524439896064";https://twitter.com/realDonaldTrump/status/769898524439896064
;2016/08/28;4334;12144;"Join me Tuesday in Everett, Washington at the Xfinity Arena! Tickets: https://www.donaldjtrump.com/schedule/register/everett-wa/ …pic.twitter.com/sn08gnd0lq";;;;"769897797319532544";https://twitter.com/realDonaldTrump/status/769897797319532544
;2016/08/27;4739;15800;"" @LindaHarden: @realDonaldTrump America loves Trump and @mike_pence -- praying for you every day. Stay strong. #TrumpPence2016 #NeverHillary";;@LindaHarden @realDonaldTrump @mike_pence;#TrumpPence2016 #NeverHillary;"769740626497679360";https://twitter.com/realDonaldTrump/status/769740626497679360
;2016/08/27;12225;22172;"NATIONAL DEBT January 2009 = $10.6 TRILLION August 2016 = $19.4 TRILLIONpic.twitter.com/dKAVaLfGAJ";;;;"769724556949020672";https://twitter.com/realDonaldTrump/status/769724556949020672
;2016/08/27;7138;21187;"It was an honor to have the amazing Root family join me in Iowa. I have been so inspired by their courage & bravery.https://amp.twimg.com/v/d96463a2-c8f5-42a3-8865-065ba39beb30 …";;;;"769718184836472832";https://twitter.com/realDonaldTrump/status/769718184836472832
;2016/08/27;5830;18876;"Thank you Iowa! #ImWithYoupic.twitter.com/3BIF6jBTkk";;;#ImWithYoupic;"769647461459632128";https://twitter.com/realDonaldTrump/status/769647461459632128
;2016/08/27;4339;17360;"Just landed in Iowa to attend a great event in honor of wonderful Senator @JoniErnst. Look forward to being with all of my friends.";;@JoniErnst;;"769607369869266944";https://twitter.com/realDonaldTrump/status/769607369869266944
;2016/08/27;8946;30688;"My condolences to Dwyane Wade and his family, on the loss of Nykea Aldridge. They are in my thoughts and prayers.";;;;"769592508879892480";https://twitter.com/realDonaldTrump/status/769592508879892480
;2016/08/27;9187;27235;"Dwyane Wade's cousin was just shot and killed walking her baby in Chicago. Just what I have been saying. African-Americans will VOTE TRUMP!";;;;"769571710924263424";https://twitter.com/realDonaldTrump/status/769571710924263424
;2016/08/27;4530;10368;""@GoldJazz559: #BlackMenForBernie Leader: #Hillary2016 ‘No Regard For Black Race’ http://dailycaller.com/2016/06/06/black-men-for-bernie-leader-hillary-has-no-regard-for-the-black-race/ … via @dailycaller #BlacksForTrump";;@GoldJazz559 @dailycaller;#BlackMenForBernie #Hillary2016 #BlacksForTrump;"769554782151331840";https://twitter.com/realDonaldTrump/status/769554782151331840
;2016/08/27;9050;21798;"" @DiamondandSilk: Crooked Hillary getting desperate. On TV bashing Trump. @CNN, she forgot how she said a KKK member was her mentor.";;@DiamondandSilk @CNN;;"769552592158412800";https://twitter.com/realDonaldTrump/status/769552592158412800
;2016/08/27;11348;34049;"Heroin overdoses are taking over our children and others in the MIDWEST. Coming in from our southern border. We need strong border & WALL!";;;;"769539271678013440";https://twitter.com/realDonaldTrump/status/769539271678013440
;2016/08/26;11607;26258;"New polls - join the MOVEMENT today. http://www.DonaldJTrump.com  #ImWithYoupic.twitter.com/numII7W99T";;;#ImWithYoupic;"769331841316687873";https://twitter.com/realDonaldTrump/status/769331841316687873
;2016/08/26;4716;12287;"Join us via our new #AmericaFirst APP! #TrumpPence16 https://www.donaldjtrump.com/press-releases/trump-campaign-debuts-the-america-first-app1 …pic.twitter.com/0angXB2BrI";;;#AmericaFirst #TrumpPence16;"769323472048623616";https://twitter.com/realDonaldTrump/status/769323472048623616
;2016/08/26;7351;22908;"Will be in Phoenix, Arizona on Wednesday. Changing venue to much larger one. Demand is unreal. Polls looking great! #ImWithYou";;;#ImWithYou;"769322071297888257";https://twitter.com/realDonaldTrump/status/769322071297888257
;2016/08/26;5039;14225;"Thank you @TeamTrump Florida. Keep me updated, and lets get those 100,000 registered voters! #MakeAmericaGreatAgainhttps://twitter.com/trumpflorida16/status/768933465685458950 …";;@TeamTrump;#MakeAmericaGreatAgainhttps;"769311305480024065";https://twitter.com/realDonaldTrump/status/769311305480024065
;2016/08/26;2429;10392;"I will be interviewed by @kimguilfoyle at 7pm on @FoxNews. #Enjoy!";;@kimguilfoyle @FoxNews;#Enjoy;"769308316350623744";https://twitter.com/realDonaldTrump/status/769308316350623744
;2016/08/26;8389;16552;"Army training slide lists Hillary Clinton as insider threat:http://www.washingtonexaminer.com/army-slide-lists-clinton-as-insider-threat/article/2599956 …";;;;"769254655939321857";https://twitter.com/realDonaldTrump/status/769254655939321857
;2016/08/26;7821;18541;"Meet the ‘Trumpocrats’: Lifelong Democrats Breaking w/ Party Over Hillary to Support Donald Trump for President:http://www.breitbart.com/2016-presidential-race/2016/08/23/meet-trumpocrats-lifelong-democrats-breaking-party-hillary-clinton-support-donald-trump-president/ …";;;;"769253422549786628";https://twitter.com/realDonaldTrump/status/769253422549786628
;2016/08/26;8205;15743;""Hillary Clinton Deleted Emails Using Program Intended To Prevent Recovery" #CrookedHillaryhttp://dailycaller.com/2016/08/25/hillary-clinton-deleted-emails-using-program-intended-to-prevent-recovery/ …";;;#CrookedHillaryhttp;"769252637350866946";https://twitter.com/realDonaldTrump/status/769252637350866946
;2016/08/26;12891;27686;"How quickly people forget that Crooked Hillary called African-American youth "SUPER PREDATORS" - Has she apologized?";;;;"769221405820923905";https://twitter.com/realDonaldTrump/status/769221405820923905
;2016/08/26;8941;31440;"I am very proud to have brought the subject of illegal immigration back into the discussion. Such a big problem for our country-I will solve";;;;"769203012250112006";https://twitter.com/realDonaldTrump/status/769203012250112006
;2016/08/26;5654;14657;"Wonderful @pastormarkburns was attacked viciously and unfairly on @MSNBC by crazy @morningmika on low ratings @Morning_Joe. Apologize!";;@pastormarkburns @MSNBC @morningmika @Morning_Joe;;"769185155198124032";https://twitter.com/realDonaldTrump/status/769185155198124032
;2016/08/26;10448;30539;"What do African-Americans and Hispanics have to lose by going with me. Look at the poverty, crime and educational statistics. I will fix it!";;;;"769177810678067200";https://twitter.com/realDonaldTrump/status/769177810678067200
;2016/08/26;8917;28068;"Crooked Hillary will NEVER be able to solve the problems of poverty, education and safety within the African-American & Hispanic communities";;;;"769170204941164544";https://twitter.com/realDonaldTrump/status/769170204941164544
;2016/08/26;7039;16983;"The Clinton's are the real predators... https://instagram.com/p/BJkj25RD44E/ ";;;;"769143845892136960";https://twitter.com/realDonaldTrump/status/769143845892136960
;2016/08/25;5458;17332;"" @Lewenskimo: Your opponent has run out of ideas, now resorts to personal attacks on you. Every Amercan knows, you represent HOPE!!"";;@Lewenskimo;;"769021525638930437";https://twitter.com/realDonaldTrump/status/769021525638930437
;2016/08/25;16403;31214;""Hillary Clinton needs to address the racist undertones of her 2008 campaign." #FlashbackFridaypic.twitter.com/MJQp0rcnzH";;;#FlashbackFridaypic;"769006162926669824";https://twitter.com/realDonaldTrump/status/769006162926669824
;2016/08/25;9001;16178;"" @DonaldJTrumpJr: Company Gouging Price Of EpiPens Is A Clinton Foundation Donor And Partner http://dailycaller.com/2016/08/24/company-gouging-price-of-epipens-is-a-clinton-foundation-donor-and-partner/ … via dailycaller"";;@DonaldJTrumpJr;;"769003323856867328";https://twitter.com/realDonaldTrump/status/769003323856867328
;2016/08/25;8319;16362;"" @foxnation: Flashback: Hillary Clinton Praised Former KKK Member Robert Byrd as 'Friend and Mentor': http://bit.ly/2bmuqej "";;@foxnation;;"769003073943457792";https://twitter.com/realDonaldTrump/status/769003073943457792
;2016/08/25;5158;12752;"CLINTON CORRUPTION AND HER SABOTAGE OF THE INNER CITIES. Full speech transcript: https://www.facebook.com/DonaldTrump/posts/10157565569645725 …";;;;"769002724218118144";https://twitter.com/realDonaldTrump/status/769002724218118144
;2016/08/25;9243;26952;"Hillary Clinton only knows how to make a speech when it is a hit on me. No policy, and always very short (stamina). Media gives her a pass!";;;;"769001435484688384";https://twitter.com/realDonaldTrump/status/769001435484688384
;2016/08/25;10541;23073;"HRC is using the oldest play in the Dem playbook- when their policies fail, they are left w/this one tired argument!http://www.snappytv.com/tc/2673821 ";;;;"768922208987127808";https://twitter.com/realDonaldTrump/status/768922208987127808
;2016/08/25;10006;28425;"Hillary Clinton is using race-baiting to try to get African-American voters- but they know she is all talk and NO ACTION!";;;;"768912241349517312";https://twitter.com/realDonaldTrump/status/768912241349517312
;2016/08/25;9413;27666;"Hillary Clinton's short speech is pandering to the worst instincts in our society. She should be ashamed of herself!";;;;"768904362211086336";https://twitter.com/realDonaldTrump/status/768904362211086336
;2016/08/25;7891;21683;"Just watched recap of #CrookedHillary's speech. Very short and lies. She is the only one fear-mongering!";;;#CrookedHillary;"768903697166368769";https://twitter.com/realDonaldTrump/status/768903697166368769
;2016/08/25;10991;33435;"So many in the African-American community are doing so badly, poverty and crime way up, employment and jobs way down: I will fix it, promise";;;;"768791265811062788";https://twitter.com/realDonaldTrump/status/768791265811062788
;2016/08/25;10125;33531;"Poll numbers are starting to look very good. Leading in Florida @CNN Arizona and big jump in Utah. All numbers rising, national way up. Wow!";;@CNN;;"768788761635356672";https://twitter.com/realDonaldTrump/status/768788761635356672
;2016/08/24;5099;13147;"" @Trump_Videos: . @Nigel_Farage of the #brexit fame - We CAN do this! We can #MAGA with @realDonaldTrump https://youtu.be/gSBDTfTfmJ8 "";;@Trump_Videos @Nigel_Farage @realDonaldTrump;#brexit #MAGA;"768667720149762048";https://twitter.com/realDonaldTrump/status/768667720149762048
;2016/08/24;7747;26481;"Thoughts and prayers to the great people of Indiana. You will prevail!";;;;"768624405777944576";https://twitter.com/realDonaldTrump/status/768624405777944576
;2016/08/24;7628;26856;"Great Governor @Mike_Pence is in Indiana to help lead the relief efforts after tornadoes struck. True leadership.";;@Mike_Pence;;"768623966713999360";https://twitter.com/realDonaldTrump/status/768623966713999360
;2016/08/24;4368;16760;"Will be on #Hannity @ 10pE @FoxNews- discussing various subjects including immigration-if elected, we will #BuildTheWall & enforce our laws!";;@ @FoxNews;#Hannity #BuildTheWall;"768600125413273600";https://twitter.com/realDonaldTrump/status/768600125413273600
;2016/08/24;6565;18938;"Thank you for your support! #AmericaFirst #ImWithYoupic.twitter.com/N8FShwYt2g";;;#AmericaFirst #ImWithYoupic;"768578478266458113";https://twitter.com/realDonaldTrump/status/768578478266458113
;2016/08/24;4928;17438;"A great afternoon in Tampa, Florida. Thank you! #TrumpPence16pic.twitter.com/K5MBAcnfR1";;;#TrumpPence16pic;"768561716149915648";https://twitter.com/realDonaldTrump/status/768561716149915648
;2016/08/24;6101;17108;"New national poll released. Join the MOVEMENT & together we will #MakeAmericaGreatAgain! http://www.DonaldJTrump.com pic.twitter.com/rnU1fkn274";;;#MakeAmericaGreatAgain;"768499164967739392";https://twitter.com/realDonaldTrump/status/768499164967739392
;2016/08/24;7432;20639;"Great new poll Florida - thank you! #MakeAmericaGreatAgainpic.twitter.com/7TKpe388Bc";;;#MakeAmericaGreatAgainpic;"768488555828183040";https://twitter.com/realDonaldTrump/status/768488555828183040
;2016/08/24;6930;16437;"I will not let the families of The Remembrance Project down! #MakeAmericaSafeAgain http://www.TheRemembranceProject.org https://amp.twimg.com/v/db1dc4a1-ae43-4da4-8c32-f84a5e5e6223 …";;;#MakeAmericaSafeAgain;"768467755339223040";https://twitter.com/realDonaldTrump/status/768467755339223040
;2016/08/24;8690;34231;"My thoughts and prayers are with the victims and families of those affected by two powerful earthquakes in Italy and Myanmar.";;;;"768448216744488960";https://twitter.com/realDonaldTrump/status/768448216744488960
;2016/08/23;7403;22290;"Thank you Travis County, Texas! #MakeAmericaGreatAgainpic.twitter.com/ZBnYzNb0eo";;;#MakeAmericaGreatAgainpic;"768280756682690562";https://twitter.com/realDonaldTrump/status/768280756682690562
;2016/08/23;5320;19454;"Will be participating in a Town Hall tonight on @SeanHannity at 10pmE from Austin, Texas. Enjoy!pic.twitter.com/8ZBneb0pGk";;@SeanHannity;;"768239855310471168";https://twitter.com/realDonaldTrump/status/768239855310471168
;2016/08/23;8545;26080;"In Austin, Texas with some of our amazing Border Patrol Agents. I will not let them down! https://instagram.com/p/BJdya79DXOF/ pic.twitter.com/7ImVH69fNb";;;;"768196613680398336";https://twitter.com/realDonaldTrump/status/768196613680398336
;2016/08/23;4317;13415;"Join me in Tampa, Florida- tomorrow at 1pmE! Tickets: https://www.donaldjtrump.com/schedule/register/tampa-fl3/ …pic.twitter.com/lLyaW6nxsP";;;;"768125054584393729";https://twitter.com/realDonaldTrump/status/768125054584393729
;2016/08/23;13839;41400;"President Obama should have gone to Louisiana days ago, instead of golfing. Too little, too late!";;;;"768119463421943808";https://twitter.com/realDonaldTrump/status/768119463421943808
;2016/08/23;9750;25852;"Hillary Clinton strongly stated that there was "absolutely no connection" between her private work and that of The State Department. LIE!";;;;"768097204376510464";https://twitter.com/realDonaldTrump/status/768097204376510464
;2016/08/23;11962;39283;"It is being reported by virtually everyone, and is a fact, that the media pile on against me is the worst in American political history!";;;;"768083669550366720";https://twitter.com/realDonaldTrump/status/768083669550366720
;2016/08/23;6711;23199;"I am now in Texas doing a big fundraiser for the Republican Party and a @FoxNews Special on the BORDER and with victims of border crime!";;@FoxNews;;"768069472464666624";https://twitter.com/realDonaldTrump/status/768069472464666624
;2016/08/22;5615;18352;"The @WashingtonPost quickly put together a hit job book on me- comprised of copies of some of their inaccurate stories. Don't buy, boring!";;@WashingtonPost;;"767889674530594816";https://twitter.com/realDonaldTrump/status/767889674530594816
;2016/08/22;8227;25003;". @AnnCoulter's new book, 'In Trump We Trust, comes out tomorrow. People are saying it's terrific - knowing Ann I am sure it is!";;@AnnCoulter;;"767888297125355521";https://twitter.com/realDonaldTrump/status/767888297125355521
;2016/08/22;5772;23949;"Just leaving Akron, Ohio, after a packed rally. Amazing people! Going now to Texas.";;;;"767870642716831744";https://twitter.com/realDonaldTrump/status/767870642716831744
;2016/08/22;7958;25127;"Great meeting with active & retired law enforcement officers- at the Fraternal Order of Police lodge in Akron, Ohio.pic.twitter.com/EUWhDC644R";;;;"767830376735735808";https://twitter.com/realDonaldTrump/status/767830376735735808
;2016/08/22;5835;13351;"Statement on Clinton Foundation: https://www.facebook.com/DonaldTrump/posts/10157542172590725 …";;;;"767706807619969025";https://twitter.com/realDonaldTrump/status/767706807619969025
;2016/08/22;2290;10869;"Will be interviewed on @foxandfriends at 8:30 A.M. Eastern. ENJOY!";;@foxandfriends;;"767700760113086465";https://twitter.com/realDonaldTrump/status/767700760113086465
;2016/08/22;7293;21911;"Some day, when things calm down, I'll tell the real story of @JoeNBC and his very insecure long-time girlfriend, @morningmika. Two clowns!";;@JoeNBC @morningmika;;"767685048703279104";https://twitter.com/realDonaldTrump/status/767685048703279104
;2016/08/22;4979;16949;"Tried watching low-rated @Morning_Joe this morning, unwatchable! @morningmika is off the wall, a neurotic and not very bright mess!";;@Morning_Joe @morningmika;;"767683204039974912";https://twitter.com/realDonaldTrump/status/767683204039974912
;2016/08/22;6315;16409;"" @realbill2016: @realDonaldTrump @Brainykid2010 @shl Trump leading LA Times poll pic.twitter.com/908uLXCIWz"";;@realbill2016 @realDonaldTrump @Brainykid2010 @shl;;"767679356466520064";https://twitter.com/realDonaldTrump/status/767679356466520064
;2016/08/21;2371;9832;"" @Brainykid2010: @shl @realDonaldTrump The ad was actually very good!"";;@Brainykid2010 @shl @realDonaldTrump;;"767536943353696256";https://twitter.com/realDonaldTrump/status/767536943353696256
;2016/08/21;4190;13362;"" @55Lidsville: #TeamTrump @KellyannePolls You need to show the crowds at the rallies use Periscope! Show HC's 139 YT viewers vs DT 38K"";;@55Lidsville @KellyannePolls;#TeamTrump;"767532993686765569";https://twitter.com/realDonaldTrump/status/767532993686765569
;2016/08/21;3957;13799;"" @SinAbunz_TM: @realDonaldTrump TRUMP VICTORY IN NOVEMBER! #MAGA #TrumpPence16"";;@SinAbunz_TM @realDonaldTrump;#MAGA #TrumpPence16;"767532557235806208";https://twitter.com/realDonaldTrump/status/767532557235806208
;2016/08/21;8229;15596;"" @Jimbos2002: @Morning_Joe Video: Hillary referring to blacks as super predators that need to be brought to heel. https://m.youtube.com/watch?v=ALXulk0T8cg …"";;@Jimbos2002 @Morning_Joe;;"767531507665756160";https://twitter.com/realDonaldTrump/status/767531507665756160
;2016/08/21;3639;13801;"I heard that @Morning_Joe was very nice on Friday but that little Donny D, a big failure in TV (& someone I helped), was nasty. Irrelevant!";;@Morning_Joe;;"767528750749810688";https://twitter.com/realDonaldTrump/status/767528750749810688
;2016/08/21;13674;39509;"Crooked Hillary is flooding the airwaves with false and misleading ads - all paid for by her bosses on Wall Street. Media is protecting her!";;;;"767520065608613888";https://twitter.com/realDonaldTrump/status/767520065608613888
;2016/08/21;12478;39616;"I have been drawing very big and enthusiastic crowds, but the media refuses to show or discuss them. Something very big is happening!";;;;"767505383430782976";https://twitter.com/realDonaldTrump/status/767505383430782976
;2016/08/20;7773;21596;"Together, we are going to MAKE AMERICA SAFE AND GREAT AGAIN!http://www.breitbart.com/2016-presidential-race/2016/08/20/la-times-poll-trump-takes-half-point-lead-clinton/ …";;;;"767150340726779904";https://twitter.com/realDonaldTrump/status/767150340726779904
;2016/08/20;5382;18623;"" @EyeCandyTMGayle: @realDonaldTrump please oh please take the CHARLOTTE NC speech ACROSS the swing states .... sooo powerful" Good!";;@EyeCandyTMGayle @realDonaldTrump;;"767149890464018433";https://twitter.com/realDonaldTrump/status/767149890464018433
;2016/08/20;4277;16318;"" @J58golf: @realDonaldTrump been a great week. More of the same will get you in the white house!"";;@J58golf @realDonaldTrump;;"767149739418804228";https://twitter.com/realDonaldTrump/status/767149739418804228
;2016/08/20;9822;30325;"We will bring America together as ONE country again – united as Americans in common purpose and common dreams. #MAGA";;;#MAGA;"767137098679853056";https://twitter.com/realDonaldTrump/status/767137098679853056
;2016/08/20;5625;18221;"Will be back soon Virginia. We are going to MAKE AMERICA GREAT AGAIN! #TrumpPence16pic.twitter.com/IU4JPSi0rZ";;;#TrumpPence16pic;"767135128950898689";https://twitter.com/realDonaldTrump/status/767135128950898689
;2016/08/20;3479;13745;"Will be interviewed on @JudgeJeanine at 9:00 P.M. Enjoy!";;@JudgeJeanine;;"767134774687330304";https://twitter.com/realDonaldTrump/status/767134774687330304
;2016/08/20;3815;17255;"Just leaving Virginia - really big crowd, great enthusiasm!";;;;"767133459148054528";https://twitter.com/realDonaldTrump/status/767133459148054528
;2016/08/20;7202;18775;"Thank you @JerryJrFalwell- will see you soon. #TrumpPence16https://www.washingtonpost.com/opinions/jerry-falwell-jr-trump-is-the-churchillian-leader-we-need/2016/08/19/b1ff79e0-64b1-11e6-be4e-23fc4d4d12b4_story.html?utm_term=.9a231e4faa1b# …";;@JerryJrFalwell;#TrumpPence16https #;"767052374934421506";https://twitter.com/realDonaldTrump/status/767052374934421506
;2016/08/19;8052;27166;"" @CatOnGlass: 200,000 new followers for @realDonaldTrump. From 10,800,000 to 11,000,000, All in the last ten days or so! #MAGA #AlwaysTrump";;@CatOnGlass @realDonaldTrump;#MAGA #AlwaysTrump;"766863067858759681";https://twitter.com/realDonaldTrump/status/766863067858759681
