username;date;retweets;favorites;text;geo;mentions;hashtags;id;permalink
;2017/02/22;12321;80491;"One thing I will say about Rep. Keith Ellison, in his fight to lead the DNC, is that he was the one who predicted early that I would win!";;;;"834377364947816448";https://twitter.com/realDonaldTrump/status/834377364947816448
;2017/02/21;26468;120105;"The so-called angry crowds in home districts of some Republicans are actually, in numerous cases, planned out by liberal activists. Sad!";;;;"834181712783560705";https://twitter.com/realDonaldTrump/status/834181712783560705
;2017/02/21;23987;108597;"'Americans overwhelmingly oppose sanctuary cities'http://thehill.com/homenews/administration/320487-poll-americans-overwhelmingly-oppose-sanctuary-cities …";;;;"834142323881684993";https://twitter.com/realDonaldTrump/status/834142323881684993
;2017/02/20;16256;95397;"Congratulations to our new National Security Advisor, General H.R. McMaster. Video: https://www.facebook.com/DonaldTrump/videos/10158684611165725/ …pic.twitter.com/VBXcJ1b6Pv";;;;"833838311315763200";https://twitter.com/realDonaldTrump/status/833838311315763200
;2017/02/20;16027;107893;"Just named General H.R. McMaster National Security Advisor.";;;;"833783438922629125";https://twitter.com/realDonaldTrump/status/833783438922629125
;2017/02/20;49749;246009;"HAPPY PRESIDENTS DAY - MAKE AMERICA GREAT AGAIN!";;;;"833686030679207936";https://twitter.com/realDonaldTrump/status/833686030679207936
;2017/02/20;35568;143465;"Give the public a break - The FAKE NEWS media is trying to say that large scale immigration in Sweden is working out just beautifully. NOT!";;;;"833681539997253636";https://twitter.com/realDonaldTrump/status/833681539997253636
;2017/02/19;26677;114104;"My statement as to what's happening in Sweden was in reference to a story that was broadcast on @FoxNews concerning immigrants & Sweden.";;@FoxNews;;"833435244451753984";https://twitter.com/realDonaldTrump/status/833435244451753984
;2017/02/18;15511;100803;"Will be having many meetings this weekend at The Southern White House. Big 5:00 P.M. speech in Melbourne, Florida. A lot to talk about!";;;;"832950628750127106";https://twitter.com/realDonaldTrump/status/832950628750127106
;2017/02/18;39708;188906;"Don't believe the main stream (fake news) media.The White House is running VERY WELL. I inherited a MESS and am in the process of fixing it.";;;;"832945737625387008";https://twitter.com/realDonaldTrump/status/832945737625387008
;2017/02/17;14384;100593;"Looking forward to the Florida rally tomorrow. Big crowd expected!";;;;"832742165436579840";https://twitter.com/realDonaldTrump/status/832742165436579840
;2017/02/17;22102;122120;""One of the most effective press conferences I've ever seen!" says Rush Limbaugh. Many agree.Yet FAKE MEDIA calls it differently! Dishonest";;;;"832730328108134402";https://twitter.com/realDonaldTrump/status/832730328108134402
;2017/02/17;51371;162693;"The FAKE NEWS media (failing @nytimes, @NBCNews, @ABC, @CBS, @CNN) is not my enemy, it is the enemy of the American People!";;@nytimes @NBCNews @ABC @CBS @CNN;;"832708293516632065";https://twitter.com/realDonaldTrump/status/832708293516632065
;2017/02/17;10084;57473;"Join me at 11:00am: Watch here: http://45.wh.gov/XYQXNw pic.twitter.com/UzndIjIqjM";;;;"832614137586933760";https://twitter.com/realDonaldTrump/status/832614137586933760
;2017/02/17;11152;70746;"General Keith Kellogg, who I have known for a long time, is very much in play for NSA - as are three others.";;;;"832579442790772736";https://twitter.com/realDonaldTrump/status/832579442790772736
;2017/02/17;26787;153037;"Thank you for all of the nice statements on the Press Conference yesterday. Rush Limbaugh said one of greatest ever. Fake media not happy!";;;;"832555987299082242";https://twitter.com/realDonaldTrump/status/832555987299082242
;2017/02/17;14552;100553;"Going to Charleston, South Carolina, in order to spend time with Boeing and talk jobs! Look forward to it.";;;;"832554772318322688";https://twitter.com/realDonaldTrump/status/832554772318322688
;2017/02/17;17469;104446;"Despite the long delays by the Democrats in finally approving Dr. Tom Price, the repeal and replacement of ObamaCare is moving fast!";;;;"832533430168608768";https://twitter.com/realDonaldTrump/status/832533430168608768
;2017/02/16;18994;95088;"'Trump signs bill undoing Obama coal mining rule'http://thehill.com/policy/energy-environment/319938-trump-signs-bill-undoing-obama-coal-mining-rule …";;;;"832375230274400256";https://twitter.com/realDonaldTrump/status/832375230274400256
;2017/02/16;27308;123075;"The Democrats had to come up with a story as to why they lost the election, and so badly (306), so they made up a story - RUSSIA. Fake news!";;;;"832238070460186625";https://twitter.com/realDonaldTrump/status/832238070460186625
;2017/02/16;20168;100868;"FAKE NEWS media, which makes up stories and "sources," is far more effective than the discredited Democrats - but they are fading fast!";;;;"832230758299340800";https://twitter.com/realDonaldTrump/status/832230758299340800
;2017/02/16;25607;128101;"The spotlight has finally been put on the low-life leakers! They will be caught!";;;;"832198588201594880";https://twitter.com/realDonaldTrump/status/832198588201594880
;2017/02/16;17366;91116;"Leaking, and even illegal classified leaking, has been a big problem in Washington for years. Failing @nytimes (and others) must apologize!";;@nytimes;;"832197515248275456";https://twitter.com/realDonaldTrump/status/832197515248275456
;2017/02/16;24022;129594;"Stock market hits new high with longest winning streak in decades. Great level of confidence and optimism - even before tax plan rollout!";;;;"832191485701451777";https://twitter.com/realDonaldTrump/status/832191485701451777
;2017/02/15;53200;110274;"Venezuela should allow Leopoldo Lopez, a political prisoner & husband of @liliantintori (just met w/ @marcorubio) out of prison immediately.pic.twitter.com/bt8Xhdo7al";;@liliantintori @marcorubio;;"832016501657968640";https://twitter.com/realDonaldTrump/status/832016501657968640
;2017/02/15;14788;59605;"Aetna CEO: Obamacare in 'Death Spiral' #RepealAndReplacehttps://www.bloomberg.com/news/articles/2017-02-15/aetna-ceo-says-obamacare-in-a-death-spiral-with-sick-customers …";;;#RepealAndReplacehttps;"831979921555742732";https://twitter.com/realDonaldTrump/status/831979921555742732
;2017/02/15;18110;73275;"Join me in Florida this Saturday at 5pm for a rally at the Orlando-Melbourne International Airport! Tickets: http://bit.ly/2lQarqaFLORIDA pic.twitter.com/GDhO6GGxwt";;;;"831952535544070145";https://twitter.com/realDonaldTrump/status/831952535544070145
;2017/02/15;14426;75545;"Welcome to the United States, @IsraeliPM Benjamin & Sara! #ICYMIJoint Press Conference: https://www.facebook.com/DonaldTrump/posts/10158654390690725 …pic.twitter.com/bH60nBL5FP";;@IsraeliPM;#ICYMIJoint;"831945670324060164";https://twitter.com/realDonaldTrump/status/831945670324060164
;2017/02/15;10847;67014;"Great listening session with CEO's of the Retail Industry Leaders Association this morning!pic.twitter.com/sy6xJcWfcF";;;;"831904516316479489";https://twitter.com/realDonaldTrump/status/831904516316479489
;2017/02/15;29097;128524;"The real scandal here is that classified information is illegally given out by "intelligence" like candy. Very un-American!";;;;"831853862281699331";https://twitter.com/realDonaldTrump/status/831853862281699331
;2017/02/15;25765;102327;"Crimea was TAKEN by Russia during the Obama Administration. Was Obama too soft on Russia?";;;;"831846101179314177";https://twitter.com/realDonaldTrump/status/831846101179314177
;2017/02/15;16594;78943;"Thank you to Eli Lake of The Bloomberg View - "The NSA & FBI...should not interfere in our politics...and is" Very serious situation for USA";;;;"831842652085686273";https://twitter.com/realDonaldTrump/status/831842652085686273
;2017/02/15;21450;81642;"Information is being illegally given to the failing @nytimes & @washingtonpost by the intelligence community (NSA and FBI?).Just like Russia";;@nytimes @washingtonpost;;"831840306161123328";https://twitter.com/realDonaldTrump/status/831840306161123328
;2017/02/15;27951;119774;"This Russian connection non-sense is merely an attempt to cover-up the many mistakes made in Hillary Clinton's losing campaign.";;;;"831837514226921472";https://twitter.com/realDonaldTrump/status/831837514226921472
;2017/02/15;26270;106108;"The fake news media is going crazy with their conspiracy theories and blind hatred. @MSNBC & @CNN are unwatchable. @foxandfriends is great!";;@MSNBC @CNN @foxandfriends;;"831830548565852160";https://twitter.com/realDonaldTrump/status/831830548565852160
;2017/02/14;18147;89198;"Obamacare continues to fail. Humana to pull out in 2018. Will repeal, replace & save healthcare for ALL Americans.https://origin-nyi.thehill.com/policy/healthcare/319538-humana-to-drop-out-of-obamacare-marketplace-at-end-of-2017 …";;;;"831636777110757377";https://twitter.com/realDonaldTrump/status/831636777110757377
;2017/02/14;8621;46721;"'Remarks by President Trump at Signing of H.J. Resolution 41' https://www.whitehouse.gov/the-press-office/2017/02/14/remarks-president-trump-signing-hj-resolution-41 …pic.twitter.com/yGDDTKm9Br";;;;"831621079747723264";https://twitter.com/realDonaldTrump/status/831621079747723264
;2017/02/14;11488;59822;"Great parent-teacher listening session this morning with @VP Pence & @usedgov Secretary @BetsyDeVos. Watch: https://www.youtube.com/watch?v=opufN8wWBoo …pic.twitter.com/QJnq4SSXlq";;@VP @usedgov @BetsyDeVos;;"831599387906301952";https://twitter.com/realDonaldTrump/status/831599387906301952
;2017/02/14;26967;113084;"The real story here is why are there so many illegal leaks coming out of Washington? Will these leaks be happening as I deal on N.Korea etc?";;;;"831510532318429184";https://twitter.com/realDonaldTrump/status/831510532318429184
;2017/02/13;16484;92153;"Congratulations to our new #VASecretary Dr. David Shulkin. Time to take care of Veterans who have fought to protect our country!pic.twitter.com/Mit3wx3yae";;;#VASecretary;"831344902990655489";https://twitter.com/realDonaldTrump/status/831344902990655489
;2017/02/13;11072;64846;"Congratulations Treasury Secretary Steven Mnuchin! #ICYMI- watch here: https://www.facebook.com/DonaldTrump/posts/10158646970740725 …pic.twitter.com/K8tWLlXiYK";;;#ICYMI;"831336432073658368";https://twitter.com/realDonaldTrump/status/831336432073658368
;2017/02/13;15668;86593;"Wonderful meeting with Canadian PM @JustinTrudeau and a group of leading CEO's & business women from Canadaand the United Statespic.twitter.com/Rxr31QpxMK";;@JustinTrudeau;;"831214091993751552";https://twitter.com/realDonaldTrump/status/831214091993751552
;2017/02/13;13676;85942;"Welcome to the @WhiteHouse Prime Minister @JustinTrudeau!pic.twitter.com/WKgF8Zo9ri";;@WhiteHouse @JustinTrudeau;;"831185943482793986";https://twitter.com/realDonaldTrump/status/831185943482793986
;2017/02/13;11929;75335;"Today I will meet with Canadian PM Trudeau and a group of leading business women to discuss women in the workforce.http://bigstory.ap.org/article/37dab25b8da74902b3fa4076030febe0/trump-trudeau-discuss-women-workforce …";;;;"831169341358014475";https://twitter.com/realDonaldTrump/status/831169341358014475
;2017/02/12;25897;143598;"Just leaving Florida. Big crowds of enthusiastic supporters lining the road that the FAKE NEWS media refuses to mention. Very dishonest!";;;;"830904083519242241";https://twitter.com/realDonaldTrump/status/830904083519242241
;2017/02/12;16280;104518;"Congratulations Stephen Miller- on representing me this morning on the various Sunday morning shows. Great job!";;;;"830804130692268032";https://twitter.com/realDonaldTrump/status/830804130692268032
;2017/02/12;15538;83618;"I know Mark Cuban well. He backed me big-time but I wasn't interested in taking all of his calls.He's not smart enough to run for president!";;;;"830769247185952772";https://twitter.com/realDonaldTrump/status/830769247185952772
;2017/02/12;13382;84109;"After two days of very productive talks, Prime Minister Abe is heading back to Japan. L";;;;"830764596235485188";https://twitter.com/realDonaldTrump/status/830764596235485188
;2017/02/12;25467;114922;"While on FAKE NEWS @CNN, Bernie Sanders was cut off for using the term fake news to describe the network. They said technical difficulties!";;@CNN;;"830751875578355713";https://twitter.com/realDonaldTrump/status/830751875578355713
;2017/02/12;22873;81819;"72% of refugees admitted into U.S. (2/3 -2/11) during COURT BREAKDOWN are from 7 countries: SYRIA, IRAQ, SOMALIA, IRAN, SUDAN, LIBYA & YEMEN";;;;"830747067379232769";https://twitter.com/realDonaldTrump/status/830747067379232769
;2017/02/12;29927;150740;"The crackdown on illegal criminals is merely the keeping of my campaign promise. Gang members, drug dealers & others are being removed!";;;;"830741932099960834";https://twitter.com/realDonaldTrump/status/830741932099960834
;2017/02/11;14957;63268;"#ICYMI: Joint Statement with Prime Minister Shinzo Abe on North Korea.pic.twitter.com/qEC87FKB1D";;;#ICYMI;"830643095150657536";https://twitter.com/realDonaldTrump/status/830643095150657536
;2017/02/11;14087;98999;"A working dinner tonight with Prime Minister Abe of Japan, and his representatives, at the Winter White House (Mar-a-Lago). Very good talks!";;;;"830558065715998726";https://twitter.com/realDonaldTrump/status/830558065715998726
;2017/02/11;13522;85402;"Played golf today with Prime Minister Abe of Japan and @TheBig_Easy, Ernie Els, and had a great time. Japan is very well represented!";;@TheBig_Easy;;"830555911559249926";https://twitter.com/realDonaldTrump/status/830555911559249926
;2017/02/11;28871;210199;"I am so proud of my daughter Ivanka. To be abused and treated so badly by the media, and to still hold her head so high, is truly wonderful!";;;;"830552079240409089";https://twitter.com/realDonaldTrump/status/830552079240409089
;2017/02/11;17250;93684;"Having a great time hosting Prime Minister Shinzo Abe in the United States! https://www.facebook.com/DonaldTrump/posts/10158635419120725:0 … https://instagram.com/p/BQYZ8n8Dtty/ pic.twitter.com/smGrnWakWQ";;;;"830483672096768001";https://twitter.com/realDonaldTrump/status/830483672096768001
;2017/02/11;17211;121916;"Melania and I are hosting Japanese Prime Minister Shinzo Abe and Mrs. Abe at Mar-a-Lago in Palm Beach, Fla. They are a wonderful couple!";;;;"830409522397184000";https://twitter.com/realDonaldTrump/status/830409522397184000
;2017/02/11;13129;85056;"...design or negotiations yet. When I do, just like with the F-35 FighterJet or the Air Force One Program, price will come WAY DOWN!";;;;"830407172747988992";https://twitter.com/realDonaldTrump/status/830407172747988992
;2017/02/11;14243;78268;"I am reading that the great border WALL will cost more than the government originally thought, but I have not gotten involved in the.....";;;;"830405706255912960";https://twitter.com/realDonaldTrump/status/830405706255912960
;2017/02/11;23334;102637;"Our legal system is broken! "77% of refugees allowed into U.S. since travel reprieve hail from seven suspect countries." (WT) SO DANGEROUS!";;;;"830389130311921667";https://twitter.com/realDonaldTrump/status/830389130311921667
;2017/02/10;41864;163222;"Heading to Joint Base Andrews on #MarineOne with Prime Minister Shinzō earlier today.pic.twitter.com/4JFhyYdeHO";;;#MarineOne;"830195857530183684";https://twitter.com/realDonaldTrump/status/830195857530183684
;2017/02/10;24131;108687;"The failing @nytimes does major FAKE NEWS China story saying "Mr.Xi has not spoken to Mr. Trump since Nov.14." We spoke at length yesterday!";;@nytimes;;"830047626414477312";https://twitter.com/realDonaldTrump/status/830047626414477312
;2017/02/10;17811;90614;"LAWFARE: "Remarkably, in the entire opinion, the panel did not bother even to cite this (the) statute." A disgraceful decision!";;;;"830042498806460417";https://twitter.com/realDonaldTrump/status/830042498806460417
;2017/02/09;67563;240045;"SEE YOU IN COURT, THE SECURITY OF OUR NATION IS AT STAKE!";;;;"829836231802515457";https://twitter.com/realDonaldTrump/status/829836231802515457
;2017/02/09;10927;72208;"Join us live in the Oval Office for the swearing in of our new Attorney General, @SenatorSessions! LIVE: http://bit.ly/2kqq2f0Sessions pic.twitter.com/0PEcB2B4Pf";;@SenatorSessions;;"829721019720015872";https://twitter.com/realDonaldTrump/status/829721019720015872
;2017/02/09;15134;92488;"..Ryan died on a winning mission ( according to General Mattis), not a "failure." Time for the U.S. to get smart and start winning again!";;;;"829689436279603206";https://twitter.com/realDonaldTrump/status/829689436279603206
;2017/02/09;11967;69076;"...long he doesn't know how to win anymore, just look at the mess our country is in - bogged down in conflict all over the place. Our hero..";;;;"829684271812067328";https://twitter.com/realDonaldTrump/status/829684271812067328
;2017/02/09;16016;87050;"Sen. McCain should not be talking about the success or failure of a mission to the media. Only emboldens the enemy! He's been losing so....";;;;"829682794951475200";https://twitter.com/realDonaldTrump/status/829682794951475200
;2017/02/09;15115;74882;"Chris Cuomo, in his interview with Sen. Blumenthal, never asked him about his long-term lie about his brave "service" in Vietnam. FAKE NEWS!";;;;"829681034564341760";https://twitter.com/realDonaldTrump/status/829681034564341760
;2017/02/09;19655;86085;"Sen.Richard Blumenthal, who never fought in Vietnam when he said for years he had (major lie),now misrepresents what Judge Gorsuch told him?";;;;"829660612452036608";https://twitter.com/realDonaldTrump/status/829660612452036608
;2017/02/08;33085;165547;"Congratulations to our new Attorney General, @SenatorSessions!pic.twitter.com/e0buP1K83z";;@SenatorSessions;;"829496507841789952";https://twitter.com/realDonaldTrump/status/829496507841789952
;2017/02/08;17917;89299;"'Trump administration seen as more truthful than news media' http://bit.ly/2k4b0imEmersonPoll …";;;;"829451566000242688";https://twitter.com/realDonaldTrump/status/829451566000242688
;2017/02/08;22122;84288;"'Majority in Leading EU Nations Support Trump-Style Travel Ban' Poll of more than 10,000 people in 10 countries...http://bit.ly/2k4fvqgEUPoll ";;;;"829446266111287305";https://twitter.com/realDonaldTrump/status/829446266111287305
;2017/02/08;30834;124693;"'Immigration Ban Is One Of Trump's Most Popular Orders So Far'pic.twitter.com/wAelwuQ4BE";;;;"829414457126313986";https://twitter.com/realDonaldTrump/status/829414457126313986
;2017/02/08;22350;99143;"Thank you Brian Krzanich, CEO of @Intel. A great investment ($7 BILLION) in American INNOVATION and JOBS! #AmericaFirstpic.twitter.com/76lAiSSQ1l";;@Intel;#AmericaFirstpic;"829410107406614534";https://twitter.com/realDonaldTrump/status/829410107406614534
;2017/02/08;17797;89883;"Big increase in traffic into our country from certain areas, while our people are far more vulnerable, as we wait for what should be EASY D!";;;;"829384587482656768";https://twitter.com/realDonaldTrump/status/829384587482656768
;2017/02/08;19412;65222;"'16 Fake News Stories Reporters Have Run Since Trump Won'http://thefederalist.com/2017/02/06/16-fake-news-stories-reporters-have-run-since-trump-won/ …";;;;"829357626798530561";https://twitter.com/realDonaldTrump/status/829357626798530561
;2017/02/08;27649;144432;"My daughter Ivanka has been treated so unfairly by @Nordstrom. She is a great person -- always pushing me to do the right thing! Terrible!";;@Nordstrom;;"829356871848951809";https://twitter.com/realDonaldTrump/status/829356871848951809
;2017/02/08;16419;91291;"Thank you to our great Police Chiefs & Sheriffs for your leadership & service. You have a true friend in the @WhiteHouse. We support you!pic.twitter.com/niwuK5rgXR";;@WhiteHouse;;"829349943613734912";https://twitter.com/realDonaldTrump/status/829349943613734912
;2017/02/08;10999;76054;"I will be speaking at 9:00 A.M. today to Police Chiefs and Sheriffs and will be discussing the horrible, dangerous and wrong decision.......";;;;"829315036329963521";https://twitter.com/realDonaldTrump/status/829315036329963521
;2017/02/08;22570;116603;"If the U.S. does not win this case as it so obviously should, we can never have the security and safety to which we are entitled. Politics!";;;;"829299566344359936";https://twitter.com/realDonaldTrump/status/829299566344359936
;2017/02/07;36966;159630;"It is a disgrace that my full Cabinet is still not in place, the longest such delay in the history of our country. Obstruction by Democrats!";;;;"829133645055135750";https://twitter.com/realDonaldTrump/status/829133645055135750
;2017/02/07;18640;109625;"An honor having the National Sheriffs' Assoc. join me at the @WhiteHouse. Incredible men & women who protect & serve 24/7/365. THANK YOU!!pic.twitter.com/9EMTnH0OrF";;@WhiteHouse;;"829003091735359488";https://twitter.com/realDonaldTrump/status/829003091735359488
;2017/02/07;51329;191087;"I don't know Putin, have no deals in Russia, and the haters are going crazy - yet Obama can make a deal with Iran, #1 in terror, no problem!";;;#1;"828939235499638784";https://twitter.com/realDonaldTrump/status/828939235499638784
;2017/02/06;33114;147998;"The threat from radical Islamic terrorism is very real, just look at what is happening in Europe and the Middle-East. Courts must act fast!";;;;"828797801630937089";https://twitter.com/realDonaldTrump/status/828797801630937089
;2017/02/06;16720;93390;"The failing @nytimes was forced to apologize to its subscribers for the poor reporting it did on my election win. Now they are worse!";;@nytimes;;"828793887275761665";https://twitter.com/realDonaldTrump/status/828793887275761665
;2017/02/06;8199;54330;"An extended interview from the Super Bowl with @oreillyfactor airs tonight at 8:00 P.M. Enjoy!pic.twitter.com/kZdHqaNTVR";;@oreillyfactor;;"828748574255091714";https://twitter.com/realDonaldTrump/status/828748574255091714
;2017/02/06;19606;98204;"The failing @nytimes writes total fiction concerning me. They have gotten it wrong for two years, and now are making up stories & sources!";;@nytimes;;"828642511698669569";https://twitter.com/realDonaldTrump/status/828642511698669569
;2017/02/06;24383;127339;"I call my own shots, largely based on an accumulation of data, and everyone knows it. Some FAKE NEWS media, in order to marginalize, lies!";;;;"828575949268606977";https://twitter.com/realDonaldTrump/status/828575949268606977
;2017/02/06;36861;164329;"Any negative polls are fake news, just like the CNN, ABC, NBC polls in the election. Sorry, people want border security and extreme vetting.";;;;"828574430800539648";https://twitter.com/realDonaldTrump/status/828574430800539648
;2017/02/05;74352;271212;"What an amazing comeback and win by the Patriots. Tom Brady, Bob Kraft and Coach B are total winners. Wow!";;;;"828447350200926212";https://twitter.com/realDonaldTrump/status/828447350200926212
;2017/02/05;37231;187625;"Enjoy the #SuperBowl and then we continue: MAKE AMERICA GREAT AGAIN!";;;#SuperBowl;"828375073006444544";https://twitter.com/realDonaldTrump/status/828375073006444544
;2017/02/05;28942;149195;"I have instructed Homeland Security to check people coming into our country VERY CAREFULLY. The courts are making the job very difficult!";;;;"828343072840900610";https://twitter.com/realDonaldTrump/status/828343072840900610
;2017/02/05;29564;140260;"Just cannot believe a judge would put our country in such peril. If something happens blame him and court system. People pouring in. Bad!";;;;"828342202174668800";https://twitter.com/realDonaldTrump/status/828342202174668800
;2017/02/04;28594;131600;"The judge opens up our country to potential terrorists and others that do not have our best interests at heart. Bad people are very happy!";;;;"828042506851934209";https://twitter.com/realDonaldTrump/status/828042506851934209
;2017/02/04;11526;71933;"Interview with @oreillyfactor on Fox Network - 4:00 P.M. (prior to Super Bowl). Enjoy!";;@oreillyfactor;;"828039143318024194";https://twitter.com/realDonaldTrump/status/828039143318024194
;2017/02/04;18154;98984;"Why aren't the lawyers looking at and using the Federal Court decision in Boston, which is at conflict with ridiculous lift ban decision?";;;;"828024835670413312";https://twitter.com/realDonaldTrump/status/828024835670413312
;2017/02/04;29896;139011;"Because the ban was lifted by a judge, many very bad and dangerous people may be pouring into our country. A terrible decision";;;;"827996357252243456";https://twitter.com/realDonaldTrump/status/827996357252243456
;2017/02/04;33819;150961;"What is our country coming to when a judge can halt a Homeland Security travel ban and anyone, even with bad intentions, can come into U.S.?";;;;"827981079042805761";https://twitter.com/realDonaldTrump/status/827981079042805761
;2017/02/04;67438;259754;"MAKE AMERICA GREAT AGAIN!";;;;"827885966509604865";https://twitter.com/realDonaldTrump/status/827885966509604865
;2017/02/04;17742;104371;"After being forced to apologize for its bad and inaccurate coverage of me after winning the election, the FAKE NEWS @nytimes is still lost!";;@nytimes;;"827874208021639168";https://twitter.com/realDonaldTrump/status/827874208021639168
;2017/02/04;33946;161436;"The opinion of this so-called judge, which essentially takes law-enforcement away from our country, is ridiculous and will be overturned!";;;;"827867311054974976";https://twitter.com/realDonaldTrump/status/827867311054974976
;2017/02/04;28688;141815;"Interesting that certain Middle-Eastern countries agree with the ban. They know if certain people are allowed in it's death & destruction!";;;;"827865957750161408";https://twitter.com/realDonaldTrump/status/827865957750161408
