username;date;retweets;favorites;text;geo;mentions;hashtags;id;permalink
;2017/02/04;38617;177807;"When a country is no longer able to say who can, and who cannot , come in & out, especially for reasons of safety &.security - big trouble!";;;;"827864176043376640";https://twitter.com/realDonaldTrump/status/827864176043376640
;2017/02/03;27386;156663;"Countries charge U.S. companies taxes or tariffs while the U.S. charges them nothing or little.We should charge them SAME as they charge us!";;;;"827715246135574530";https://twitter.com/realDonaldTrump/status/827715246135574530
;2017/02/03;45503;207740;"We must keep "evil" out of our country!";;;;"827655062835052544";https://twitter.com/realDonaldTrump/status/827655062835052544
;2017/02/03;42325;166603;"A new radical Islamic terrorist has just attacked in Louvre Museum in Paris. Tourists were locked down. France on edge again. GET SMART U.S.";;;;"827499871011819520";https://twitter.com/realDonaldTrump/status/827499871011819520
;2017/02/03;43322;175165;"Professional anarchists, thugs and paid protesters are proving the point of the millions of people who voted to MAKE AMERICA GREAT AGAIN!";;;;"827483841589891073";https://twitter.com/realDonaldTrump/status/827483841589891073
;2017/02/03;19662;127577;"Meeting with biggest business leaders this morning. Good jobs are coming back to U.S., health care and tax bills are being crafted NOW!";;;;"827482059438432260";https://twitter.com/realDonaldTrump/status/827482059438432260
;2017/02/03;33140;151067;"Thank you to Prime Minister of Australia for telling the truth about our very civil conversation that FAKE NEWS media lied about. Very nice!";;;;"827480386120929280";https://twitter.com/realDonaldTrump/status/827480386120929280
;2017/02/03;64861;175552;"Iran is playing with fire - they don't appreciate how "kind" President Obama was to them. Not me!";;;;"827478751931924480";https://twitter.com/realDonaldTrump/status/827478751931924480
;2017/02/03;23931;118998;"Yes, Arnold Schwarzenegger did a really bad job as Governor of California and even worse on the Apprentice...but at least he tried hard!";;;;"827477947154063361";https://twitter.com/realDonaldTrump/status/827477947154063361
;2017/02/02;26615;127481;"Thank you, @Samsung! We would love to have you!https://www.axios.com/trump-effect-samsung-may-build-u-s-factory-2233101986.html …";;@Samsung;;"827207267632164868";https://twitter.com/realDonaldTrump/status/827207267632164868
;2017/02/02;24541;98939;"Iran was on its last legs and ready to collapse until the U.S. came along and gave it a life-line in the form of the Iran Deal: $150 billion";;;;"827119326880813056";https://twitter.com/realDonaldTrump/status/827119326880813056
;2017/02/02;39971;123065;"Iran has been formally PUT ON NOTICE for firing a ballistic missile.Should have been thankful for the terrible deal the U.S. made with them!";;;;"827118012784373760";https://twitter.com/realDonaldTrump/status/827118012784373760
;2017/02/02;16984;125339;"Attending Chief Ryan Owens' Dignified Transfer yesterday with my daughter Ivanka was my great honor. To a great and brave man - thank you!";;;;"827115768202534913";https://twitter.com/realDonaldTrump/status/827115768202534913
;2017/02/02;16162;116783;"Congratulations to Rex Tillerson on being sworn in as our new Secretary of State. He will be a star!";;;;"827113926517194757";https://twitter.com/realDonaldTrump/status/827113926517194757
;2017/02/02;59275;214879;"If U.C. Berkeley does not allow free speech and practices violence on innocent people with a different point of view - NO FEDERAL FUNDS?";;;;"827112633224544256";https://twitter.com/realDonaldTrump/status/827112633224544256
;2017/02/01;37845;154337;"Do you believe it? The Obama Administration agreed to take thousands of illegal immigrants from Australia. Why? I will study this dumb deal!";;;;"827002559122567168";https://twitter.com/realDonaldTrump/status/827002559122567168
;2017/02/01;21321;95068;"Iran is rapidly taking over more and more of Iraq even after the U.S. has squandered three trillion dollars there. Obvious long ago!";;;;"826990079738540033";https://twitter.com/realDonaldTrump/status/826990079738540033
;2017/02/01;61509;255889;"Everybody is arguing whether or not it is a BAN. Call it what you want, it is about keeping bad people (with bad intentions) out of country!";;;;"826774668245946368";https://twitter.com/realDonaldTrump/status/826774668245946368
;2017/01/31;34823;254181;"Hope you like my nomination of Judge Neil Gorsuch for the United States Supreme Court. He is a good and brilliant man, respected by all.";;;;"826637556787838976";https://twitter.com/realDonaldTrump/status/826637556787838976
;2017/01/31;6717;53954;"Join me live from the @WhiteHouse. https://www.facebook.com/POTUS/videos/1240366106032827/ …";;@WhiteHouse;;"826596187453153281";https://twitter.com/realDonaldTrump/status/826596187453153281
;2017/01/31;16737;104656;"Getting ready to deliver a VERY IMPORTANT DECISION! 8:00 P.M.";;;;"826588658304217088";https://twitter.com/realDonaldTrump/status/826588658304217088
;2017/01/31;39481;181797;"When will the Democrats give us our Attorney General and rest of Cabinet! They should be ashamed of themselves! No wonder D.C. doesn't work!";;;;"826391334248407040";https://twitter.com/realDonaldTrump/status/826391334248407040
;2017/01/31;31672;154948;"Nancy Pelosi and Fake Tears Chuck Schumer held a rally at the steps of The Supreme Court and mic did not work (a mess)-just like Dem party!";;;;"826390034693623809";https://twitter.com/realDonaldTrump/status/826390034693623809
;2017/01/30;28303;129264;"The Democrats are delaying my cabinet picks for purely political reasons. They have nothing going but to obstruct. Now have an Obama A.G.";;;;"826229971584708608";https://twitter.com/realDonaldTrump/status/826229971584708608
;2017/01/30;35221;179397;"The American dream is back. We’re going to create an environment for small business like we haven’t had in many, many decades!pic.twitter.com/ZuJNaN6z8b";;;;"826175120238604288";https://twitter.com/realDonaldTrump/status/826175120238604288
;2017/01/30;33182;165791;"Where was all the outrage from Democrats and the opposition party (the media) when our jobs were fleeing our country?";;;;"826073437735100418";https://twitter.com/realDonaldTrump/status/826073437735100418
;2017/01/30;25419;128947;"I have made my decision on who I will nominate for The United States Supreme Court. It will be announced live on Tuesday at 8:00 P.M. (W.H.)";;;;"826063267760046080";https://twitter.com/realDonaldTrump/status/826063267760046080
;2017/01/30;36146;174255;"If the ban were announced with a one week notice, the "bad" would rush into our country during that week. A lot of bad "dudes" out there!";;;;"826060143825666051";https://twitter.com/realDonaldTrump/status/826060143825666051
;2017/01/30;35627;175756;"There is nothing nice about searching for terrorists before they can enter our country. This was a big part of my campaign. Study the world!";;;;"826044059647107073";https://twitter.com/realDonaldTrump/status/826044059647107073
;2017/01/30;24429;135924;"protesters and the tears of Senator Schumer. Secretary Kelly said that all is going well with very few problems. MAKE AMERICA SAFE AGAIN!";;;;"826042483155013632";https://twitter.com/realDonaldTrump/status/826042483155013632
;2017/01/30;31506;132852;"Only 109 people out of 325,000 were detained and held for questioning. Big problems at airports were caused by Delta computer outage,.....";;;;"826041397232943104";https://twitter.com/realDonaldTrump/status/826041397232943104
;2017/01/29;11267;68713;"I will be interviewed by @TheBrodyFile on @CBNNews tonight at 11pm. Enjoy!";;@TheBrodyFile @CBNNews;;"825850987348914184";https://twitter.com/realDonaldTrump/status/825850987348914184
;2017/01/29;17198;70288;"Statement Regarding Recent Executive Order Concerning Extreme Vetting: https://www.facebook.com/DonaldTrump/posts/10158567643610725 …";;;;"825848204633731074";https://twitter.com/realDonaldTrump/status/825848204633731074
;2017/01/29;42729;172499;"...Senators should focus their energies on ISIS, illegal immigration and border security instead of always looking to start World War III.";;;;"825823217025691648";https://twitter.com/realDonaldTrump/status/825823217025691648
;2017/01/29;24163;109161;"The joint statement of former presidential candidates John McCain & Lindsey Graham is wrong - they are sadly weak on immigration. The two...";;;;"825822320128303110";https://twitter.com/realDonaldTrump/status/825822320128303110
;2017/01/29;60310;227109;"Christians in the Middle-East have been executed in large numbers. We cannot allow this horror to continue!";;;;"825721153142521858";https://twitter.com/realDonaldTrump/status/825721153142521858
;2017/01/29;51358;222015;"Our country needs strong borders and extreme vetting, NOW. Look what is happening all over Europe and, indeed, the world - a horrible mess!";;;;"825692045532618753";https://twitter.com/realDonaldTrump/status/825692045532618753
;2017/01/29;22632;113816;"Somebody with aptitude and conviction should buy the FAKE NEWS and failing @nytimes and either run it correctly or let it fold with dignity!";;@nytimes;;"825690087857995776";https://twitter.com/realDonaldTrump/status/825690087857995776
;2017/01/28;33100;172279;"Today, we remember the crew of the Space Shuttle Challenger, 31 years later. #NeverForgetpic.twitter.com/OhshQsFRfl";;;#NeverForgetpic;"825368580325773312";https://twitter.com/realDonaldTrump/status/825368580325773312
;2017/01/28;16250;106971;"...dwindling subscribers and readers.They got me wrong right from the beginning and still have not changed course, and never will. DISHONEST";;;;"825331665509691393";https://twitter.com/realDonaldTrump/status/825331665509691393
;2017/01/28;13919;80750;"Thr coverage about me in the @nytimes and the @washingtonpost gas been so false and angry that the times actually apologized to its.....";;@nytimes @washingtonpost;;"825329757646618624";https://twitter.com/realDonaldTrump/status/825329757646618624
;2017/01/28;21069;111058;"The failing @nytimes has been wrong about me from the very beginning. Said I would lose the primaries, then the general election. FAKE NEWS!";;@nytimes;;"825328817833123840";https://twitter.com/realDonaldTrump/status/825328817833123840
;2017/01/27;29412;151249;"I promise that our administration will ALWAYS have your back. We will ALWAYS be with you!pic.twitter.com/D0aOWhOH4X";;;;"825127844066054144";https://twitter.com/realDonaldTrump/status/825127844066054144
;2017/01/27;10859;58632;"Statement on International Holocaust Remembrance Day: https://www.whitehouse.gov/the-press-office/2017/01/27/statement-president-international-holocaust-remembrance-day …";;;;"825075972659613696";https://twitter.com/realDonaldTrump/status/825075972659613696
;2017/01/27;16276;89630;". @VP Mike Pence will be speaking at today's #MarchForLife -- You have our full support!https://twitter.com/vp/status/824757313441525761 …";;@VP;#MarchForLife;"825018149397463040";https://twitter.com/realDonaldTrump/status/825018149397463040
;2017/01/27;46233;187426;"The #MarchForLife is so important. To all of you marching --- you have my full support!";;;#MarchForLife;"825017279209410561";https://twitter.com/realDonaldTrump/status/825017279209410561
;2017/01/27;31168;162879;"Mexico has taken advantage of the U.S. for long enough. Massive trade deficits & little help on the very weak border must change, NOW!";;;;"824970003153842176";https://twitter.com/realDonaldTrump/status/824970003153842176
;2017/01/27;17635;90009;"Look forward to seeing final results of VoteStand. Gregg Phillips and crew say at least 3,000,000 votes were illegal. We must do better!";;;;"824968416486387713";https://twitter.com/realDonaldTrump/status/824968416486387713
;2017/01/26;25236;114246;"Miami-Dade Mayor drops sanctuary policy. Right decision. Strong!http://www.miamiherald.com/news/local/community/miami-dade/article128984759.html …";;;;"824767281146245120";https://twitter.com/realDonaldTrump/status/824767281146245120
;2017/01/26;10823;74564;"Will be interviewed by @SeanHannity on @FoxNews at 10:00pm tonight. Enjoy!";;@SeanHannity @FoxNews;;"824765229527605248";https://twitter.com/realDonaldTrump/status/824765229527605248
;2017/01/26;11504;73413;"Spoke at the Congressional @GOP Retreat in Philadelphia, PA. this afternoon w/ @VP, @SenateMajLdr, @SpeakerRyan. Thank you for your support!pic.twitter.com/DEv2DnksDc";;@GOP @VP @SenateMajLdr @SpeakerRyan;;"824698743630995457";https://twitter.com/realDonaldTrump/status/824698743630995457
;2017/01/26;28587;117387;"of jobs and companies lost. If Mexico is unwilling to pay for the badly needed wall, then it would be better to cancel the upcoming meeting.";;;;"824616644370714627";https://twitter.com/realDonaldTrump/status/824616644370714627
;2017/01/26;26360;108519;"The U.S. has a 60 billion dollar trade deficit with Mexico. It has been a one-sided deal from the beginning of NAFTA with massive numbers...";;;;"824615820391305216";https://twitter.com/realDonaldTrump/status/824615820391305216
;2017/01/26;28433;130211;"Ungrateful TRAITOR Chelsea Manning, who should never have been released from prison, is now calling President Obama a weak leader. Terrible!";;;;"824573698774601729";https://twitter.com/realDonaldTrump/status/824573698774601729
;2017/01/25;6604;54594;"Interview with David Muir of @ABC News in 10 minutes. Enjoy!";;@ABC;;"824448880993509376";https://twitter.com/realDonaldTrump/status/824448880993509376
;2017/01/25;6565;45561;"" @romoabcnews: . @DavidMuir first @POTUS interview since taking office. Tonight on @ABCWorldNews @ABC2020 tonight. pic.twitter.com/I4Vz1mRdBK"";;@romoabcnews @DavidMuir @POTUS @ABCWorldNews @ABC2020;;"824448156935081984";https://twitter.com/realDonaldTrump/status/824448156935081984
;2017/01/25;29629;154380;"As your President, I have no higher duty than to protect the lives of the American people.pic.twitter.com/o7YNUNwb8f";;;;"824440456813707265";https://twitter.com/realDonaldTrump/status/824440456813707265
;2017/01/25;23486;111443;"Beginning today, the United States of America gets back control of its borders. Full speech from today @DHSgov: http://bit.ly/2jSZomhDHS pic.twitter.com/48iZam5Fai";;@DHSgov;;"824407390674157568";https://twitter.com/realDonaldTrump/status/824407390674157568
;2017/01/25;12638;77057;"I will be interviewed by @DavidMuir tonight at 10 o'clock on @ABC. Will be my first interview from the White House. Enjoy!pic.twitter.com/okiZ8ZeDgz – at The White House";;@DavidMuir @ABC;;"824377804590563339";https://twitter.com/realDonaldTrump/status/824377804590563339
;2017/01/25;22069;134077;"I will be making my Supreme Court pick on Thursday of next week.Thank you!";;;;"824229586091307008";https://twitter.com/realDonaldTrump/status/824229586091307008
;2017/01/25;19162;108640;"even, those registered to vote who are dead (and many for a long time). Depending on results, we will strengthen up voting procedures!";;;;"824228768227217408";https://twitter.com/realDonaldTrump/status/824228768227217408
;2017/01/25;26387;131619;"I will be asking for a major investigation into VOTER FRAUD, including those registered to vote in two states, those who are illegal and....";;;;"824227824903090176";https://twitter.com/realDonaldTrump/status/824227824903090176
;2017/01/24;55122;196751;"Big day planned on NATIONAL SECURITY tomorrow. Among many other things, we will build the wall!";;;;"824083821889015809";https://twitter.com/realDonaldTrump/status/824083821889015809
;2017/01/24;57096;212361;"If Chicago doesn't fix the horrible "carnage" going on, 228 shootings in 2017 with 42 killings (up 24% from 2016), I will send in the Feds!";;;;"824080766288228352";https://twitter.com/realDonaldTrump/status/824080766288228352
;2017/01/24;32710;165010;"Congratulations to @FoxNews for being number one in inauguration ratings. They were many times higher than FAKE NEWS @CNN - public is smart!";;@FoxNews @CNN;;"824078417213747200";https://twitter.com/realDonaldTrump/status/824078417213747200
;2017/01/24;18964;102362;"Great meeting with Ford CEO Mark Fields and General Motors CEO Mary Barra at the @WhiteHouse today.pic.twitter.com/T0eIgO6LP8";;@WhiteHouse;;"824055927200423936";https://twitter.com/realDonaldTrump/status/824055927200423936
;2017/01/24;26119;133690;"Signing orders to move forward with the construction of the Keystone XL and Dakota Access pipelines in the Oval Office.pic.twitter.com/OErGmbBvYK – at The Oval Office";;;;"823950814163140609";https://twitter.com/realDonaldTrump/status/823950814163140609
;2017/01/24;16564;100878;"Great meeting with automobile industry leaders at the @WhiteHouse this morning. Together, we will #MAGA!pic.twitter.com/OXdiLOkGsZ";;@WhiteHouse;#MAGA;"823939422743830528";https://twitter.com/realDonaldTrump/status/823939422743830528
;2017/01/24;21225;110847;"A photo delivered yesterday that will be displayed in the upper/lower press hall. Thank you Abbas!pic.twitter.com/Uzp0ivvRp0";;;;"823937936056008704";https://twitter.com/realDonaldTrump/status/823937936056008704
;2017/01/24;24095;156745;"Will be meeting at 9:00 with top automobile executives concerning jobs in America. I want new plants to be built here for cars sold here!";;;;"823850781946343427";https://twitter.com/realDonaldTrump/status/823850781946343427
;2017/01/23;27166;180274;"Busy week planned with a heavy focus on jobs and national security. Top executives coming in at 9:00 A.M. to talk manufacturing in America.";;;;"823495059010109440";https://twitter.com/realDonaldTrump/status/823495059010109440
;2017/01/22;83032;395308;"Peaceful protests are a hallmark of our democracy. Even if I don't always agree, I recognize the rights of people to express their views.";;;;"823174199036542980";https://twitter.com/realDonaldTrump/status/823174199036542980
;2017/01/22;40790;220439;"Wow, television ratings just out: 31 million people watched the Inauguration, 11 million more than the very good ratings from 4 years ago!";;;;"823151124815507460";https://twitter.com/realDonaldTrump/status/823151124815507460
;2017/01/22;46640;216245;"Watched protests yesterday but was under the impression that we just had an election! Why didn't these people vote? Celebs hurt cause badly.";;;;"823150055418920960";https://twitter.com/realDonaldTrump/status/823150055418920960
;2017/01/22;17178;129228;"Had a great meeting at CIA Headquarters yesterday, packed house, paid great respect to Wall, long standing ovations, amazing people. WIN!";;;;"823146987117772800";https://twitter.com/realDonaldTrump/status/823146987117772800
;2017/01/21;23668;179606;"A fantastic day and evening in Washington D.C.Thank you to @FoxNews and so many other news outlets for the GREAT reviews of the speech!";;@FoxNews;;"822774162011910144";https://twitter.com/realDonaldTrump/status/822774162011910144
;2017/01/20;16838;93349;"TO ALL AMERICANS https://www.facebook.com/DonaldTrump/posts/10158510987625725 …";;;;"822507434396753921";https://twitter.com/realDonaldTrump/status/822507434396753921
;2017/01/20;14250;87588;"So to all Americans, in every city near and far, small and large, from mountain to mountain...https://www.facebook.com/DonaldTrump/posts/10158510880180725 …";;;;"822504142178500608";https://twitter.com/realDonaldTrump/status/822504142178500608
;2017/01/20;9310;59815;"It is time to remember that...https://www.facebook.com/DonaldTrump/posts/10158510858055725 …";;;;"822503558369181697";https://twitter.com/realDonaldTrump/status/822503558369181697
;2017/01/20;38779;163409;"We will follow two simple rules: BUY AMERICAN & HIRE AMERICAN! #InaugurationDay #MAGA";;;#InaugurationDay #MAGA;"822502887477673984";https://twitter.com/realDonaldTrump/status/822502887477673984
;2017/01/20;38222;176001;"We will bring back our jobs. We will bring back our borders. We will bring back our wealth - and we will bring back our dreams!";;;;"822502601304526848";https://twitter.com/realDonaldTrump/status/822502601304526848
;2017/01/20;35647;149880;"The forgotten men and women of our country will be forgotten no longer. From this moment on, it’s going to be #AmericaFirst";;;#AmericaFirst;"822502450007515137";https://twitter.com/realDonaldTrump/status/822502450007515137
;2017/01/20;61602;221087;"January 20th 2017, will be remembered as the day the people became the rulers of this nation again.";;;;"822502270503972872";https://twitter.com/realDonaldTrump/status/822502270503972872
;2017/01/20;43566;182579;"What truly matters is not which party controls our government, but whether our government is controlled by the people.";;;;"822502135233384448";https://twitter.com/realDonaldTrump/status/822502135233384448
;2017/01/20;18722;92351;"power from Washington, D.C. and giving it back to you, the American People. #InaugurationDay";;;#InaugurationDay;"822501939267141634";https://twitter.com/realDonaldTrump/status/822501939267141634
;2017/01/20;20496;111011;"Today we are not merely transferring power from one Administration to another, or from one party to another – but we are transferring...";;;;"822501803615014918";https://twitter.com/realDonaldTrump/status/822501803615014918
;2017/01/20;71840;271504;"It all begins today! I will see you at 11:00 A.M. for the swearing-in. THE MOVEMENT CONTINUES - THE WORK BEGINS!";;;;"822421390125043713";https://twitter.com/realDonaldTrump/status/822421390125043713
;2017/01/19;21128;114296;"Thank you for a wonderful evening in Washington, D.C. #Inaugurationpic.twitter.com/a6xpFQTHj5";;;#Inaugurationpic;"822298747421986828";https://twitter.com/realDonaldTrump/status/822298747421986828
;2017/01/19;34701;167806;"Thank you for joining us at the Lincoln Memorial tonight- a very special evening! Together, we are going to MAKE AMERICA GREAT AGAIN!pic.twitter.com/5d774OCx5o";;;;"822242449053614081";https://twitter.com/realDonaldTrump/status/822242449053614081
;2017/01/19;12476;67069;"Join me at 4pm over at the Lincoln Memorial with my family! #Inauguration2017https://twitter.com/trumpinaugural/status/822161617425203203 …";;;#Inauguration2017https;"822177206633955328";https://twitter.com/realDonaldTrump/status/822177206633955328
;2017/01/19;8523;66237;"Great Concert at 4:00 P.M. today at Lincoln Memorial. Enjoy!";;;;"822176438627536897";https://twitter.com/realDonaldTrump/status/822176438627536897
;2017/01/19;9019;57224;"On my way! #Inauguration2017https://twitter.com/trumpinaugural/status/822142520473829377 …";;;#Inauguration2017https;"822175285151928320";https://twitter.com/realDonaldTrump/status/822175285151928320
;2017/01/19;39507;161800;"the American people. I have no doubt that we will, together, MAKE AMERICA GREAT AGAIN!";;;;"822066653953458177";https://twitter.com/realDonaldTrump/status/822066653953458177
;2017/01/19;26106;151873;"Getting ready to leave for Washington, D.C. The journey begins and I will be working and fighting very hard to make it a great journey for..";;;;"822066132307808256";https://twitter.com/realDonaldTrump/status/822066132307808256
;2017/01/19;28198;126657;""It wasn't Donald Trump that divided this country, this country has been divided for a long time!" Stated today by Reverend Franklin Graham.";;;;"822064153426857984";https://twitter.com/realDonaldTrump/status/822064153426857984
;2017/01/18;16560;83242;"Thank you to our amazing Wounded Warriors for their service. It was an honor to be with them tonight in D.C. #Heroes https://www.facebook.com/DonaldTrump/posts/10158502102660725:0 …pic.twitter.com/wFXlWQ0XRr";;;#Heroes;"821930600290521089";https://twitter.com/realDonaldTrump/status/821930600290521089
;2017/01/18;10206;65613;"Great seeing @TheLeeGreenwood and Kimberly at this evenings VP dinner! #GodBlessTheUSApic.twitter.com/SxVmaWvOFT";;@TheLeeGreenwood;#GodBlessTheUSApic;"821898525432811520";https://twitter.com/realDonaldTrump/status/821898525432811520
;2017/01/18;21427;137432;"Looking forward to a speedy recovery for George and Barbara Bush, both hospitalized. Thank you for your wonderful letter!";;;;"821844875268255744";https://twitter.com/realDonaldTrump/status/821844875268255744
;2017/01/18;21415;109070;"Writing my inaugural address at the Winter White House, Mar-a-Lago, three weeks ago. Looking forward to Friday. #Inaugurationpic.twitter.com/S701FdTCQu";;;#Inaugurationpic;"821772494864580614";https://twitter.com/realDonaldTrump/status/821772494864580614
;2017/01/18;11517;66620;". @TheAlabamaBand was great last night in D.C. playing for 147 Diplomats and Ambassadors from countries around the world. Thanks Alabama!";;@TheAlabamaBand;;"821719763214880769";https://twitter.com/realDonaldTrump/status/821719763214880769
;2017/01/18;10762;58108;"No wonder the Today Show on biased @NBC is doing so badly compared to its glorious past. Little credibility!";;@NBC;;"821705440178348033";https://twitter.com/realDonaldTrump/status/821705440178348033
;2017/01/18;12126;58904;""Bayer AG has pledged to add U.S. jobs and investments after meeting with President-elect Donald Trump, the latest in a string..." @WSJ";;@WSJ;;"821703902940827648";https://twitter.com/realDonaldTrump/status/821703902940827648
;2017/01/18;11679;58605;"to the U.S., but had nothing to do with TRUMP, is more FAKE NEWS. Ask top CEO's of those companies for real facts. Came back because of me!";;;;"821699672687448064";https://twitter.com/realDonaldTrump/status/821699672687448064
;2017/01/18;10336;48836;"Totally biased @NBCNews went out of its way to say that the big announcement from Ford, G.M., Lockheed & others that jobs are coming back...";;@NBCNews;;"821697182235496450";https://twitter.com/realDonaldTrump/status/821697182235496450
;2017/01/18;5715;38028;"Will be interviewed by @ainsleyearhardt on @foxandfriends - Enjoy!";;@ainsleyearhardt @foxandfriends;;"821686928680583169";https://twitter.com/realDonaldTrump/status/821686928680583169
