username;date;retweets;favorites;text;geo;mentions;hashtags;id;permalink
;2017/01/17;21842;105446;"Thank you to General Motors and Walmart for starting the big jobs push back into the U.S.!";;;;"821415698278875137";https://twitter.com/realDonaldTrump/status/821415698278875137
;2017/01/17;11610;43503;""How Trump Won--And How The Media Missed It"http://www.breitbart.com/big-journalism/2017/01/16/media-covered-trump-without-listening-voters/ …";;;;"821410947864653825";https://twitter.com/realDonaldTrump/status/821410947864653825
;2017/01/17;14186;65073;""thought it would be hypocritical to attend Bush's swearing-in....he doesn't believe Bush is the true elected president." Sound familiar! WP";;;;"821369651968012288";https://twitter.com/realDonaldTrump/status/821369651968012288
;2017/01/17;16455;67869;"John Lewis said about my inauguration, "It will be the first one that I've missed." WRONG (or lie)! He boycotted Bush 43 also because he...";;;;"821368088935432196";https://twitter.com/realDonaldTrump/status/821368088935432196
;2017/01/17;10574;57022;"country and with the massive cost reductions I have negotiated on military purchases and more, I believe the people are seeing "big stuff."";;;;"821365569366671360";https://twitter.com/realDonaldTrump/status/821365569366671360
;2017/01/17;11193;59930;"With all of the jobs I am bringing back into the U.S. (even before taking office), with all of the new auto plants coming back into our.....";;;;"821364027506966532";https://twitter.com/realDonaldTrump/status/821364027506966532
;2017/01/17;24832;108187;"The same people who did the phony election polls, and were so wrong, are now doing approval rating polls. They are rigged just like before.";;;;"821344302651555840";https://twitter.com/realDonaldTrump/status/821344302651555840
;2017/01/17;25302;122234;"People are pouring into Washington in record numbers. Bikers for Trump are on their way. It will be a great Thursday, Friday and Saturday!";;;;"821342600322043905";https://twitter.com/realDonaldTrump/status/821342600322043905
;2017/01/16;8301;47611;"" @drgoodspine: @realDonaldTrump @Ivanka Trump is great, a woman with real character and class."";;@drgoodspine @realDonaldTrump @Ivanka;;"821177307708661761";https://twitter.com/realDonaldTrump/status/821177307708661761
;2017/01/16;11713;58992;"At 9:00 P.M. @CNN, of all places, is doing a Special Report on my daughter, Ivanka. Considering it is CNN, can't imagine it will be great!";;@CNN;;"821172595869577220";https://twitter.com/realDonaldTrump/status/821172595869577220
;2017/01/16;12691;62031;"" @levisteveholt: @realDonaldTrump I appreciate your use of Twitter to keep us informed and maintain transparency." Very dishonest media!";;@levisteveholt @realDonaldTrump;;"821170750983995392";https://twitter.com/realDonaldTrump/status/821170750983995392
;2017/01/16;38523;163274;"Celebrate Martin Luther King Day and all of the many wonderful things that he stood for. Honor him for being the great man that he was!";;;;"820992721120854016";https://twitter.com/realDonaldTrump/status/820992721120854016
;2017/01/15;14215;59817;"much worse - just look at Syria (red line), Crimea, Ukraine and the build-up of Russian nukes. Not good! Was this the leaker of Fake News?";;;;"820789938887294977";https://twitter.com/realDonaldTrump/status/820789938887294977
;2017/01/15;11613;46049;". @FoxNews "Outgoing CIA Chief, John Brennan, blasts Pres-Elect Trump on Russia threat. Does not fully understand." Oh really, couldn't do...";;@FoxNews;;"820786730257285120";https://twitter.com/realDonaldTrump/status/820786730257285120
;2017/01/15;19173;86043;". @NBCNews is bad but Saturday Night Live is the worst of NBC. Not funny, cast is terrible, always a complete hit job. Really bad television!";;@NBCNews;;"820764134857969666";https://twitter.com/realDonaldTrump/status/820764134857969666
;2017/01/15;15551;71435;"about that...Those Intelligence chiefs made a mistake here, & when people make mistakes, they should APOLOGIZE." Media should also apologize";;;;"820725491812487170";https://twitter.com/realDonaldTrump/status/820725491812487170
;2017/01/15;16317;70696;"Thank you to Bob Woodward who said, "That is a garbage document...it never should have been presented...Trump's right to be upset (angry)...";;;;"820723387995717632";https://twitter.com/realDonaldTrump/status/820723387995717632
;2017/01/15;29998;129483;"For many years our country has been divided, angry and untrusting. Many say it will never change, the hatred is too deep. IT WILL CHANGE!!!!";;;;"820707210565132288";https://twitter.com/realDonaldTrump/status/820707210565132288
;2017/01/15;15435;79445;"will only get higher. Car companies and others, if they want to do business in our country, have to start making things here again. WIN!";;;;"820632299037409280";https://twitter.com/realDonaldTrump/status/820632299037409280
;2017/01/15;16387;80294;"The Democrats are most angry that so many Obama Democrats voted for me. With all of the jobs I am bringing back to our Nation, that number..";;;;"820631495660408835";https://twitter.com/realDonaldTrump/status/820631495660408835
;2017/01/14;25564;122956;"Inauguration Day is turning out to be even bigger than expected. January 20th, Washington D.C. Have fun!";;;;"820450166331346944";https://twitter.com/realDonaldTrump/status/820450166331346944
;2017/01/14;22417;96831;"Congressman John Lewis should finally focus on the burning and crime infested inner-cities of the U.S. I can use all the help I can get!";;;;"820425770925338624";https://twitter.com/realDonaldTrump/status/820425770925338624
;2017/01/14;19327;69581;"INTELLIGENCE INSIDERS NOW CLAIM THE TRUMP DOSSIER IS "A COMPLETE FRAUD!" @OANN";;@OANN;;"820257714362314753";https://twitter.com/realDonaldTrump/status/820257714362314753
;2017/01/14;16855;78135;"mention crime infested) rather than falsely complaining about the election results. All talk, talk, talk - no action or results. Sad!";;;;"820255947956383744";https://twitter.com/realDonaldTrump/status/820255947956383744
;2017/01/14;21377;89378;"Congressman John Lewis should spend more time on fixing and helping his district, which is in horrible shape and falling apart (not to......";;;;"820251730407473153";https://twitter.com/realDonaldTrump/status/820251730407473153
;2017/01/13;21508;110864;"A beautiful funeral today for a real NYC hero, Detective Steven McDonald. Our law enforcement community has my complete and total support.";;;;"819962894616064001";https://twitter.com/realDonaldTrump/status/819962894616064001
;2017/01/13;30559;131564;"The "Unaffordable" Care Act will soon be history!";;;;"819869953692155904";https://twitter.com/realDonaldTrump/status/819869953692155904
;2017/01/13;13641;68324;"have been allowed to run - guilty as hell. They were VERY nice to her. She lost because she campaigned in the wrong states - no enthusiasm!";;;;"819868066364461058";https://twitter.com/realDonaldTrump/status/819868066364461058
;2017/01/13;12944;58946;"What are Hillary Clinton's people complaining about with respect to the F.B.I. Based on the information they had she should never.....";;;;"819867246352801792";https://twitter.com/realDonaldTrump/status/819867246352801792
;2017/01/13;12158;54609;"released by "Intelligence" even knowing there is no proof, and never will be. My people will have a full report on hacking within 90 days!";;;;"819865802849587200";https://twitter.com/realDonaldTrump/status/819865802849587200
;2017/01/13;12648;55454;"Totally made up facts by sleazebag political operatives, both Democrats and Republicans - FAKE NEWS! Russia says nothing exists. Probably...";;;;"819864373988573184";https://twitter.com/realDonaldTrump/status/819864373988573184
;2017/01/13;17531;73644;"It now turns out that the phony allegations against me were put together by my political opponents and a failed spy afraid of being sued....";;;;"819863039902097408";https://twitter.com/realDonaldTrump/status/819863039902097408
;2017/01/13;16901;82072;"All of my Cabinet nominee are looking good and doing a great job. I want them to be themselves and express their own thoughts, not mine!";;;;"819858926455967744";https://twitter.com/realDonaldTrump/status/819858926455967744
;2017/01/12;19632;87226;"Congrats to the Senate for taking the first step to #RepealObamacare- now it's onto the House! – at Trump Tower";;;#RepealObamacare;"819600124133474307";https://twitter.com/realDonaldTrump/status/819600124133474307
;2017/01/12;35922;129626;". @CNN is in a total meltdown with their FAKE NEWS because their ratings are tanking since election and their credibility will soon be gone!";;@CNN;;"819550083742109696";https://twitter.com/realDonaldTrump/status/819550083742109696
;2017/01/12;21782;93909;"Thank you to Linda Bean of L.L.Bean for your great support and courage. People will support you even more now. Buy L.L.Bean. @LBPerfectMaine";;@LBPerfectMaine;;"819541997325316096";https://twitter.com/realDonaldTrump/status/819541997325316096
;2017/01/12;17415;72799;"James Clapper called me yesterday to denounce the false and fictitious report that was illegally circulated. Made up, phony facts.Too bad!";;;;"819520238446411777";https://twitter.com/realDonaldTrump/status/819520238446411777
;2017/01/11;9526;53059;"" @zhu_amy3: @realDonaldTrump It's Morning in America again!!! Thank you President-Elect Donald Trump!!! So proud of you!!!!" THANKS!";;@zhu_amy3 @realDonaldTrump;;"819399723924803585";https://twitter.com/realDonaldTrump/status/819399723924803585
;2017/01/11;28579;119462;"We had a great News Conference at Trump Tower today. A couple of FAKE NEWS organizations were there but the people truly get what's going on";;;;"819393877174087682";https://twitter.com/realDonaldTrump/status/819393877174087682
;2017/01/11;32305;110093;"Intelligence agencies should never have allowed this fake news to "leak" into the public. One last shot at me.Are we living in Nazi Germany?";;;;"819164172781060096";https://twitter.com/realDonaldTrump/status/819164172781060096
;2017/01/11;29090;116884;"I win an election easily, a great "movement" is verified, and crooked opponents try to belittle our victory with FAKE NEWS. A sorry state!";;;;"819162968592183298";https://twitter.com/realDonaldTrump/status/819162968592183298
;2017/01/11;23744;86889;"Russia has never tried to use leverage over me. I HAVE NOTHING TO DO WITH RUSSIA - NO DEALS, NO LOANS, NO NOTHING!";;;;"819159806489591809";https://twitter.com/realDonaldTrump/status/819159806489591809
;2017/01/11;17865;67352;"Russia just said the unverified report paid for by political opponents is "A COMPLETE AND TOTAL FABRICATION, UTTER NONSENSE." Very unfair!";;;;"819155311793700865";https://twitter.com/realDonaldTrump/status/819155311793700865
;2017/01/10;15275;46124;"'BuzzFeed Runs Unverifiable Trump-Russia Claims' #FakeNewshttp://www.lifezette.com/polizette/buzzfeed-runs-error-laden-unverifiable-trump-russia-claim/ …";;;#FakeNewshttp;"819000924207251456";https://twitter.com/realDonaldTrump/status/819000924207251456
;2017/01/10;29857;95731;"FAKE NEWS - A TOTAL POLITICAL WITCH HUNT!";;;;"818990655418617856";https://twitter.com/realDonaldTrump/status/818990655418617856
;2017/01/10;10666;44090;"'Trump Helps Lift Small Business Confidence to 12-Yr. High' http://bit.ly/2j5gad2FOXBusiness …pic.twitter.com/CWAvJ4fRdx – at Trump Tower";;;;"818948254943604736";https://twitter.com/realDonaldTrump/status/818948254943604736
;2017/01/10;11989;50401;"'Small business optimism soars after Trump election'http://www.cnbc.com/2017/01/10/small-business-optimism-soars-after-trump-election.html … – at Trump Tower";;;;"818922995980845056";https://twitter.com/realDonaldTrump/status/818922995980845056
;2017/01/10;11326;42643;"'U.S. Small-Business Optimism Index Surges by Most Since 1980'https://www.bloomberg.com/news/articles/2017-01-10/u-s-small-business-optimism-index-surges-by-most-since-1980 …";;;;"818841421364989952";https://twitter.com/realDonaldTrump/status/818841421364989952
;2017/01/09;23507;94248;"Thank you to all of the men and women who protect & serve our communities 24/7/365! #LawEnforcementAppreciationDay https://www.facebook.com/DonaldTrump/posts/10158443103370725:0 …pic.twitter.com/ySRNaF9Nvz";;;#LawEnforcementAppreciationDay;"818643528905621504";https://twitter.com/realDonaldTrump/status/818643528905621504
;2017/01/09;25396;125260;"An old picture with Nancy and Ronald Reagan.pic.twitter.com/8kvQ1PzPAf";;;;"818586286034485250";https://twitter.com/realDonaldTrump/status/818586286034485250
;2017/01/09;23776;111103;"Ford said last week that it will expand in Michigan and U.S. instead of building a BILLION dollar plant in Mexico. Thank you Ford & Fiat C!";;;;"818461467766824961";https://twitter.com/realDonaldTrump/status/818461467766824961
;2017/01/09;23698;102289;"It's finally happening - Fiat Chrysler just announced plans to invest $1BILLION in Michigan and Ohio plants, adding 2000 jobs. This after...";;;;"818460862675558400";https://twitter.com/realDonaldTrump/status/818460862675558400
;2017/01/09;16357;70279;""groveling" when he totally changed a 16 year old story that he had written in order to make me look bad. Just more very dishonest media!";;;;"818422930157830144";https://twitter.com/realDonaldTrump/status/818422930157830144
;2017/01/09;21771;85526;"Hillary flunky who lost big. For the 100th time, I never "mocked" a disabled reporter (would never do that) but simply showed him.......";;;;"818421066859167746";https://twitter.com/realDonaldTrump/status/818421066859167746
;2017/01/09;38247;125192;"Meryl Streep, one of the most over-rated actresses in Hollywood, doesn't know me but attacked last night at the Golden Globes. She is a.....";;;;"818419002548568064";https://twitter.com/realDonaldTrump/status/818419002548568064
;2017/01/09;7411;38324;"Rupert Murdoch is a great guy who likes me much better as a very successful candidate than he ever did as a very successful developer!";;;;"818416446527172608";https://twitter.com/realDonaldTrump/status/818416446527172608
;2017/01/08;19476;79352;"Dishonest media says Mexico won't be paying for the wall if they pay a little later so the wall can be built more quickly. Media is fake!";;;;"818307689323368448";https://twitter.com/realDonaldTrump/status/818307689323368448
;2017/01/08;20902;75227;"Before I, or anyone, saw the classified and/or highly confidential hacking intelligence report, it was leaked out to @NBCNews. So serious!";;@NBCNews;;"818169485169410048";https://twitter.com/realDonaldTrump/status/818169485169410048
;2017/01/08;18257;59145;"Kellyanne Conway went to @MeetThePress this morning for an interview with @chucktodd. Dishonest media cut out 9 of her 10 minutes. Terrible!";;@MeetThePress @chucktodd;;"818136714396975104";https://twitter.com/realDonaldTrump/status/818136714396975104
;2017/01/08;8156;35658;"" @FoxNews: "We certainly don’t want intelligence interfering with politics and we don’t want politics interfe… https://twitter.com/i/web/status/817542630682796033 …"";;@FoxNews;;"818134981344165888";https://twitter.com/realDonaldTrump/status/818134981344165888
;2017/01/08;5497;29175;"" @KellyannePolls: Welcome to President and Mrs. Bush. http://thehill.com/blogs/blog-briefing-room/news/312525-george-w-bush-to-attend-trumps-inauguration#.WGvveimVlvw.twitter …" Very nice!";;@KellyannePolls;#;"818134360712953858";https://twitter.com/realDonaldTrump/status/818134360712953858
;2017/01/07;17543;86514;"I look very much forward to meeting Prime Minister Theresa May in Washington in the Spring. Britain, a longtime U.S. ally, is very special!";;;;"817915516018892805";https://twitter.com/realDonaldTrump/status/817915516018892805
;2017/01/07;12343;66200;"Congratulation to Jane Timken on her major upset victory in becoming the Ohio Republican Party Chair. Jane is a loyal Trump supporter & star";;;;"817882028272128001";https://twitter.com/realDonaldTrump/status/817882028272128001
;2017/01/07;16571;71134;"both countries will, perhaps, work together to solve some of the many great and pressing problems and issues of the WORLD!";;;;"817753083707015168";https://twitter.com/realDonaldTrump/status/817753083707015168
;2017/01/07;18935;79511;"have enough problems around the world without yet another one. When I am President, Russia will respect us far more than they do now and....";;;;"817750330196819968";https://twitter.com/realDonaldTrump/status/817750330196819968
;2017/01/07;29888;102460;"Having a good relationship with Russia is a good thing, not a bad thing. Only "stupid" people, or fools, would think that it is bad! We.....";;;;"817748207694467072";https://twitter.com/realDonaldTrump/status/817748207694467072
;2017/01/07;20061;85297;"Only reason the hacking of the poorly defended DNC is discussed is that the loss by the Dems was so big that they are totally embarrassed!";;;;"817703208567078913";https://twitter.com/realDonaldTrump/status/817703208567078913
;2017/01/07;18565;70117;"Intelligence stated very strongly there was absolutely no evidence that hacking affected the election results. Voting machines not touched!";;;;"817701436096126977";https://twitter.com/realDonaldTrump/status/817701436096126977
;2017/01/06;16710;68825;"Gross negligence by the Democratic National Committee allowed hacking to take place.The Republican National Committee had strong defense!";;;;"817579925771341825";https://twitter.com/realDonaldTrump/status/817579925771341825
;2017/01/06;7855;48975;"Happy Birthday @EricTrump! https://www.facebook.com/DonaldTrump/posts/10158426170160725:0 …";;@EricTrump;;"817522928862502913";https://twitter.com/realDonaldTrump/status/817522928862502913
;2017/01/06;22560;97391;"Monitoring the terrible situation in Florida. Just spoke to Governor Scott. Thoughts and prayers for all. Stay safe!";;;;"817453219613917185";https://twitter.com/realDonaldTrump/status/817453219613917185
;2017/01/06;26230;93795;"I am asking the chairs of the House and Senate committees to investigate top secret intelligence shared with NBC prior to me seeing it.";;;;"817413321058029568";https://twitter.com/realDonaldTrump/status/817413321058029568
;2017/01/06;6570;35497;"Anna Wintour came to my office at Trump Tower to ask me to meet with the editors of Conde Nast & Steven Newhouse, a friend. Will go this AM.";;;;"817374875962769408";https://twitter.com/realDonaldTrump/status/817374875962769408
;2017/01/06;8964;41728;"being a movie star-and that was season 1 compared to season 14. Now compare him to my season 1. But who cares, he supported Kasich & Hillary";;;;"817350726800306177";https://twitter.com/realDonaldTrump/status/817350726800306177
;2017/01/06;9508;39681;"Wow, the ratings are in and Arnold Schwarzenegger got "swamped" (or destroyed) by comparison to the ratings machine, DJT. So much for....";;;;"817348644647108609";https://twitter.com/realDonaldTrump/status/817348644647108609
;2017/01/06;14619;67149;"Hopefully, all supporters, and those who want to MAKE AMERICA GREAT AGAIN, will go to D.C. on January 20th. It will be a GREAT SHOW!";;;;"817341196251070464";https://twitter.com/realDonaldTrump/status/817341196251070464
;2017/01/06;8403;42246;"and knew they were in big trouble - which is why they cancelled their big fireworks at the last minute.THEY SAW A MOVEMENT LIKE NEVER BEFORE";;;;"817336355193753600";https://twitter.com/realDonaldTrump/status/817336355193753600
;2017/01/06;10740;52193;"Hillary and the Dems were never going to beat the PASSION of my voters. They saw what was happening in the last two weeks before the......";;;;"817334794958807042";https://twitter.com/realDonaldTrump/status/817334794958807042
;2017/01/06;19438;66854;"The dishonest media does not report that any money spent on building the Great Wall (for sake of speed), will be paid back by Mexico later!";;;;"817329823374831617";https://twitter.com/realDonaldTrump/status/817329823374831617
;2017/01/05;20962;71999;"So how and why are they so sure about hacking if they never even requested an examination of the computer servers? What is going on?";;;;"817168818539757568";https://twitter.com/realDonaldTrump/status/817168818539757568
;2017/01/05;19017;58032;"The Democratic National Committee would not allow the FBI to study or see its computer info after it was supposedly hacked by Russia......";;;;"817166353266262016";https://twitter.com/realDonaldTrump/status/817166353266262016
;2017/01/05;20899;69074;"How did NBC get "an exclusive look into the top secret report he (Obama) was presented?" Who gave them this report and why? Politics!";;;;"817164923843280896";https://twitter.com/realDonaldTrump/status/817164923843280896
;2017/01/05;32729;109450;"Toyota Motor said will build a new plant in Baja, Mexico, to build Corolla cars for U.S. NO WAY! Build plant in U.S. or pay big border tax.";;;;"817071792711942145";https://twitter.com/realDonaldTrump/status/817071792711942145
;2017/01/05;15571;68854;"to make up their own minds as to the truth. The media lies to make it look like I am against "Intelligence" when in fact I am a big fan!";;;;"817004210529116160";https://twitter.com/realDonaldTrump/status/817004210529116160
;2017/01/05;16558;62936;"The dishonest media likes saying that I am in Agreement with Julian Assange - wrong. I simply state what he states, it is for the people....";;;;"816999062562107392";https://twitter.com/realDonaldTrump/status/816999062562107392
;2017/01/05;16795;79322;"...time for Republicans & Democrats to get together and come up with a healthcare plan that really works - much less expensive & FAR BETTER!";;;;"816979231217483776";https://twitter.com/realDonaldTrump/status/816979231217483776
;2017/01/05;12455;52490;"...do the typical political thing and BLAME. The fact is ObamaCare was a lie from the beginning."Keep you doctor, keep your plan!" It is....";;;;"816977937731878912";https://twitter.com/realDonaldTrump/status/816977937731878912
;2017/01/05;13292;54118;"The Democrats, lead by head clown Chuck Schumer, know how bad ObamaCare is and what a mess they are in. Instead of working to fix it, they..";;;;"816977032433270784";https://twitter.com/realDonaldTrump/status/816977032433270784
;2017/01/04;17357;80658;"Jackie Evancho's album sales have skyrocketed after announcing her Inauguration performance.Some people just don't understand the "Movement"";;;;"816718880731234304";https://twitter.com/realDonaldTrump/status/816718880731234304
;2017/01/04;13778;54963;"massive increases of ObamaCare will take place this year and Dems are to blame for the mess. It will fall of its own weight - be careful!";;;;"816652088662958082";https://twitter.com/realDonaldTrump/status/816652088662958082
;2017/01/04;11394;47171;"like the 116% hike in Arizona. Also, deductibles are so high that it is practically useless. Don't let the Schumer clowns out of this web...";;;;"816645831659061248";https://twitter.com/realDonaldTrump/status/816645831659061248
;2017/01/04;11301;46886;"Republicans must be careful in that the Dems own the failed ObamaCare disaster, with its poor coverage and massive premium increases......";;;;"816644321768312832";https://twitter.com/realDonaldTrump/status/816644321768312832
;2017/01/04;10915;47311;"things they did and said (like giving the questions to the debate to H). A total double standard! Media, as usual, gave them a pass.";;;;"816638194468999169";https://twitter.com/realDonaldTrump/status/816638194468999169
;2017/01/04;10420;43303;"Somebody hacked the DNC but why did they not have "hacking defense" like the RNC has and why have they not responded to the terrible......";;;;"816637064708030464";https://twitter.com/realDonaldTrump/status/816637064708030464
;2017/01/04;19880;87808;"Thank you to Ford for scrapping a new plant in Mexico and creating 700 new jobs in the U.S. This is just the beginning - much more to follow";;;;"816635078067490816";https://twitter.com/realDonaldTrump/status/816635078067490816
;2017/01/04;15025;42764;"" @FoxNews: Julian Assange on U.S. media coverage: “It’s very dishonest.” #Hannity pic.twitter.com/ADcPRQifH9" More dishonest than anyone knows";;@FoxNews;#Hannity;"816632793862176769";https://twitter.com/realDonaldTrump/status/816632793862176769
;2017/01/04;18400;62005;"Julian Assange said "a 14 year old could have hacked Podesta" - why was DNC so careless? Also said Russians did not give him the info!";;;;"816620855958601730";https://twitter.com/realDonaldTrump/status/816620855958601730
;2017/01/03;23813;81339;"The "Intelligence" briefing on so-called "Russian hacking" was delayed until Friday, perhaps more time needed to build a case. Very strange!";;;;"816452807024840704";https://twitter.com/realDonaldTrump/status/816452807024840704
;2017/01/03;14881;58728;"I will be having a general news conference on JANUARY ELEVENTH in N.Y.C. Thank you.";;;;"816433590892429312";https://twitter.com/realDonaldTrump/status/816433590892429312
;2017/01/03;14271;53943;""Trump is already delivering the jobs he promised America"http://nypost.com/2017/01/01/trump-is-already-delivering-the-jobs-he-promised-america/ … – at Trump Tower";;;;"816354639859871745";https://twitter.com/realDonaldTrump/status/816354639859871745
;2017/01/03;20971;83992;"There should be no further releases from Gitmo. These are extremely dangerous people and should not be allowed back onto the battlefield.";;;;"816333480409833472";https://twitter.com/realDonaldTrump/status/816333480409833472
;2017/01/03;12895;55431;"Instead of driving jobs and wealth away, AMERICA will become the world's great magnet for INNOVATION & JOB CREATION. https://instagram.com/p/BOz0xbXD74D/  – at Trump Tower";;;;"816328314759606272";https://twitter.com/realDonaldTrump/status/816328314759606272
